뉴스 식별자,일자,언론사,제목,특성추출(가중치순 상위 50개),URL,대분류,중분류,소분류,세부항목 예시,뉴스 일반 표현,유사도
1100301.20221024,20221024,내일신문,2023 고교선택의 바른 길 고교선택 학생개별검사지 포함,고등학교 일반고 자사고 면학분위기 고교생활 명문대 일주일 학생들 고등학생 고교선정 희망진로 서울시 교육과정 선택과목 2단계 학교분위기 김지민 지민 리더스 김지민영어학원 서울특별시 노원구 선생님 2개,http://www.naeil.com/news_view/?id_art=439272,교육활동지원,교무업무운영,교무학사운영,입학전형,"학교 입학전형, 입학전형 관리, 전형 일정 공고",0.6328011751174927
1100501.202210191,20221019,문화일보,VR 학습놀이터로 탄소저감 실천법 교육 LX판토스 취약계층 아동 환경교육 지원,판토스 서울 학습놀이터 실천법 lx판토스 종로구 김인호 김성욱 국가환경교육센터장 최운정 협약식 vr lx 오른쪽 본부장 가상현실 국가환경교육센터 센터장 cho 지원 교육 환경 아동 각종 협약 기회 국가 사진 접목 왼쪽 예정 회사 활동 업무 사회,http://www.munhwa.com/news/view.html?no=2022101901039907301002,기본적교육활동,교과활동,교과활동지원,학습준비물지원,"정보 수업, 코딩 교육, 소프트웨어 교육, 디지털 리터러시",0.6326492428779602
1101001.202210031,20221003,한겨레,실내마스크 해제는 언제 복지부 차관 빠르면 내년 3월,이기일 전문가 유치원 중하순 서울아산병원 간호사 2차 한국방송 코로나19 접촉면회 토착화 상반기 유전자 음식물,http://www.hani.co.kr/arti/society/health/1061137.html,학생복지/교육격차해소,보건관리,학생및교직원보건안전관리,감염병예방관리,"코로나19 대응, 학교 방역, 전염병 예방교육, 감염병 관리 지침",0.6326421499252319
1100901.202210241,20221024,중앙일보,서경대학교 2022년 대학혁신지원사업 글로벌 역량 강화 프로그램 워크숍 개최,스타트업 이석형 devops 인턴십 교직원 학생들 네트워킹 서울 실무역량 서경대 서경대학교,https://www.joongang.co.kr/article/25111725,선택적교육활동,기타선택적교육활동,기타선택적교육운영,대학교육실습생운영,"교육실습 운영, 예비교사 실습, 대학교 연계 실습",0.6324933171272278
1100301.202210121,20221012,내일신문,수시경쟁률 선호도학과 2023 선호도 학과 수시 경쟁률로 보니,경쟁률 중앙대 학생부 전년도 건국대 생명과학 선호도 합격선 연세대 한양대 성균관대 이화여대,http://www.naeil.com/news_view/?id_art=438106,교육활동지원,교무업무운영,교무학사운영,입학전형,"학교 입학전형, 입학전형 관리, 전형 일정 공고",0.6322031617164612
1100801.202210122,20221012,조선일보,응급실 환자 이젠 코로나 검사 진료부터 받는다,확진자 응급실 코로나 재감염 2회 53만 의료진 8개월 중대본 조규홍,https://www.chosun.com/national/welfare-medical/2022/10/12/YC7EBQFYEZBCRIMYTUIK32EVQ4/?utm_source=bigkinds&utm_medium=original&utm_campaign=news,학생복지/교육격차해소,보건관리,학생및교직원보건안전관리,감염병예방관리,"코로나19 대응, 학교 방역, 전염병 예방교육, 감염병 관리 지침",0.6320461630821228
1100901.202210061,20221006,중앙일보,서경대학교 2023 2025 정부초청 외국인 장학생 GKS 수학대학 학사 석 박사 신규 선정,서경대학교 외국인 한국어 장학생 국립국제교육원 서경대 대학원 교육부 gks 등록금 이수 수학대학 최영철,https://www.joongang.co.kr/article/25107339,학생복지/교육격차해소,학생복지,학생장학금운영,학생장학금지원,"장학금 지급, 학생 장학 제도, 교육비 지원, 장학생 선발 공고",0.6316750645637512
1101001.202210121,20221012,한겨레,응급실 대기줄 준다 선 진료 뒤 필요할 때만 후 코로나 검사,응급실 코로나19 확진자 감염병 중대본 겨울철 의심환자 일주일 조규홍 1차장 코로나 명대 인플루엔자 3만 예방접종 대기줄 의료진,http://www.hani.co.kr/arti/society/health/1062287.html,학생복지/교육격차해소,보건관리,학생및교직원보건안전관리,감염병예방관리,"코로나19 대응, 학교 방역, 전염병 예방교육, 감염병 관리 지침",0.6315147280693054
1100751.202210181,20221018,아시아투데이,교육부 찾아가는 양성평등교육 실시 초중고 105곳 대상,교육부 양성평등교육 학생들 고등학교 중학교 장상윤 박아람 아시아투데이 교육청 지능화 고도화 시도교육청별 성폭행 자료집 성폭력 성범죄 디지털 교육 대상 학생 예방 시행 학교 역량 양성 절차 자체적 구체적 시도,https://www.asiatoday.co.kr/view.php?key=20221018010008291,선택적교육활동,기타선택적교육활동,다문화교육운영,다문화교육중점학교,"다문화중점학교, 다문화교육 시범학교, 다문화 특화 교육기관",0.6313525438308716
1100701.202210011,20221001,세계일보,교실서 흉기로 친구 위협한 중학생 경찰 내사,중학교 a군 b군 서울 학부모 지원청 위원회 노원구 타박상 서울북부교육지원청 노원경찰서 뉴시스 경찰관 중학생 서울시교육청 경찰 흉기 교실 학교 범행 폭력 폭행 위협 조사 경위 내사 한편 심의,http://www.segye.com/content/html/2022/10/01/20221001506107.html,교육활동지원,생활지도운영,학교폭력예방,학교폭력전담기구운영,"학교폭력 전담기구, 학교폭력대응 조직, 학교폭력대책위 운영",0.6308189630508423
1100701.20221025,20221025,세계일보,충청소방학교 전국 최초 전문교육 융합 교육훈련 운영,충청소방학교 교육훈련 대원 전술드론 충남 김푸른 보령소방서 충남도 소방본부 저수지 해수욕장 수난구조 산악지역 수중탐색장비 소방교 항공대 현장지휘소 전문가들 3주 대원들 드론 참가자 이해도 전문가 참가자들 산악항공,http://www.segye.com/content/html/2022/10/24/20221024512143.html,교육활동지원,생활지도운영,학생안전교육,소방훈련,"학교 소방훈련, 화재 대피 훈련, 소방 안전 교육",0.6303752064704895
1101101.202210281,20221028,한국일보,중대본 코로나19 유행 반등 조짐 중증화율 상승,코로나 중대본 확진자 코로나19 3만 조규홍 중증화 감염병 경북 치명률 오미크론 3종 사전예약,https://hankookilbo.com/News/Read/A2022102809000005657,학생복지/교육격차해소,보건관리,학생및교직원보건안전관리,감염병예방관리,"코로나19 대응, 학교 방역, 전염병 예방교육, 감염병 관리 지침",0.6303178668022156
1100101.202210262,20221026,경향신문,CJ올리브네트웍스 IT 관련 교육격차 해소 위해 SW창의캠프 운영,cj sw 올리브네트웍스 코로나19 학생들 cj올리브네트웍스 머신러닝 신기술 임직원 디지털전환 정보기술 창의융합인재교육 레고 전라 임직원들 제주 중학생 중소기업 다문화 계열사 강원 서울 중요성 교육과정 중소기업들 사각지대,https://www.khan.co.kr/ePR/article/202210262009025,기본적교육활동,교과활동,정보교과활동,교육용SW확충,"정보 수업, 코딩 교육, 소프트웨어 교육, 디지털 리터러시",0.6300536394119263
1101101.202210231,20221023,한국일보,취업준비 대학생 10명 중 7명 구직단념,전경련 일자리 대학생 공기업 구직활동 취업준비기간 응답자 대기업 7명 취업준비 취업인식 청년들 추광호,https://hankookilbo.com/News/Read/A2022102312160005483,선택적교육활동,직업교육,직업교육운영,취업역량강화지원,"취업 지원, 학생 취업역량 강화, 취업 연계 교육",0.629883885383606
1100201.202210201,20221020,국민일보,경기도교육청 과밀학급 해소 종합대책 추진,지자체 교육부 과밀학급 도교육청 유관기관 류영신 종합대책 경기도교육청 증축비 보정계수 특례법,https://news.kmib.co.kr/article/view.asp?arcid=0017587234&code=61121111&cp=kd,교육활동지원,연구학교운영,연구학교운영,시도교육청지정,"교육청 지정 연구학교, 시도교육청 시범학교",0.6296741962432861
1100501.202210131,20221013,문화일보,초중고 학력평가 전면 확대의 당위성,학력평가 건강검진 맞춤형 학생들 강원 부산 인성교육 안전망 전문가 부산교대 김정래 경쟁시대 창의성 교육평가 변별력 윤석열 전문성,http://www.munhwa.com/news/view.html?no=2022101301073111000001,교육활동지원,교무업무운영,교무학사운영,교육과정평가,"교육과정 평가, 학교 운영 평가, 수업 평가",0.6294468641281128
1100201.202210021,20221002,국민일보,중증장애아동돌봄서비스 확대 연 960시간,주소지 제주 장애아가족양육지원사업 중증장애아동가족 장애아 제주도장애인부모회 585만 기준중위소득 4인 주민센터 사단법인제주도장애인부모회 전문자격 중증장애아동 이용자 제주도 지원시간 돌봄 지원서비스 시간 서비스 지원 확대 이용 기준 사업 가족 가정 주민 신청 부담 중증 아동 방문 안팎 돌보미 미만 연간,https://news.kmib.co.kr/article/view.asp?arcid=0017529998&code=61121111&cp=kd,학생복지/교육격차해소,학생복지,교육복지우선,교육복지사인건비,"교육복지사 채용, 교육복지 인력 확충, 취약계층 교육 지원",0.6292762160301208
1100611.20221012,20221012,서울신문,교육격차 해소 vs 학생인권 침해 일선 현장 벌써 충돌,전교조 진단평가 강원 일제고사 교육청 학력평가 교육감 강원교육청 전북교육청 충북교육청 관계자 충북 전북 강원도,http://www.seoul.co.kr/news/newsView.php?id=20221012002013,교육활동지원,교무업무운영,교무학사운영,교육과정평가,"교육과정 평가, 학교 운영 평가, 수업 평가",0.6289612054824829
1100201.20221003,20221003,국민일보,이주호 저서에서 고교학점제 정착 교육격차 해소 강조,후보자 고교학점제 대입제도 ai 미달자 교육부 문제점 사회계층 이주호 전주교대 정영식 이화여대 부총리 정제영 바칼로레아 입학사정관제 학생부 사정관 학생부종합전형 국정과제 문재인정부 경쟁적 출근길 문재인 보완점,https://news.kmib.co.kr/article/view.asp?arcid=0924266484&code=11151100,학생복지/교육격차해소,교육격차해소,기타교육격차해소지원,기타교육격차해소지원,"교육격차 해소, 교육복지 사각지대, 취약지역 교육 지원",0.6288214325904846
1100301.202210141,20221014,내일신문,대화고등학교 최승후 교사의 입시 칼럼 이제는 수시 면접을 준비해야 할 때3,지원자 모집단위 코로나19 핸드폰 감염병 제시문 시사이슈 자동차 숙명여대 사고력 기록부 학교생활기록부 전공소양 고등학교 최승후 반려동물,http://www.naeil.com/news_view/?id_art=438524,교육활동지원,교무업무운영,교무학사운영,입학전형,"학교 입학전형, 입학전형 관리, 전형 일정 공고",0.6288212537765503
1100201.202210051,20221005,국민일보,코로나 독감 동시 유행 대비 무료 예방접종 실시,예방접종 서울 송파구 소아과 트윈데믹 임산부 독감접종 보건소 안내문 코로나19 코로나 접종 독감 무료 일선 유행 동시 예고 기관 의료 이날 어린이 대비 부착 대상 예방 경험 가능,https://news.kmib.co.kr/article/view.asp?arcid=0017539768&code=61121111&cp=kd,학생복지/교육격차해소,보건관리,학생및교직원보건안전관리,감염병예방관리,"코로나19 대응, 학교 방역, 전염병 예방교육, 감염병 관리 지침",0.6288016438484192
1100901.202210051,20221005,중앙일보,대전 세종 충남 공유대학 학교 인근서 로봇 자율주행 수업한다,공유대학 충남 교육부 특화지역 고등교육혁신특화지역 장상윤 지방대학 세종 충북 바이오헬스 재정지원 광주 실습비 특별채용 지방비 2km 모빌리티 차마 전남 겸임교원,https://www.joongang.co.kr/article/25106929,교육활동지원,연구학교운영,연구학교운영,교육지원청지정,"교육지원청 지정 연구학교, 지역 연구학교",0.6286141872406006
1100751.202210271,20221027,아시아투데이,인권위 제23차 한국인권교육포럼 개최,인권위 교육청 공동체 교육부 활성화 학습공동체 이슈페이퍼 교육과정 서울 경인교육대학교 중구 이정연 구정화 아시아투데이,https://www.asiatoday.co.kr/view.php?key=20221027010014218,학교일반운영,학교운영협력,학교운영위원회운영,학교운영위원회운영,"학교운영위 운영, 학교 의사결정 기구, 학부모 참여 위원회",0.6283887028694153
1100101.202210262,20221026,경향신문,이주호 에듀테크 기업에 학교가 테스트베드 제공해야,에듀테크 후보자 교육부 관계자 통합플랫폼 이주호 시험장 교육청 경쟁력 테스트베드 에듀테크산업협회 경향신문 정의당 정소영 아시아교육협회 전교조 에듀 후원금 기부금 부총리,https://www.khan.co.kr/national/education/article/202210262141035,기본적교육활동,교과활동,과학교과활동,실험실습재료지원,"특성화 고교 교과, 전문계열 교육, 직업 연계 교과",0.6283254623413086
1100751.202210311,20221031,아시아투데이,경복대 임상병리학과 전공 창의 융합 지원 프로그램 실시,진단검사 진단검사의학과 임상병리사 경복대 병리학 병리사 팀장 임상병리학과 교수학습개발센터 재학생 의학과 코로나19 국가시험 구리병원 안암병원 분당제생병원 메디컬,https://www.asiatoday.co.kr/view.php?key=20221031001742053,선택적교육활동,직업교육,직업교육운영,산학훈련연계교육,"산학협력 교육, 산학 연계 프로그램, 현장연계 수업",0.6282570362091064
1100501.202210211,20221021,문화일보,코로나 재생산지수 9주만에 1 넘어서 독감 전연령 확산,중대본 코로나19 2만 9주 재유행 정재훈 전주 청장년층 이기일 코로나 rt 분율 전연령 페이스북 42주차 관리청 질병관리청 보건복지부 조정관 변이종 제2차관 전문가들 전문가 다음달 가천의대 연령대별 수치화,http://www.munhwa.com/news/view.html?no=2022102101070803325001,학생복지/교육격차해소,보건관리,학생및교직원보건안전관리,감염병예방관리,"코로나19 대응, 학교 방역, 전염병 예방교육, 감염병 관리 지침",0.6279872059822083
1100201.20221012,20221012,국민일보,뜨거운 감자 강원 학생성장진단평가 초 중교 절반만 치른다,강원학생성장진단평가 도교육청 강원 중학교 전교조 학교별 심영택 학부모 일제고사 장학관 코로나19 전국교직원노동조합 진단평가 구성원 각급,https://news.kmib.co.kr/article/view.asp?arcid=0924267799&code=11171315,교육활동지원,교무업무운영,교무학사운영,교육과정평가,"교육과정 평가, 학교 운영 평가, 수업 평가",0.6279325485229492
1100401.202210131,20221013,동아일보,모든 학생이 기초학력 갖춰야 AI로 평가하고 보충지도 강화한다,종합계획 교육부 학생들 경계선 대상자 9671억 학업성취도 내년도 자율평가,https://www.donga.com/news/article/all/20221013/115938479/1,기본적교육활동,교과활동,교과활동지원,기초학력지도,"기초학력 보장, 학습부진 학생 지원, 학력 격차 해소, 기초학력 책임교육",0.6278300881385803
1100901.202210231,20221023,중앙일보,제자 수년간 폭행한 중학교 운동부 코치 징역형 집행유예,피고인 중학교 a씨 아동학대 이수 청주지법 피해자 집행유예 운동부 이수현 재판부 징역형 b군 수년 충북 훈련장 용인 고등학교 범행일시 얼차려 청주 사회봉사 복지법 양형 폭행,https://www.joongang.co.kr/article/25111383,교육활동지원,생활지도운영,학교폭력예방,가해학생선도,"가해학생 상담, 선도교육 프로그램, 처분대상자 교육",0.6277854442596436
1100751.202210171,20221017,아시아투데이,원포인트건강 고령자 독감 무료 예방접종 시작 인플루엔자 유행주의보 발령,코로나19 인플루엔자 고령자 양지병원 전문의 고령층 가능성 예방접종 의료계 이지용 합병증 호흡기 실내외 이듬해 코로나바이러스 김시영 트윈데믹,https://www.asiatoday.co.kr/view.php?key=20221017010007547,학생복지/교육격차해소,보건관리,학생및교직원보건안전관리,보건교육,"보건교육 프로그램, 위생교육, 감염병 예방교육, 건강생활 교육",0.6276937127113342
1100901.202210261,20221026,중앙일보,재료연 방역취약세대 안전지킴이로 나서,코로나19 재료연 연구팀 서울시 방역취약세대 발스이노베이션 실증사업 한국재료연구원 30세대 성북구 안전지킴이 에이씨에스 과학기술정보통신부 겨울철 이승훈 호흡기 상용화 에어로졸 이정환 테스트베드,https://www.joongang.co.kr/article/25112388,학생복지/교육격차해소,보건관리,학생및교직원보건안전관리,감염병예방관리,"코로나19 대응, 학교 방역, 전염병 예방교육, 감염병 관리 지침",0.6274631023406982
1100751.202210061,20221006,아시아투데이,한국외대 2022 진로탐색캠프 운영대학 매우우수 선정,한국외대 진로탐색 교육원 sw 대학교 중간평가 학생들 교육부 김한슬 아시아투데이 제공해 고등학생들 봉사단 한국과학창의재단 두일철 컴퓨팅사고,https://www.asiatoday.co.kr/view.php?key=20221006010002992,교육활동지원,교무업무운영,교무학사운영,교내외장학초빙공모제운영,"장학생 선발, 장학 공모제, 우수학생 유치 프로그램",0.6273910403251648
1100701.202210141,20221014,세계일보,사람 메타뉴모바이러스 확산세 영유아 주의 필요,영유아 호흡기 감염증 뉴모바이러스 코로나19 메타뉴모바이러스 질병청 관리청 병원체 코로나바이러스 콧물 코막힘 공동사용 대증치료 세기관지염 게티 개인물품 해열제 게티이미지뱅크 분비물 방역당국 확산세,http://www.segye.com/content/html/2022/10/14/20221014508990.html,학생복지/교육격차해소,보건관리,학생및교직원보건안전관리,감염병예방관리,"코로나19 대응, 학교 방역, 전염병 예방교육, 감염병 관리 지침",0.6270058155059814
1100101.202210311,20221031,경향신문,2022 교보교육대상에 장성중학교 오승훈 교사 등 5명 선정,수상자 수형자 서울 오승훈 학생들 교보교육대상 특별상 문영호 문영호씨 옥효진씨 김영식 옥효진 오승훈씨 장성중학교 교보재 교보생명빌딩 교보 부산 충남기계공업고등학교,https://www.khan.co.kr/economy/finance/article/202210311631001,인적자원운용,교직원복지및역량강화,교직원복지,교직원포상,"우수 교사 포상, 교원 격려, 교직원 사기 진작, 교육 공로상",0.6268747448921204
1100201.20221017,20221017,국민일보,학교폭력 계속 증가하는데 학교전담 경찰관은 줄었다,경남 학교폭력 경찰관 교육청 경남경찰청 예방법 범죄예방 경찰청 관계자 촬영물,https://news.kmib.co.kr/article/view.asp?arcid=0924268549&code=11171425,교육활동지원,생활지도운영,학교폭력예방,학교폭력전담기구운영,"학교폭력 전담기구, 학교폭력대응 조직, 학교폭력대책위 운영",0.6264114379882812
1100611.202210041,20221004,서울신문,서울포토 대면 면회 첫날,감염취약시설 코로나19 입소자 신속항원검사 1천 3천 요양병원 재유행 비접촉,http://www.seoul.co.kr/news/newsView.php?id=20221004500087,학생복지/교육격차해소,보건관리,학생및교직원보건안전관리,감염병예방관리,"코로나19 대응, 학교 방역, 전염병 예방교육, 감염병 관리 지침",0.6260249018669128
1100751.202210061,20221006,아시아투데이,홍천군 무궁화 장학생 추가 선발 25일까지 접수,홍천 홍천군 대학교 신영재 강원 이중택 서무담당 공고일 1학년 상반기 자긍심 고등학교 홈페이지 공지사항 1명 대상자 필요서류 2학기 학생들 애향심 중학교 홍천군청 무궁화장학금 무궁화장학회 장학금 주소지 접수기한 접수 무궁화 추가 선발 신청 지역 사항,https://www.asiatoday.co.kr/view.php?key=20221006010002953,교육활동지원,교무업무운영,교무학사운영,교내외장학초빙공모제운영,"장학생 선발, 장학 공모제, 우수학생 유치 프로그램",0.6259774565696716
1100301.202210171,20221017,내일신문,간호조무사로 재취업의 꿈 이루세요,영통경기간호학원 간호조무사 재취업 일자리 취업률 노동부 자격증 고용노동부 야간반 주간반 수강생 강사진 수원 만큼 직장인 주부들,http://www.naeil.com/news_view/?id_art=438532,선택적교육활동,직업교육,직업교육운영,직업능력개발훈련,"직무 능력 향상, 직업훈련 프로그램, 직무역량 강화",0.6259690523147583
1100801.20221003,20221003,조선일보,기고 실내 마스크 해제 정부가 결단해야,코로나 치료제 부작용 확진자 자영업자 포퓰리즘,https://www.chosun.com/opinion/contribution/2022/10/03/MOPNGZCRJVGPREGN2PAX6RYIXM/?utm_source=bigkinds&utm_medium=original&utm_campaign=news,학생복지/교육격차해소,보건관리,학생및교직원보건안전관리,감염병예방관리,"코로나19 대응, 학교 방역, 전염병 예방교육, 감염병 관리 지침",0.6256776452064514
1100901.202210191,20221019,중앙일보,세종사이버대 컴퓨터 AI공학과 이노그리드 와 산학교육협력 MOU 체결,전문가 클라우드 세종사이버대 이노그리드 김효정 산학교육협력 자격증 빅데이터 세종사이버대학교 ai 재학생 학과장 홈페이지 네트워킹,https://www.joongang.co.kr/article/25110451,기본적교육활동,교과활동,정보교과활동,교육용SW확충,"정보 수업, 코딩 교육, 소프트웨어 교육, 디지털 리터러시",0.6255438327789307
1100801.202210281,20221028,조선일보,차에 치이고도 비틀대며 친구에게 달려가 초등생들에 도움 손길,병원비 등굣길 중앙선 승용차 보배드림 학생들 온라인 특례법 외국인 우즈베키스탄 조선닷컴 5명 책임보험 충남 종합보험 관계자 동생들 작성자 피해자 의무사항 피해자들,https://www.chosun.com/national/regional/chungcheong/2022/10/28/KVIHPTVDMZAGHPXU7XVKD2YDWE/?utm_source=bigkinds&utm_medium=original&utm_campaign=news,학생복지/교육격차해소,보건관리,학생및교직원보건안전관리,응급학생후송지원,"응급학생 이송, 학교 내 사고 대응, 응급환자 처리, 학생 긴급 후송",0.6253796219825745
1100401.202210031,20221003,동아일보,요양병원 접촉 면회 내일부터 재개 외출 외박도 허용,코로나19 입소자 확진자 감염취약시설 자가검사키트 관계자 요양병원 코로나바이러스 장애인시설 가림막 아크릴판 일주일 1만 본격화 2차 달여 2만 감염증 키트 3만 정신병원 요양원 방문객 장애인 입소자들 방역조치 그동안,https://www.donga.com/news/article/all/20221003/115773787/1,학생복지/교육격차해소,보건관리,학생및교직원보건안전관리,감염병예방관리,"코로나19 대응, 학교 방역, 전염병 예방교육, 감염병 관리 지침",0.625183641910553
1100611.20221026,20221026,서울신문,속보 백신 접종 대상 18세 이상 성인으로 전면 확대,18세 코로나19 중대본 방역상황 김성호 동절기 고령층 60세 대상자 행정안전부 조정관 안전부 재난안전관리본부장 재유행 제2총괄 본부장 요양시설 요양병원 감염취약시설 중앙재난안전대책본부 취약계층 면역저 3종 1종 백신 접종 확대 요양,http://www.seoul.co.kr/news/newsView.php?id=20221026500022,학생복지/교육격차해소,보건관리,학생및교직원보건안전관리,감염병예방관리,"코로나19 대응, 학교 방역, 전염병 예방교육, 감염병 관리 지침",0.6249157786369324
1100901.20221011,20221011,중앙일보,건강한 우리집 강북연세병원 퇴행성 관절염 건강교실,강북연세병원 관절염 건강교실 무릎관절 발병 코로나19 발병률 걸레질 예방법 카카오톡 병원장 김용찬 무릎관절염 콜센터 회의실 근육량 건강강좌 무릎 건강 관절 교실 예방 지정 남성 강좌 진행 질환 퇴행 확산,https://www.joongang.co.kr/article/25108182,학생복지/교육격차해소,보건관리,학생및교직원보건안전관리,보건교육,"보건교육 프로그램, 위생교육, 감염병 예방교육, 건강생활 교육",0.6242517828941345
