뉴스 식별자,일자,언론사,제목,특성추출(가중치순 상위 50개),URL,대분류,중분류,소분류,세부항목 예시,뉴스 일반 표현,유사도
1100501.202412041,20241204,문화일보,경기 부교육감 하이코칭 교원역량 통합지원 시스템 교사 역량 끌어올려,하이코칭 경기도교육청 사무총장 통합지원 인공지능 교육청 헤이소프 설립자 엘리사 마넬 인터내셔널 하이러닝 영통구 데이비드 홍정표 싱가포르 위원회 필라델피아,http://www.munhwa.com/news/view.html?no=2024120401039927042001,인적자원운용,교직원복지및역량강화,교직원역량강화,기타역량강화지원,"교직원 자기개발, 역량강화 프로그램, 교사 성장 지원, 교원 역량 개발 사업",0.6757243275642395
1101001.20241204,20241204,한겨레,속보 교육부 모든 업무와 학사일정은 정상운영,이정훈 학사일정 정상운영 교육부 업무 학사 일정 정상 운영,http://www.hani.co.kr/arti/society/schooling/1170624.html,교육활동지원,교무업무운영,교무학사운영,교무학사운영,"학사 운영, 교육행정 운영, 학교 일정 관리",0.6755576133728027
1100401.20241226,20241226,동아일보,건양사이버대에 성인 학습자 몰리는 이유 일 학습 병행 지원하는 맞춤형 교육과정 운영,장학금 이수 사이버대 건양사이버대 1학년 온라인 등록금 수업료 산업체 10여 치료학 소득분위 한국 글로벌뷰티학과 2025학년도 학년도,https://www.donga.com/news/Society/article/all/20241225/130683220/1,학교일반운영,학교운영협력,관계기관협력,평생교육지원,"평생교육 지원, 성인학습 기회, 평생학습 활성화",0.6753379702568054
1100901.202412231,20241223,중앙일보,삼육대 자유전공학부 SU PREME 교육과정 개발,공학부 자유전공학부 학생들 삼육대 8주 학교생활 자유전 멘토 전문가 2학기 7주 이수 신입생 나군,https://www.joongang.co.kr/article/25302076,선택적교육활동,기타선택적교육활동,기타선택적교육운영,대학교육실습생운영,"교육실습 운영, 예비교사 실습, 대학교 연계 실습",0.6750807166099548
1100401.20241212,20241212,동아일보,내년부터 고교학점제 고교생도 대학 수업 들으면 학점 인정해준다,교육부 이수 공동교육과정 교육청 고교생 광주 조선대 대구보건대 조선간호대 영남대 울산 대구 울산대 부산외국어대 성취도 전북 부산대 원점수 전북대,https://www.donga.com/news/Society/article/all/20241212/130622950/2,기본적교육활동,교과활동,교과활동지원,공동교육과정운영,"고교 공동교육과정, 학교 간 교육과정 공유, 맞춤형 수업 운영, 교육과정 다양화",0.6745272278785706
1100751.202412041,20241204,아시아투데이,대구시 겨울철 감염병 예방수칙 준수로 건강 챙기세요,감염병 대구시 겨울철 백일해 폐렴균 코로나19 아시아투데이 인플루엔자 마이코플라스마 배철완 65세 홍보활동 김신우 호흡기 경북 임신부 경북권 현장점검,https://www.asiatoday.co.kr/view.php?key=20241204010002232,학생복지/교육격차해소,보건관리,학생및교직원보건안전관리,감염병예방관리,"코로나19 대응, 학교 방역, 전염병 예방교육, 감염병 관리 지침",0.6720160245895386
1100701.202412192,20241219,세계일보,전국에 독감 유행주의보 발령 고위험군 백신 접종해야,인플루엔자 임신부 질병청 50주차 주의보 유행주의보 성북우리아이들병원 방역당국 동절기 호흡기 감염병 면역저 감염위험 1천 4주 49세 관리청 연령별 18세 서울 분율 12세,http://www.segye.com/content/html/2024/12/19/20241219519220.html,학생복지/교육격차해소,보건관리,학생및교직원보건안전관리,감염병예방관리,"코로나19 대응, 학교 방역, 전염병 예방교육, 감염병 관리 지침",0.6712011098861694
1100801.20241219,20241219,조선일보,수시 합격자 이탈 막아라 벌써 OT 여는 대학들,합격자 장학금 대학들 경희대 이대 학생들 ot 학부모 종로학원 계약학과 잡학 물리학 한양대 관계자,https://www.chosun.com/national/education/2024/12/19/O7ARQEB7LZDRDBEXNZHA22DKMI/?utm_source=bigkinds&utm_medium=original&utm_campaign=news,교육활동지원,교무업무운영,교무학사운영,입학전형,"학교 입학전형, 입학전형 관리, 전형 일정 공고",0.6710817217826843
1100701.202412192,20241219,세계일보,교육의미래 경기교육청의 학교체제 혁신구상,경기도교육청 유네스코 김성열 공교육 온라인 민주시민 보고서 경기공유학교 불가능 촉진자 시간표 교육청 형평성 웰빙 수원 민주주 이사장 경남대학교,http://www.segye.com/content/html/2024/12/19/20241219514390.html,교육활동지원,연구학교운영,연구학교운영,시도교육청지정,"교육청 지정 연구학교, 시도교육청 시범학교",0.6707488298416138
1100801.20241212,20241212,조선일보,올해의 스승상 강수정 병곡초 교사 외,학생들 다문화 교사들 자격증 전교생 학부모,https://www.chosun.com/national/education/2024/12/12/DK6CSERU5BCNTJKOD37FNBNHWA/?utm_source=bigkinds&utm_medium=original&utm_campaign=news,인적자원운용,교직원복지및역량강화,교직원복지,교직원포상,"우수 교사 포상, 교원 격려, 교직원 사기 진작, 교육 공로상",0.6700064539909363
1100901.20241219,20241219,중앙일보,대입 내비게이션 전공 자율선택제 도입 미래 융합형 인재 양성,공학부 가군 나군 자유전공학부 다군 약학과 자연계열 자유전 학생들 농어촌 데이터클라우드공학과 공학과 모집단위 예체능계열 물리치료학과 간호학과 창의융합자유전공학부 삼육대 인문계열 합격자 진학어플라이 아트앤디자인학과 체육학과 음악학 사범계열 교차지원 체육학 첨단학 유아교육과 일반전형,https://www.joongang.co.kr/article/25301160,기본적교육활동,자유학기(년)활동,자유학기활동,진로탐색활동,"진로탐색 프로그램, 자유학기제 활동, 학생 진로 설계, 자기주도 진로활동",0.6698769927024841
1101001.202412021,20241202,한겨레,질문의 힘 수학 학습의 지름길,학생들 궁금증 수포자 지름길 자신감 사람들 최우성 사회성 다산고 자율학습 학습자 극대화 일들 선생님 창의성 잠재력 부여 일상생활 의사소통 성취감 시간date 질문 학습 수학 해결 능력 이해 제공 답변 사고,http://www.hani.co.kr/arti/society/schooling/1170332.html,기본적교육활동,교과활동,수학교과활동,수학교과운영,"수학 수업, 수학 보충수업, 수학 창의력 프로그램, 수학 체험활동",0.6693712472915649
1100701.202412181,20241218,세계일보,CJ나눔재단 취약계층 청소년 지원 CJ도너스캠프 꿈키움 장학 모집,장학생 꿈키움 cj 나눔재단 환경적 cj나눔재단 고등학생 꿈키,http://www.segye.com/content/html/2024/12/17/20241217514885.html,학생복지/교육격차해소,교육격차해소,학비지원,사회적배려대상자지원,"저소득층 학생 지원, 교육복지 대상자, 취약계층 장학금, 교육소외 해소",0.6690027713775635
1100201.202412121,20241212,국민일보,대구소방본부 신속한 CPR 지도로 80여명 생명 구해,심폐소생술 심정지 구급상황관리센터 보호자 대구 소생술 신생아 달성군 응급처치 방본부 80여명 대구소 cpr 골든타임 1101건 구급대 가슴압박 심춘섭 119구급대 구지면 생존율 생술 심폐소 2219건 소방본부 지도 구급 생명 신고,https://www.kmib.co.kr/article/view.asp?arcid=0021093283&code=61122020&cp=kd,교육활동지원,생활지도운영,학생안전교육,응급처치교육,"응급처치 교육, 심폐소생술 교육, 응급 상황 대처",0.6686558723449707
1100611.202412121,20241212,서울신문,정지웅 서울시의원 늘봄실무직원 도움받을 수 없는 특수교사 서울시교육청이 나서서 해결해야,서울시교육청 늘봄학교 늘봄 행정업무 방과후학교 교육부 특수교사 후학교 치료지원 방과후 정지웅 특수교육 특수학급 교육활동 서울시의회 늘봄실무직원,http://go.seoul.co.kr/news/newsView.php?id=20241212500045,선택적교육활동,방과후학교운영,늘봄학교운영,늘봄전담인력운영,"늘봄교실 전담 인력, 학교 돌봄 전담자, 돌봄 인력 확충",0.6686030626296997
1100501.202412031,20241203,문화일보,AI 학습 플랫폼 공유학교로 공교육 대변혁 시도,공교육 교육감 경기도교육청 임태희 공유학교 온라인 경기도 유네스코 영통구 경기미래교육 경기교육 ai 수원 형평성 인공지능 참살이 수원컨벤션센터 수원시 학생들 사회변화 교육생태계 불가능 일맥상통 대변혁,http://www.munhwa.com/news/view.html?no=2024120301071327042002,교육활동지원,연구학교운영,연구학교운영,시도교육청지정,"교육청 지정 연구학교, 시도교육청 시범학교",0.6685796976089478
1100301.20241205,20241205,내일신문,영어 잘하려면 풍부한 독서로 인문학적 소양 갖춰야,서술형 학생들 김현영어전문학원 서울대 인문학 학년도 고잔고 예비고1 독서량 고등학교,https://www.naeil.com/news/read/531181?ref=bigkinds,선택적교육활동,독서활동,독서활동운영,독서교육역량강화,"독서 교육, 문해력 강화, 책읽기 활동, 학생 독서 습관",0.66827392578125
1100611.20241217,20241217,서울신문,온 동네가 돌본다 금천표 늘봄학교,작은도서관 공교육 금천구 책마을 늘봄학교 구청장 유성훈 맞춤형 서울시 학부모 독산 행정안전부 체육관 활동가 아이들 금천시니어클럽 탐험대 금천표 2배,http://go.seoul.co.kr/news/newsView.php?id=20241217026006,선택적교육활동,방과후학교운영,늘봄학교운영,늘봄학교(교실)운영,"늘봄학교 운영, 돌봄교실 확장, 온종일 교육체계, 학교 중심 돌봄",0.6676180362701416
1100751.202412121,20241212,아시아투데이,르포 이젠 친구랑 치고받고 싸우지 않아요 마음읽기 로 학폭 예방,학교폭력 대구 교육부 관계회복지원단 아이들 지원단 마음학기제 중학교 대구교육청 교육감 마음학기 학생들 사회정서역량 모둠 친구들 6개월 마음교육,https://www.asiatoday.co.kr/view.php?key=20241212010007250,교육활동지원,생활지도운영,학생생활상담지도,체험/공감형예방교육,"학교폭력 예방교육, 공감형 교육, 체험형 인성교육",0.6673763990402222
1101001.202412161,20241216,한겨레,전공선택권 강화 융합형 인재 양성의 요람,학생들 이수 인하대 융합학부 다중전공 반도체 융합형 멘토 전공디자인센터 졸업생 공학부 일대일 인공지능,http://www.hani.co.kr/arti/society/schooling/1173398.html,선택적교육활동,직업교육,직업교육운영,산학훈련연계교육,"산학협력 교육, 산학 연계 프로그램, 현장연계 수업",0.667008101940155
1100751.202412242,20241224,아시아투데이,대학 등록금 동결시 교내장학금 10 줄여도 국가장학금 지원,국가장학금 교내장학금 등록금 장학금 학자금 교육부 소비자 박지숙 아시아투데이 내년도 동결시 그간 교육법,https://www.asiatoday.co.kr/view.php?key=20241224010013650,학생복지/교육격차해소,학생복지,학생장학금운영,학생장학금지원,"장학금 지급, 학생 장학 제도, 교육비 지원, 장학생 선발 공고",0.6667473912239075
1100701.202412161,20241216,세계일보,경상국립대 총장 학생 행복대학의 새로운 모델 대학,장학금 경상국립대 생활관 가좌캠퍼스 신입생 우수자 교육과정 글로컬 글로컬대학 이수 재학생 취업지원 교내장학금 경남,http://www.segye.com/content/html/2024/12/16/20241216508168.html,교육활동지원,교무업무운영,교무학사운영,교내외장학초빙공모제운영,"장학생 선발, 장학 공모제, 우수학생 유치 프로그램",0.666625440120697
1100901.202412111,20241211,중앙일보,세종사이버대학교 아동가족학부 발달재활서비스 제공인력 교육기관전문 심리상담사 취득 특강 개최,세종사이버대 아동학 자격증 상담사 양성과정 전문가 놀이치료 교육기관 제공인력 수퍼바이저 아동가족학부 종사자 세종사이버대학교 아동가족 입학시 보유자 네이버 놀이심리재활 입시모집 한국심리학회,https://www.joongang.co.kr/article/25299062,선택적교육활동,직업교육,직업교육운영,직업교육운영,"직업교육, 진로직업 교육, 기술교육 강화, 실무형 인재 양성",0.666410505771637
1100611.202412101,20241210,서울신문,경기교육청 2025 경기교육 기본계획 발표 공교육 확대 로 공교육 대변혁,공교육 도교육청 경기공유학교 경기온라인학교 임태희 섹터 지역협력 경기도 교육감 서혜정 경기미래교육 수원 경기도교육청 에듀테크 정책과제,http://www.seoul.co.kr/news/newsView.php?id=20241210500094,교육활동지원,연구학교운영,연구학교운영,시도교육청지정,"교육청 지정 연구학교, 시도교육청 시범학교",0.6657430529594421
1100901.202412131,20241213,중앙일보,서울시립대학교 수시모집 최초합격자 발표,수시모집 합격자 서울시립대학교 등록금 추가합격자 이중등록 홈페이지 입학처 등록확인예치금 생년월일 수험번호 발표일 정시모집 복수지원 원용걸 학년도 추가모집,https://www.joongang.co.kr/article/25299771,교육활동지원,교무업무운영,교무학사운영,입학전형,"학교 입학전형, 입학전형 관리, 전형 일정 공고",0.6652916073799133
1100301.202412231,20241223,내일신문,양평원 부총리 겸 교육부장관상 수상,원격교육연수원 실시간 부총리 학습자 운영평가 한국양성평등교육진흥원 교육부장관상 진흥원 한국양 교육청 한국양성 한국교육학술정보원 평등교육진흥원 제작물 표창장 가족부 교육부 한국,https://www.naeil.com/news/read/533160?ref=bigkinds,인적자원운용,교직원복지및역량강화,교직원복지,교직원포상,"우수 교사 포상, 교원 격려, 교직원 사기 진작, 교육 공로상",0.6649103164672852
1100101.202412102,20241210,경향신문,국제칼럼 일본 교사의 고단한 열정페이,일본 열정페이 교사들 아이들 운동장 교무실 교직조정수당 시간date 노동자 박진환 문부과학성 기본급 근로기준법 문부과학 중학교 공립학교 만큼 대조적,https://www.khan.co.kr/article/202412102050005,인적자원운용,기타교직원보수,교직원대체인건비,교원대체인건비,"기간제 교사, 대체 교사, 출산휴가 교사, 교사 인력난",0.6645985841751099
1101101.202412051,20241205,한국일보,경희사이버대 이주민을 위한 교육 지원 방안 포럼 성료,이주민 경희사이버대학교 이민정책연구원 경희사이버대 다문화 외국인 박민정 인하대 최해연 안산시 홈페이지 서진숙 연구원 센터장 글로벌자율학부,https://www.hankookilbo.com/News/Read/A2024120516390005309,선택적교육활동,기타선택적교육활동,다문화교육운영,다문화교육프로그램운영비,"다문화 교육 프로그램, 중도입국자 교육, 다문화 체험 활동",0.6639918684959412
1100751.202412201,20241220,아시아투데이,경북교육청 내년부터 교육공무직 4개 직종 급여업무 교육지원청 이관,경북교육청 교육지원청 교육공무직원 위클래스 문봉현 아시아투데이 지원청 사회복지사 복지사 상담사 취업지원관 임종식 근로기준법 지원관 영양사 교육감 교무실무사 직종별 직종 이관 교육 학교 급여 내년 업무 기준 부담 법령 지급 임금 공무,https://www.asiatoday.co.kr/view.php?key=20241220010011867,학교일반운영,학교기관운영,부서기본운영,교육행정업무운영,"교육행정 운영, 학교 행정 업무, 학사관리 행정 지원",0.663550615310669
1100901.20241224,20241224,중앙일보,과학고와 영재학교 내신 벗어나 다양한 경험 쌓게 해줘야,영재학교 토론회 과학고 충남과학고 지원자 17억 생기부 연구활동 과학기술정보통신부 경상국립대 손정우 과학창의재단 학생들 김미란 부여 생애주기 국제올림피아드,https://www.joongang.co.kr/article/25302319,선택적교육활동,기타선택적교육활동,창의교육운영,영재교육운영,"영재교육, 영재학생 발굴, 수월성 교육, 창의인재 육성",0.6633217334747314
1100751.202412091,20241209,아시아투데이,부산교육청 학생 안전사고와 위급상황 대응 능력 키운다,교직원 안전교육 다자녀 부산시교육청 체험관 부산학생안전체험관 홈페이지 하윤수 만족도 통합예약포털 아시아투데이 조영돌 희망자 안전사고 학생안전체험관 부산,https://www.asiatoday.co.kr/view.php?key=20241209010005313,교육활동지원,생활지도운영,학생안전교육,안전교육,"학생 안전교육, 생활안전 교육, 학교 안전 지침",0.6632605195045471
1101001.202412241,20241224,한겨레,학생이 교사 사진으로 딥페이크 교권 침해가 아니라고요,교육활동 씨 성범죄 피해자 성범죄물 지역교권 가해자 보호위 딥페이크 위원회 성폭력 학생들 광주 반포 지역교 처벌법 인격권 한겨레 전교조 굴욕감 성폭력처벌법 모욕감 교원지위법 지원청 지위법,http://www.hani.co.kr/arti/society/women/1174679.html,인적자원운용,교직원복지및역량강화,교직원복지,교육활동보호지원,"교권 보호 정책, 교사 폭력 방지, 교사 보호법, 교육활동 안전 확보",0.6630488038063049
1100501.202412111,20241211,문화일보,서울 중구 이끌어주는 부모과정 수료식 개최,중구 상담사 이수 부모과정 전문자격 학부모 3개 응시자 성적표 교육과정,http://www.munhwa.com/news/view.html?no=2024121101039927163006,학교일반운영,학교운영협력,학부모협력,학부모회연수운영,"학부모 연수, 학부모 교육 프로그램, 보호자 교육",0.6615948677062988
1100301.202412271,20241227,내일신문,학생 지도 방향성 얻었다,학생들 염광고 송치성 고1 방향성 발표내용 대면수업 신소재 skin 물리학 고교생 코로나19 double 태양광 태양빛 심사위원 지구과학 과학탐구실험 손희승 학생 과학 위기 방향 탄소 데이터 과목 캠페인 방법 교육 능력 기후 교사 에너지,https://www.naeil.com/news/read/533583?ref=bigkinds,기본적교육활동,교과활동,과학교과활동,실험실습재료지원,"특성화 고교 교과, 전문계열 교육, 직업 연계 교과",0.6614401936531067
1101101.202412171,20241217,한국일보,우울 불안 서울 청소년 상담받으러 오세요 접근성 높인다,서울시 서울 자치구 교육청 상담비 접근성 청소년들 업무협약 원스톱 202억 서울시청 교육지원청별 11개소 아이들 지원청 9개,https://www.hankookilbo.com/News/Read/A2024121714530000748,교육활동지원,생활지도운영,학생생활상담지도,위클래스운영,"위클래스 상담실, 학생 정서 지원, 학교 상담센터",0.6608463525772095
1100401.20241209,20241209,동아일보,인천시교육청 내년부터 농촌 유학 프로그램 본격 운영,농어촌 시교육청 인천 인천시교육청 학생들 옹진군 강화군 중학교 학부모 16곳 2명 학부모들 6개월 관계자 12곳 80가족 25가족 학생 프로그램 유학 운영 농촌 가족,https://www.donga.com/news/Society/article/all/20241208/130596940/2,교육활동지원,연구학교운영,연구학교운영,시도교육청지정,"교육청 지정 연구학교, 시도교육청 시범학교",0.6605635285377502
1101001.20241204,20241204,한겨레,교육부 4일 학교 정상 운영,교육부 비상계엄 윤석열 학사일정 다음날 출입기자단 기자단 한동안 분께 정상운영 학사 정상 운영 변동 별도 대통령 안내 일정 학교 출입 긴급 담화 업무 발생 선포 상황 결정,http://www.hani.co.kr/arti/society/schooling/1170628.html,교육활동지원,교무업무운영,교무학사운영,교무학사운영,"학사 운영, 교육행정 운영, 학교 일정 관리",0.6593188047409058
1101001.202412181,20241218,한겨레,목표 대학 학과의 입시 결과 토대로 전략 세워야,지원자 다군 서울 우연철 무전공 경쟁률 대학별 학년도 가산점 자연계열 선발인원 고려대 이치우,http://www.hani.co.kr/arti/society/schooling/1173716.html,교육활동지원,교무업무운영,교무학사운영,입학전형,"학교 입학전형, 입학전형 관리, 전형 일정 공고",0.6584661602973938
1100501.202412201,20241220,문화일보,노원구 겨울방학 노원 어린이 영어캠프 운영,노원 영어캠프 원어민 영어실력 실생활 어학연수 사교육비 노원구 겨울방학 그중 삼육대학교 공동체 부교사 1명,http://www.munhwa.com/news/view.html?no=2024122001039927107005,기본적교육활동,교과활동,외국어교과활동,영어캠프운영,"영어 수업, 외국어 말하기 대회, 원어민 수업, 글로벌 언어 교육",0.6584107875823975
1100901.202412242,20241224,중앙일보,등록금 동결 대학 교내장학금 10 줄여도 국가장학금 지원,등록금 장학금 교육부 교내장학금 국가장학금 학자금 소비자 2유형 대학들 개선비 인건비 최고치,https://www.joongang.co.kr/article/25302584,학생복지/교육격차해소,학생복지,학생장학금운영,학생장학금지원,"장학금 지급, 학생 장학 제도, 교육비 지원, 장학생 선발 공고",0.6582622528076172
1100751.202412191,20241219,아시아투데이,서울시교육청 2024 가칭 영유아학교 성과공유회 개최,서울시교육청 유보통합 영유아 시범운영기관 시범사업 어린이집 영유아학교 성과공유회 서울시 유치원 공유회 관계자 유튜브 아시아투데이 한국프레스센터 박지숙 정근식,https://www.asiatoday.co.kr/view.php?key=20241219010010982,교육활동지원,연구학교운영,연구학교운영,시도교육청지정,"교육청 지정 연구학교, 시도교육청 시범학교",0.6580443382263184
1101001.202412031,20241203,한겨레,사이버한국외국어대 AI 기반 혁신적 교육과정으로 차별화된 학습 경험 제공,외국어 교육과정 스페인어 전문가 온라인 ai 학년도 이수 사이버한국외대 한국외대 누리집 일본어 대상자 학생들 마이크로디 베트남어 블렌디드 스토리텔링,http://www.hani.co.kr/arti/society/schooling/1170519.html,기본적교육활동,교과활동,외국어교과활동,외국어교과운영,"영어 수업, 외국어 말하기 대회, 원어민 수업, 글로벌 언어 교육",0.6571716666221619
1100501.202412091,20241209,문화일보,서울시교 저소득층 학생 도운 초록우산서울본부 등 우수기관 4곳 표창,서울시교육청 서울 표창장 정근식 수여식 취약학생 세계시민포럼 두산연강재단 6억 서울시 교육감 장학금 수상기관 학생들 송석복지재단 종로구 교육감실 다문화 서울시교 학생 기관 우수 지원 기부 가정 본부 선정 사회 표창 계기 확산,http://www.munhwa.com/news/view.html?no=2024120901039921043001,학생복지/교육격차해소,교육격차해소,학비지원,사회적배려대상자지원,"저소득층 학생 지원, 교육복지 대상자, 취약계층 장학금, 교육소외 해소",0.657117486000061
1100701.202412241,20241224,세계일보,단독 교육부 대학 교내 장학금 10 감축해도 국가장학금 지원 허용,등록금 교육부 장학금 국가장학금 사립대 학년도 2025학년도 소비자 대학들 관계자 그간,http://www.segye.com/content/html/2024/12/24/20241224512855.html,학생복지/교육격차해소,학생복지,학생장학금운영,학생장학금지원,"장학금 지급, 학생 장학 제도, 교육비 지원, 장학생 선발 공고",0.6569797992706299
1100751.202412101,20241210,아시아투데이,내년부터 고교학점제 대학수업 들으면 고교 대학 학점 동시 인정,교육부 교육청 고교학점제 시도교육청 온라인 공동교육과정 지역사회 이주호 아시아투데이 부총리 고등학교 박지숙 그동안 성취도 원점수,https://www.asiatoday.co.kr/view.php?key=20241210010006029,기본적교육활동,교과활동,교과활동지원,공동교육과정운영,"고교 공동교육과정, 학교 간 교육과정 공유, 맞춤형 수업 운영, 교육과정 다양화",0.6568098664283752
1100201.20241202,20241202,국민일보,부산시교육청 공교육 내실화 미래 교육 체계 구축 성과,부산 공교육 중학교 고등학교 학생들 부산교육청 학부모 서부산,,교육활동지원,연구학교운영,연구학교운영,시도교육청지정,"교육청 지정 연구학교, 시도교육청 시범학교",0.6562725305557251
