뉴스 식별자,일자,언론사,제목,특성추출(가중치순 상위 50개),URL,대분류,중분류,소분류,세부항목 예시,뉴스 일반 표현,유사도
1100611.20221012,20221012,서울신문,학업성취도 평가 5년 만에 사실상 부활 초3 고2까지 확대,교육부 전수평가 학업성취 학업성취도 일제고사 자율평가 표집 중3,http://www.seoul.co.kr/news/newsView.php?id=20221012002003,교육활동지원,교무업무운영,교무학사운영,교육과정평가,"교육과정 평가, 학교 운영 평가, 수업 평가",0.6635290384292603
1100501.202210111,20221011,문화일보,서울교육청 무료코딩교육 플랫폼 운영,온라인 sw 교육청 서울시교육청 실생활 조희연 강의들 메타버스 데이터과학 sw교육 https 회원가입 서울시 플레이스토어 구글 다각도 메타 사고력,http://www.munhwa.com/news/view.html?no=2022101101039921022001,기본적교육활동,교과활동,정보교과활동,정보교과운영,"정보 수업, 코딩 교육, 소프트웨어 교육, 디지털 리터러시",0.6634671092033386
1100751.202210311,20221031,아시아투데이,거창교육지원청 영재교육원 프로젝트 발표 공개수업 실시,영재교육원 학부모 거창영재교육원 학생들 이명주 박현섭 거창 조기룡 거창교육지원청 7개 공개수업 창의성 거창영재 중등과학 발명교육센터 경남 전문가 교육원장 그동안 팬데믹 20차 산출물 시간date 프로젝트 학습 수업 학생 중등 발명,https://www.asiatoday.co.kr/view.php?key=20221031010015974,선택적교육활동,기타선택적교육활동,창의교육운영,영재교육운영,"영재교육, 영재학생 발굴, 수월성 교육, 창의인재 육성",0.6626213192939758
1101101.20221005,20221005,한국일보,과학적 근거 없는 실내 마스크 의무 해제해야 기고,코로나19 확진자 감염예방효과 유럽 우리나라 미국 한국 면역력 가능성 사람들 국민들 혈청역학조사 감염자,https://hankookilbo.com/News/Read/A2022100410190000607,학생복지/교육격차해소,보건관리,학생및교직원보건안전관리,감염병예방관리,"코로나19 대응, 학교 방역, 전염병 예방교육, 감염병 관리 지침",0.6625890731811523
1100301.202210141,20221014,내일신문,대학가는 최적의 길 입시에 필요한 학습 생활 통합 관리,하늘높이컨설팅 학부모 설명회 학습관리 진도,http://www.naeil.com/news_view/?id_art=438383,교육활동지원,교무업무운영,교무학사운영,입학전형,"학교 입학전형, 입학전형 관리, 전형 일정 공고",0.6624998450279236
1100201.20221012,20221012,국민일보,3 뺀 모든 학생 새학년 2개월내 학력 측정 받는다,교육부 전수평가 ai 고2 종합계획 중3 학업성취 자율평가 일제고사 장상윤 안전망,https://news.kmib.co.kr/article/view.asp?arcid=0924267924&code=11121200,교육활동지원,교무업무운영,교무학사운영,교육과정평가,"교육과정 평가, 학교 운영 평가, 수업 평가",0.6623193025588989
1101001.20221013,20221013,한겨레,양도 질도 형편없는 학교체육 고교학점제 땐 더 밀려난다,고교학점제 체육시간 체육교사 선택과목 중학교 서울 시수 짐나지움 신체활동 학교체육 이수 그동안 학생들,http://www.hani.co.kr/arti/society/society_general/1062436.html,기본적교육활동,교과활동,체육교과활동,특성화중학교(체육)운영,"체육 수업, 체력 증진 활동, 체육대회, 학생 스포츠 활동",0.6621366739273071
1100751.202210311,20221031,아시아투데이,포토 코로나 19 정례 브리핑하는 정기석 단장,코로나19 정기석 브리핑실 종로구 아시아투데이 동절기 서울 박성일 국가감염병 위원장 대응단장 서울청사 국가감염병위기대응자문위원장 특별대응단장 코로나 대응 위기 자문 접종 중요 예방 브리핑 정부 특별 단장 정례,https://www.asiatoday.co.kr/view.php?key=20221031010015738,학생복지/교육격차해소,보건관리,학생및교직원보건안전관리,감염병예방관리,"코로나19 대응, 학교 방역, 전염병 예방교육, 감염병 관리 지침",0.662006139755249
1100751.202210211,20221021,아시아투데이,경기도교육청 학교폭력 예방 소통 토론회 개최,토론회 경기도교육청 학교폭력 교육공동체 교육적 유튜브 전문가 오프라인 한마음홀 선착순 실시간 경인교대 박주형 박정행 김주홍 공동체 수원 큐알 온라인 학생생활교육과장 좌장 관계회복 학부모 변호사 구성원 학교문화 공감대 교육력 지원청,https://www.asiatoday.co.kr/view.php?key=20221021010010404,교육활동지원,생활지도운영,학교폭력예방,학교폭력관련연수지원,"학교폭력 연수, 교사 연수 프로그램, 폭력 예방 교육",0.6619203090667725
1100401.202210112,20221011,동아일보,학업성취도 평가 2024년부터 초3 고2로 확대,교육부 자율평가 전수평가 고2 표집 안전망 국무회의,https://www.donga.com/news/article/all/20221011/115904620/1,교육활동지원,교무업무운영,교무학사운영,교육과정평가,"교육과정 평가, 학교 운영 평가, 수업 평가",0.6616503000259399
1101001.202210101,20221010,한겨레,쩌렁쩌렁 악기 소리 생생한 의료 실습 이게 대학생활이죠,전문대 온라인 학생들 만큼 코로나19 비대면 전문가 졸업작품 실습병원 전문대학 디마 메타버스,http://www.hani.co.kr/arti/society/schooling/1062051.html,선택적교육활동,기타선택적교육활동,기타선택적교육운영,대학교육실습생운영,"교육실습 운영, 예비교사 실습, 대학교 연계 실습",0.6615304350852966
1100301.20221018,20221018,내일신문,방송대 대학원 신입생 모집,대학원 경영대학원 합격자 홈페이지 방송대 신입생 교육학 콘텐츠학 언어문화학 과정도 유아교육학과 영상문화콘텐츠학 정민승 아프리카 시스템학 실용중국어학 행정학 불어권,http://www.naeil.com/news_view/?id_art=438820,교육활동지원,교무업무운영,교무학사운영,입학전형,"학교 입학전형, 입학전형 관리, 전형 일정 공고",0.6610175967216492
1100401.202210122,20221012,동아일보,성인 손 씻는 시간 9 15초 올바른 방법은 영상,화장실 질병청 손바닥 공중화장실 홍보물 감염병 3명 그해 코로나19 실천율 코로나바이러스 세면대 백경란 전년도 6단계 관계자 관리청,https://www.donga.com/news/article/all/20221012/115917544/2,학생복지/교육격차해소,보건관리,학생및교직원보건안전관리,감염병예방관리,"코로나19 대응, 학교 방역, 전염병 예방교육, 감염병 관리 지침",0.660679042339325
1100201.202210241,20221024,국민일보,급식종사자 폐질환 막자 충남교육청 종사자 처우 개선 강화,노동자 급식실 교육청 충남 도교육청 검사비 종사자 촬영비 근로자 이상소견 충남도교육청 4단계 김지철,https://news.kmib.co.kr/article/view.asp?arcid=0017598518&code=61121111&cp=kd,학생복지/교육격차해소,급식관리,학교급식운영,영양사/조리사인건비,"영양사 인건비, 조리사 채용, 급식 노동자 처우, 학교 급식 인력",0.6606234312057495
1100201.202210022,20221002,국민일보,이기일 차관 내년 3월쯤 코로나19 사실상 끝날 것,코로나19 이기일 만큼 kbs 인플루엔자 치명률 치료제 방역체계 전문가 나라들 제2차관 오미크론 대중교통 계절독감 호흡기 유행 차관 마스크 의무 내년 실내 겨울 의료 의견 여력 체계 강조 해제,https://news.kmib.co.kr/article/view.asp?arcid=0017530666&code=61171811&cp=kd,학생복지/교육격차해소,보건관리,학생및교직원보건안전관리,감염병예방관리,"코로나19 대응, 학교 방역, 전염병 예방교육, 감염병 관리 지침",0.6602754592895508
1100101.202210251,20221025,경향신문,학생선수 대회 훈련 출석인정 확대될 듯 교육부 개선안 마련 중,교육부 중학교 학습권 고려대 학생선수 고등학교 출석인정제 윔블던 출석인정일수 전문가 관계자 출석인정 토론회 중구 이정호 서울 조대연 고영종 학생선수들 학생들 운동선수,https://www.khan.co.kr/national/education/article/202210251217001,교육활동지원,교무업무운영,교무학사운영,교육과정평가,"교육과정 평가, 학교 운영 평가, 수업 평가",0.6602670550346375
1100801.20221013,20221013,조선일보,사설 기초학력은 학생 기본권 학력 측정해야 맞춤형 지원 도 가능,고2 중3 코로나 기본권 학생들 선진국 미국 포인트씩 선진국들 부작용 무책임 영국 교과별 학교별 영역별,https://www.chosun.com/opinion/editorial/2022/10/13/37PFXEVLXFG3RHDT63FH5XQLSU/?utm_source=bigkinds&utm_medium=original&utm_campaign=news,기본적교육활동,교과활동,교과활동지원,기초학력지도,"기초학력 보장, 학습부진 학생 지원, 학력 격차 해소, 기초학력 책임교육",0.6602150797843933
1100611.202210122,20221012,서울신문,최유희 서울시의원 오산중 고 방문해 학부모 간담회 가져,학부모 오산중 최유희 용산구 아이들 서울시 서울특별시의회 위원회 활성화 지원방안 허심탄회 용산 코로나 학습환경 용산구청 캔들 시간date 서울시의회 교직원 고등학교 간담회 의원 교육 활동 아이 체험 개선 환경 위원 지원 현안 방문 소속,http://go.seoul.co.kr/news/newsView.php?id=20221012500247,학교일반운영,학교운영협력,학부모협력,학부모회연수운영,"학부모 연수, 학부모 교육 프로그램, 보호자 교육",0.660142183303833
1100751.202210111,20221011,아시아투데이,학업성취도 자율평가 확대 전수평가 일제고사 부활 의미 아냐,전수평가 교육부 표집 종합계획 학업성취 소지자 일제고사 자율평가 학부모 중3 표집평가 이해숙,https://www.asiatoday.co.kr/view.php?key=20221011010005032,교육활동지원,교무업무운영,교무학사운영,교육과정평가,"교육과정 평가, 학교 운영 평가, 수업 평가",0.6599437594413757
1101101.202210251,20221025,한국일보,지방교육재정교부금 논란 속 교육전출금도 개성해야,교육청 전출금 법정전출금 oecd 1만 이철우 경북도 비법정전출금 교부금 무상급식 불필요 고등교육 교육전출금 도세 내국세 222억 지방교육재정교부금 지방정부 222억 중등교육 지방세 공교육 교육비 용동 재정난 법정전 한국 일자리,https://hankookilbo.com/News/Read/A2022102516190002667,학생복지/교육격차해소,학생복지,학생장학금운영,도비특별장학금,"지방정부 장학금, 도비 장학 지원, 지역 인재 양성 장학금",0.6598593592643738
1100611.202210201,20221020,서울신문,이경숙 위원장 서울시교육청 즉시 학업성취도 전수평가 실시해야,위원장 전수평가 학업성취 서울시의회 서울시교육청 서울 30억 서울교육 입장문 일제고사 교육감 서울특별시교육청 이경숙 서울특별시의회 불안감 부작용,http://go.seoul.co.kr/news/newsView.php?id=20221020500111,교육활동지원,교무업무운영,교무학사운영,교육과정평가,"교육과정 평가, 학교 운영 평가, 수업 평가",0.6596848368644714
1101001.202210021,20221002,한겨레,자연면역 1년 간다는데 백신 간격 실내 마스크는 이대로,감염병 코로나19 김윤 확진자 일상회복 엄중식 서울대병원 재유행 자연면역,http://www.hani.co.kr/arti/society/health/1061030.html,학생복지/교육격차해소,보건관리,학생및교직원보건안전관리,감염병예방관리,"코로나19 대응, 학교 방역, 전염병 예방교육, 감염병 관리 지침",0.6591541171073914
1100801.20221015,20221015,조선일보,가을 운동회 학부모들의 마음,학부모 운동회 서울 코로나 운동장 학부모들 학교들 아이들 오종찬 교육부 까치발 oh 학교 마스크 아이 관리 교문 교장 학창 착용 아파트 인근 교내 마음 실외 소리 손뼉 응원 야외 해제 가을,https://www.chosun.com/national/weekend/2022/10/15/B6YLTFME75AIVPGWLMHKFI7W7A/?utm_source=bigkinds&utm_medium=original&utm_campaign=news,학교일반운영,학교운영협력,학부모협력,학부모회활동지원,"학부모 활동, 참여교육 지원, 학교 행사 협조",0.6586923599243164
1100901.2022102,20221020,중앙일보,WHO 코로나19 국제적 공중보건 비상사태 유지,코로나19 pheic 사무총장 테워드로스 비상사태 제네바 위원회 기자회견 거브러여수스 아드 세계보건기구 보건 유지 국제 공중 선언 사태 조치 바이러스 개선 변이 상황 각종 권고 억제 대비 의견 나라 현지 질병 자금 결정,https://www.joongang.co.kr/article/25110658,학생복지/교육격차해소,보건관리,학생및교직원보건안전관리,감염병예방관리,"코로나19 대응, 학교 방역, 전염병 예방교육, 감염병 관리 지침",0.6583118438720703
1100751.202210051,20221005,아시아투데이,2022 국감 질병청 실내마스크 의무 겨울 유행 후 단계적 완화 논의,감염병 코로나19 질병청 오미크론 위원회 이선영 방역통합정보시스템 아시아투데이 차세대 겨울철 조정방안 질환자 28개국,https://www.asiatoday.co.kr/view.php?key=20221005010002087,학생복지/교육격차해소,보건관리,학생및교직원보건안전관리,감염병예방관리,"코로나19 대응, 학교 방역, 전염병 예방교육, 감염병 관리 지침",0.6579915285110474
1100701.202210291,20221029,세계일보,자생의료재단 저소득 가정 청소년 나눔 실천 훈훈,바자회 자생의료재단 임직원 임직원들 청소년들 온라인 희망드림 이미화 신민식 행사장 코로나바이러스 200여 서울 강남구 자생봉사단 봉사단 수익금 사회공헌위원장 건강차,http://www.segye.com/content/html/2022/10/29/20221029505155.html,기본적교육활동,창의적체험활동,봉사활동,봉사캠페인,"학생 봉사활동, 사회공헌 캠페인, 학교 내 봉사 문화, 지역사회 기여",0.6579375267028809
1100751.202210311,20221031,아시아투데이,경기도교육청 교원 전문성 신장과 지위 향상 위해 함께 노력,경기교총 교육감 임태희 요구안 동반자 경기도교원단체총연합회 주훈지 수원 김주홍 합의서 부서별 선생님 실무교섭 부회장 실무교섭위원장 상견례 교총 도교육청 위원장 교육정책국장 경기도 교육협력국장 인사말,https://www.asiatoday.co.kr/view.php?key=20221031010016229,인적자원운용,교직원복지및역량강화,교직원복지,교직원포상,"우수 교사 포상, 교원 격려, 교직원 사기 진작, 교육 공로상",0.6578803062438965
1100611.2022102,20221020,서울신문,혁신학교 폐지 아닌 발전적 계승 학교자치 실현 노력할 것,혁신학교 전남 전남교육청 학교자치 교육감 전남교육 미래교육 김대중 문해력 아이들 인공지능 안정성 미래인재 운영비,http://go.seoul.co.kr/news/newsView.php?id=20221020034001,학교일반운영,학교운영협력,관계기관협력,주민참여학교운영,"주민 참여 학교, 지역 개방형 학교, 학교 공동체 운영",0.6577335596084595
1100751.202210051,20221005,아시아투데이,예산군 코로나19 동절기 추가접종 시행,코로나19 동절기 건강취약계층 고령층 겨울철 김관태 관계자 감염취약시설 65세 60세 완료자 예방접종 예산군 기저질환자 질환자 집단시설자 70세 시설자 75세 보건의료인 의료인 전화예약 당일접종 보건기관 2가 사전예약 종사자 49세,https://www.asiatoday.co.kr/view.php?key=20221005010001948,학생복지/교육격차해소,보건관리,학생및교직원보건안전관리,감염병예방관리,"코로나19 대응, 학교 방역, 전염병 예방교육, 감염병 관리 지침",0.6573304533958435
1100901.202210071,20221007,중앙일보,발명진흥회 대한민국 교육기부 대상 수상,지식재산 이러닝 한국발명진흥회 교육기부 특허청 대한민국 선도학교 온라인 손용욱 우리나라 기자단 경제적 강연회 교육부 부회장 발명수업 상근부회장 창의발명,https://www.joongang.co.kr/article/25107653,선택적교육활동,기타선택적교육활동,창의교육운영,발명교실운영,"발명교육, 창의력 개발, 메이커 교육, 발명 아이디어 교실",0.6571657061576843
1100101.202210122,20221012,경향신문,국민 절반은 코로나 경험,확진자 코로나19 전주 중대본 조규홍 중앙방역대책본부 의사환자 응급실 의료기관 진료소 감염자 대체인력,https://www.khan.co.kr/national/health-welfare/article/202210122132015,학생복지/교육격차해소,보건관리,학생및교직원보건안전관리,감염병예방관리,"코로나19 대응, 학교 방역, 전염병 예방교육, 감염병 관리 지침",0.6569628119468689
1100751.20221004,20221004,아시아투데이,하윤수 부산시교육감 장애아동 교육 사각지대 해소 나선다,교육감 학부모 장애아동 교육청 하윤수 사각지대 조영돌 전문가 부산 교육과장 거제동 부산시교육청 공감실 가족들 지원단 특수교육장학관 연제구,https://www.asiatoday.co.kr/view.php?key=20221004010000620,기본적교육활동,창의적체험활동,봉사활동,장애학생돌보기,"장애학생 돌봄, 특수학생 지원 활동, 장애인식 개선 봉사, 통합교육 봉사활동",0.6564882397651672
1101101.20221005,20221005,한국일보,특수학교 찾아 빚지고 이사 특수학급 요구엔 딴 학교 가라 1071명 발달장애를 답하다,특수학교 특수학급 울산 중학교 경남 장애인 발달장애인 일반학교 진해구 응답자 경남교육청 특례법 특수교육 교육감 남구 해든학교 300가구 시행자,https://hankookilbo.com/News/Read/A2022100409060001371,학생복지/교육격차해소,교육격차해소,학비지원,특수교육대상자지원,"특수교육 대상 학생, 장애학생 학비 지원, 특수학교 무상교육, 통합교육 지원",0.6553032994270325
1100101.202210111,20221011,경향신문,스쿨미투 손놓은 교육당국 버젓이 교단에 서있는 가해자 137명 플랫,성폭력 교육청 가해자 성희롱 피해자 0건 용화여고 서울 시도교육청 미투 교육청들 민형배 17곳,https://www.khan.co.kr/national/education/article/202210111430001,인적자원운용,교직원복지및역량강화,교직원복지,성폭력피해자지원,"교내 성폭력 피해자 보호, 교사 성희롱 대응, 성폭력 상담 지원, 피해 교원 지원 제도",0.6550957560539246
1100801.20221012,20221012,조선일보,초중고 학력평가 5년만에 사실상 부활,자율평가 국가수준 교육부 전교조 학생들 ai 표집 안전망 고2,https://www.chosun.com/national/education/2022/10/12/LPGKRZ3IL5DGXNLVI5JZVWCFWI/?utm_source=bigkinds&utm_medium=original&utm_campaign=news,교육활동지원,교무업무운영,교무학사운영,교육과정평가,"교육과정 평가, 학교 운영 평가, 수업 평가",0.6549309492111206
1100301.202210141,20221014,내일신문,방역완화에도 유행감소,코로나19 김성호 확진자 입국자 중대본 일평균 요양병원 유전자 조정관 제2총괄 모두발언 유전자증폭 2만 유행감소 감소세 pcr 방역완화 대책 방역 완화 유행 감소 신규 시설 회의 해외 허용 주간 정부,http://www.naeil.com/news_view/?id_art=438422,학생복지/교육격차해소,보건관리,학생및교직원보건안전관리,감염병예방관리,"코로나19 대응, 학교 방역, 전염병 예방교육, 감염병 관리 지침",0.6547330617904663
1100701.202210241,20221024,세계일보,정기석 실내 마스크 지금은 벗을 상황 아냐 3개월은 참아야,코로나19 3개월 정기석 위원장 팬데믹 의료기관 국가감염병 대응단장 대중교통 특별대응단장 국가감염병위기대응자문위원장 실내 마스크 안전 해제 정례 의무 기관 의료 시설 위기 대응 세계적 자문 선언 세계 특별 스트레스 브리핑 한참 종료 견해 착용 상황 강조,http://www.segye.com/content/html/2022/10/24/20221024508288.html,학생복지/교육격차해소,보건관리,학생및교직원보건안전관리,감염병예방관리,"코로나19 대응, 학교 방역, 전염병 예방교육, 감염병 관리 지침",0.6545653343200684
1100701.20221027,20221027,세계일보,농사나 지어라 초등생에 막말 한 교사 경찰 아동복지법 위반 혐의 조사키로,학생들 막말 학부모 학부모들 진술서 심리치료 복지법 키로 학생 교사 조사 경찰 혐의 항의 위반 학교 아동 농사 교직 치료 돌입 사과 심리 사실 등교 예정 진행 자신 입장,http://www.segye.com/content/html/2022/10/26/20221026511421.html,교육활동지원,생활지도운영,학교폭력예방,가해학생선도,"가해학생 상담, 선도교육 프로그램, 처분대상자 교육",0.6542100310325623
1100901.20221019,20221019,중앙일보,트윈데믹 우려 만 13세이하 독감 예방접종 중점 시행,13세 김성호 코로나19 9세 조정관 중대본 코로나바이러스 확진자 면역력 항바이러스 안전부 전담병상 행정안전부 재난안전관리본부장 본부장 활성화 제2총괄 고령층 고위험군 의료대응체계 감염증 시간대 의료자원 달빛어린이병원 2주 439만 6개월 의료상담센터 대응체계,https://www.joongang.co.kr/article/25110292,학생복지/교육격차해소,보건관리,학생및교직원보건안전관리,감염병예방관리,"코로나19 대응, 학교 방역, 전염병 예방교육, 감염병 관리 지침",0.6538916826248169
1100751.202210261,20221026,아시아투데이,김해상록골프클럽 김해서부소방서와 위급상황 모의 훈련,생명지킴이팀 김해상록골프클럽 심정지 김해서부소방서 골든타임 응급상황 구급대 심실세동 관계자 소생술 경남 심폐소생술 김태춘 김성옥 자동심장충격기 충격기 이철우 상록골프클럽 김해 응급처치법,https://www.asiatoday.co.kr/view.php?key=20221026010013526,교육활동지원,생활지도운영,학생안전교육,응급처치교육,"응급처치 교육, 심폐소생술 교육, 응급 상황 대처",0.6538662910461426
1100401.20221021,20221021,동아일보,마스크 대중교통 등 특정 장소만 의무화 검토,코로나19 조규홍 복지부 대중교통 한국 의무화 의료기관 이기일 코로나바이러스 회원국 질병관리청 분들 전문가 21개국 가능성 수용도 관리청,https://www.donga.com/news/article/all/20221020/116057952/1,학생복지/교육격차해소,보건관리,학생및교직원보건안전관리,감염병예방관리,"코로나19 대응, 학교 방역, 전염병 예방교육, 감염병 관리 지침",0.6535131931304932
1100301.202210261,20221026,내일신문,경북도 교육전출금 제도개선 요구,경북도 전출금 무상급식비 교육청 교육전출금 법정전출금 비법정전출금 oecd 경북도교육청 도세 재정난 기획관 이철우 어린이집 불필요 급식비 지방교육청 1인 최혁준 1만 총예산 유치원,http://www.naeil.com/news_view/?id_art=439583,학생복지/교육격차해소,학생복지,학생장학금운영,도비특별장학금,"지방정부 장학금, 도비 장학 지원, 지역 인재 양성 장학금",0.6534553170204163
1100301.202210121,20221012,내일신문,영유아 초등생 온종일 돌봄 더 촘촘하게,중랑구 서울시 아이들 보호자 온종일 류경기 서울 면목7동 영유아 공동체 3곳 관계자 신내동 1층 망우본동 실내놀이터 해결사 중랑구청장 키움센터 묵동 안성맞춤,http://www.naeil.com/news_view/?id_art=438159,선택적교육활동,방과후학교운영,늘봄학교운영,늘봄학교(교실)운영,"늘봄학교 운영, 돌봄교실 확장, 온종일 교육체계, 학교 중심 돌봄",0.6534451842308044
1100101.20221013,20221013,경향신문,교육 돌아보기 ADHD 학생 지원이 절실하다,adhd 교사들 우리나라 특수교육 대상자 주의력 교육부 홍인기 학부모 세계보건기구 adhd학생들 유병 행동지원 전문교사 미국 결핍장애 과원교사 학령기,https://www.khan.co.kr/opinion/column/article/202210130300045,학생복지/교육격차해소,학생복지,교육복지우선,교육복지사인건비,"교육복지사 채용, 교육복지 인력 확충, 취약계층 교육 지원",0.6531030535697937
1100901.202210131,20221013,중앙일보,학업성취도평가 자율이냐 필수냐 교육청 국감서도 논란,교육감 부산 교육청 학업성취 교육감들 일제고사 맞춤형 더불어민주당 전교조 학업성취도 충북 교육부 강원 이정선 하윤수 윤건영 조희연 신경호 임종식 대구 김대중 강은희 일제식,https://www.joongang.co.kr/article/25108973,교육활동지원,교무업무운영,교무학사운영,교육과정평가,"교육과정 평가, 학교 운영 평가, 수업 평가",0.6530573964118958
