뉴스 식별자,일자,언론사,제목,특성추출(가중치순 상위 50개),URL,대분류,중분류,소분류,세부항목 예시,뉴스 일반 표현,유사도
1100201.202309141,20230914,국민일보,소망의 샘 뚝 끊긴 청소년 봉사활동,봉사활동 지역사회 참여율 사회봉사 온라인 청소년기 교육과정 교육적 우리나라 청소년들 활성화 학부모,,기본적교육활동,창의적체험활동,동아리활동,청소년단체활동,"청소년 단체 활동, 스카우트 활동, 청소년 봉사단, 학교 조직 활동",0.79073166847229
1100751.202309211,20230921,아시아투데이,전남교육청 학교정보화지원센터 운영 내실화,학교정보화 학내전산망 교육지원청 전남교육청 정보화 관계자 네트워크 pc 지원청 전산망 이명남 아시아투데이 전산직 내실화 공무원,https://www.asiatoday.co.kr/view.php?key=20230921010013097,교육활동지원,학습지원실운영,정보화실운영,학교정보지원,"학교 정보시스템, 정보화 기기 지원, 학교 IT 인프라",0.7793445587158203
1100701.202309262,20230926,세계일보,교육부 이주배경학생 에 한국어 교육 지원 강화,이주배경학생 한국어 교육부 다문화 장학금 이주호 부총리 지원방안 충남교육청 입국자 18만 서울청사 중도입국자 결혼이민 교과학습 다문화가정 사회관계 3배 3개월,http://www.segye.com/content/html/2023/09/26/20230926519926.html,학생복지/교육격차해소,교육격차해소,기타교육격차해소지원,다문화가정지원,"다문화가정 학생 지원, 다문화 교육 정책, 중도입국 학생",0.7768840789794922
1101001.202309071,20230907,한겨레,인력 시설 떠넘긴 채 늘봄학교 속도전만 무리한 추진,늘봄학교 학부모 비정규직 교육부 교사운동 늘봄 씨 돌봄전담사 한성준 서울시교육청 서울 도봉구 박동국 한겨레,http://www.hani.co.kr/arti/society/schooling/1107622.html,선택적교육활동,방과후학교운영,늘봄학교운영,늘봄전담인력운영,"늘봄교실 전담 인력, 학교 돌봄 전담자, 돌봄 인력 확충",0.7767600417137146
1101101.202309041,20230904,한국일보,교사 보호가 공교육 살리는 지름길 인천 5개 교원단체 대책 마련 촉구,인천 교사들 공교육 인천시교육청 전교조 김지현 49재 교육활동 힙동 안봉한 서울 인천지부 교육당국 지름길 실효성 병가 인천교사 수석부위원장 휴업일 인천네트워크 교육감 부위원장 인천지,https://www.hankookilbo.com/News/Read/A2023090413120005273,인적자원운용,교직원복지및역량강화,교직원복지,교육활동보호지원,"교권 보호 정책, 교사 폭력 방지, 교사 보호법, 교육활동 안전 확보",0.7754102349281311
1101101.202309081,20230908,한국일보,한동훈 교사 아동학대 사건 처리할 때 교권 보장해야,아동학대 법무부 한동훈 학생지도 교육부 형사법 불필요 비대면 유관부처 교육활동 발달상태 교육감 교육청 서면 각급 공동전담팀 필요성 수업권 구체화 불안정 관계자 검찰청 대상학생 지시사항,https://www.hankookilbo.com/News/Read/A2023090810010004454,인적자원운용,교직원복지및역량강화,교직원복지,교육활동보호지원,"교권 보호 정책, 교사 폭력 방지, 교사 보호법, 교육활동 안전 확보",0.7741391062736511
1100751.202309061,20230906,아시아투데이,고교처럼 초중학교도 경기 공동교육과정 확대,교육과정 중학교 실천학교 구안,https://www.asiatoday.co.kr/view.php?key=20230906010003183,기본적교육활동,교과활동,교과활동지원,공동교육과정운영,"고교 공동교육과정, 학교 간 교육과정 공유, 맞춤형 수업 운영, 교육과정 다양화",0.7740045189857483
1100801.202309261,20230926,조선일보,다문화 학생 학교밖서 한국어 배운다 우수 인재에겐 장학금 도,한국어 다문화 장학금 외국어 학생들 고등학생 학교들 지원액 사회관계 71곳 외부기관 장관회 교육부 9명 18만 전교생 장려금 재학생 3개월,https://www.chosun.com/national/education/2023/09/26/2KE7PVI7TVB37ECRD2TQRZUITI/?utm_source=bigkinds&utm_medium=original&utm_campaign=news,학생복지/교육격차해소,교육격차해소,기타교육격차해소지원,다문화가정지원,"다문화가정 학생 지원, 다문화 교육 정책, 중도입국 학생",0.771581768989563
1101101.202309132,20230913,한국일보,이주호 교권침해 신고 직통번호 마련하겠다,부총리 시도교육청 교육청 이주호 형사처벌 피해자 선생님 학생인권조례 교사들 교육활동 전화번호 교육부 윤석열 통합민원팀 지원청 불합리 교육지원청 서울청사 신고센터 117학교 신고 민원 대응 마련 교육 회의 학생,https://www.hankookilbo.com/News/Read/A2023091320520005820,인적자원운용,교직원복지및역량강화,교직원복지,교육활동보호지원,"교권 보호 정책, 교사 폭력 방지, 교사 보호법, 교육활동 안전 확보",0.7685699462890625
1100751.202309201,20230920,아시아투데이,충남교육청 생각하고 소통하는 학생회연합 대표 배움자리 운영,학생회 충남 학생회연합 학생자치 충남교육청 학생자치활동 이한복 공동체 교육청 김관태 아시아투데이 대표학생 지역별 김지철 집단지성 정체성 교육감 실제실습 지원청 진행법 지역학생회 활성화 학생참여 학생들 지원단 학생회연합회 학생지원단,https://www.asiatoday.co.kr/view.php?key=20230920010012287,기본적교육활동,창의적체험활동,자율·자치활동,학생자치회,"학생 자치회, 학생회 활동, 학교 자율 운영, 학생 참여 교육",0.7668059468269348
1100751.202309261,20230926,아시아투데이,이주배경 학생 한국어교육 강화 우수생엔 까지 장학금,다문화 한국어 이주배경학생 교육부 장학금 한국어학급 한국어교육 이주배경 고등학교 지역대학,https://www.asiatoday.co.kr/view.php?key=20230926010015967,학생복지/교육격차해소,교육격차해소,기타교육격차해소지원,다문화가정지원,"다문화가정 학생 지원, 다문화 교육 정책, 중도입국 학생",0.763684093952179
1100101.202309041,20230904,경향신문,학부모가 교사 지켜줘야죠 교육 공백 메우러 나온 학부모,학부모 학부모들 세종 교육청 통신문 가정통신문 선생님 자원봉사 학교장 일본 실과실 휴업일 학교재량 지부장 공교육 대전지역 8개 교사들 20여명 김현희 대전교사노동조합,https://www.khan.co.kr/national/national-general/article/202309041424001,학교일반운영,학교운영협력,학부모협력,학부모회활동지원,"학부모 활동, 참여교육 지원, 학교 행사 협조",0.7635233402252197
1100751.202309111,20230911,아시아투데이,오산시 환경미화원 대상 심페소생술 등 응급처치교육 진행,심폐소생술 응급상황 사용법 이용필 소생술 생활폐기물 장이준 오산시 오산 본부장 아시아투데이 시민들 심페소생술 미화원 대처법 근무중 기도폐쇄 충격기 자동심장,https://www.asiatoday.co.kr/view.php?key=20230911010006190,교육활동지원,생활지도운영,학생안전교육,응급처치교육,"응급처치 교육, 심폐소생술 교육, 응급 상황 대처",0.7618809342384338
1100751.20230921,20230921,아시아투데이,충북도교육청 교사 교육활동 보호 위한 5대 특단 조치 마련,교육활동보호 교육활동 충북도교육청 교육감 학부모 원스톱 문제행동 교육청 선생님 무분별 윤건영 충북,https://www.asiatoday.co.kr/view.php?key=20230921010012867,인적자원운용,교직원복지및역량강화,교직원복지,교육활동보호지원,"교권 보호 정책, 교사 폭력 방지, 교사 보호법, 교육활동 안전 확보",0.761802077293396
1100701.202309201,20230920,세계일보,교권 보호 위한 교육활동 정상화법 발의 정당한 지도행위는 정서적 학대로 보지 않기로,학대행위 의원실 교육활동 개정안 교사들 서울 뉴스1 학부모 여의도 공교육 중등교육법 법률안 대표발의 교육목적 교육법 송석준 복지법 이천시 아동보호 사각지대 전문가,http://www.segye.com/content/html/2023/09/20/20230920508057.html,인적자원운용,교직원복지및역량강화,교직원복지,교육활동보호지원,"교권 보호 정책, 교사 폭력 방지, 교사 보호법, 교육활동 안전 확보",0.7607933282852173
1100401.202309051,20230905,동아일보,학교 체육활동 대입에 반영해야 체육 없는 한국 교육 미래도 없다 세미나 개최,학생들 한국 한국체육기자연맹 연령대 체력장 참여율 문화체육관광부 최보근 체육활동 문제점 김대진 연세새봄의원 채용현 교육부 양종구 상명대학교 유상건 한양대학교 유영만,https://www.donga.com/news/Society/article/all/20230905/121022495/1,기본적교육활동,교과활동,체육교과활동,체육교육활성화,"체육 수업, 체력 증진 활동, 체육대회, 학생 스포츠 활동",0.7597252130508423
1101101.202309061,20230906,한국일보,서울 어린이집 급식 학교 수준으로 건강하게 식자재 공급망 통합,식재료 자치구 어린이집 공공급식 서울 서울시 농산물 162곳 공공급식센터 지자체 162곳 구종원 그동안,https://www.hankookilbo.com/News/Read/A2023090614360001563,학생복지/교육격차해소,급식관리,학교급식운영,급식재료구입비,"학교 급식, 급식 질, 친환경 식자재, 학교 식단",0.7590751051902771
1100501.20230919,20230919,문화일보,지역인재 키우는 전문대 특화산업 손잡고 지역과 동반성장,전문대학 rise 전문대교협 유학생 교육부 네트워킹 정주형 평생직업교육 지원단 지역사회,http://www.munhwa.com/news/view.html?no=2023091901032421172001,학교일반운영,학교운영협력,관계기관협력,지역관계기관협력,"지역 교육기관 협력, 지역사회 연계, 공공기관 협업",0.758807897567749
1100101.20230903,20230903,경향신문,서둘러 마련한 교권 보호책 현장서 시끄러운 이유,아동학대 학부모 생활지도 학생인권조례 교권침해 종합방안 부여 교육청 생기부 교육법,https://www.khan.co.kr/national/education/article/202309030830001,인적자원운용,교직원복지및역량강화,교직원복지,교육활동보호지원,"교권 보호 정책, 교사 폭력 방지, 교사 보호법, 교육활동 안전 확보",0.7586678266525269
1100101.202309261,20230926,경향신문,이제는 이주배경학생도 한국의 인재 정부 각종 지원 방안 마련,다문화 한국어 이주배경학생 외국어 한국어교육 장학금 대학생 서울청사 이중언어 지원방안 다문화교육지원센터 인공지능 디지털교과서 다국어번역,https://www.khan.co.kr/national/education/article/202309261400001,학생복지/교육격차해소,교육격차해소,기타교육격차해소지원,다문화가정지원,"다문화가정 학생 지원, 다문화 교육 정책, 중도입국 학생",0.7567710876464844
1100611.202309201,20230920,서울신문,광주시교육청 학교별 특색 키우는 자치학교 확대,자치학교 광주시교육청 내년도 교육청 혁신학교 만족도 과제도 본예산 그동안 예시안 연구학교 사례집 수업지원 신청서 광주 지역사회 이정선 교육과정 인성교육 교육정책 위원회 책무성 구성원,http://www.seoul.co.kr/news/newsView.php?id=20230920500074,교육활동지원,연구학교운영,연구학교운영,시도교육청지정,"교육청 지정 연구학교, 시도교육청 시범학교",0.7556023001670837
1100801.202309101,20230910,조선일보,마스크 다시 착용할까 서 코로나 확진자 늘자 논의 활발,코로나 교육구 미국 이탈리아 학생들 la 루스코니 직원들 확진자 호흡기 비브 팬데믹 자가격리,https://www.chosun.com/international/international_general/2023/09/10/43BAV4UJERDKJLIBN4NINZ6AGE/?utm_source=bigkinds&utm_medium=original&utm_campaign=news,학생복지/교육격차해소,보건관리,학생및교직원보건안전관리,감염병예방관리,"코로나19 대응, 학교 방역, 전염병 예방교육, 감염병 관리 지침",0.7533129453659058
1100401.20230913,20230913,동아일보,선생님이 학폭서 지켜줘 피해 학생들의 교권보호 호소,학교폭력 학폭 피해자 선생님 전문가 최선희 교사들 푸른나무재단 박길성 고등학교 기자회견 김수연 학부모,https://www.donga.com/news/Society/article/all/20230913/121151462/1,인적자원운용,교직원복지및역량강화,교직원복지,교육활동보호지원,"교권 보호 정책, 교사 폭력 방지, 교사 보호법, 교육활동 안전 확보",0.75321364402771
1100611.202309181,20230918,서울신문,경남교육청 교육활동 보호강화방안 발표 교원 84 교육활동 침해 심각하다 인식,교육활동 경남 교육감 교육청 경남교육청 온라인 학부모 경남도교육청 설문조사 심리검사,http://www.seoul.co.kr/news/newsView.php?id=20230918500210,인적자원운용,교직원복지및역량강화,교직원복지,교육활동보호지원,"교권 보호 정책, 교사 폭력 방지, 교사 보호법, 교육활동 안전 확보",0.7496007680892944
1100401.20230925,20230925,동아일보,1대1 상담 필요한 학폭 가해자 교육 청소 자습 시간 때우기,학폭 특별교육 상담교사 교육청 이수 학부모 가해자 시간date,https://www.donga.com/news/Society/article/all/20230925/121347813/1,교육활동지원,생활지도운영,학교폭력예방,가해학생선도,"가해학생 상담, 선도교육 프로그램, 처분대상자 교육",0.7470625042915344
1101101.202309121,20230912,한국일보,학생 책임 강조 교사 학습권 강화 경기교육청 학생인권 교권보호 조례 개정안 마련,개정안 경기도 교육활동 학교장 경기도교육청 경기도의회 교권보호조례 경기교육청 교권보호 학습권 학생인권 황진희 도의회 보호자,https://www.hankookilbo.com/News/Read/A2023091210070002298,인적자원운용,교직원복지및역량강화,교직원복지,교육활동보호지원,"교권 보호 정책, 교사 폭력 방지, 교사 보호법, 교육활동 안전 확보",0.7451446056365967
1100801.202309081,20230908,조선일보,한동훈 교사의 정당한 학생 지도와 교권 충실히 보장하라 절차 개선 지시,아동학대 한동훈 법무부 형사법 대검찰청 교육감 중요성 관계인 교육부 공동전담팀 교육청 관계자 특수성 불안정 무분별 교사 장관 처리 사건 현장 집행 개선 수사 지시 위축 보장 교권 학교 존중,https://www.chosun.com/national/court_law/2023/09/08/BN5VWVPGRVCBBN4RDGMHPWQ44Q/?utm_source=bigkinds&utm_medium=original&utm_campaign=news,인적자원운용,교직원복지및역량강화,교직원복지,교육활동보호지원,"교권 보호 정책, 교사 폭력 방지, 교사 보호법, 교육활동 안전 확보",0.7439368367195129
1101101.202309041,20230904,한국일보,장학금 100 등록금 0 상상 이상의 혜택과 지원,장학금 등록금 남해대학 교육부 도립대학 신입생 편입학 원서접수 000원 학기당 수시모집 취업약정 경남,https://www.hankookilbo.com/News/Read/A2023082317460004685,학생복지/교육격차해소,학생복지,학생장학금운영,학생장학금지원,"장학금 지급, 학생 장학 제도, 교육비 지원, 장학생 선발 공고",0.7438134551048279
1101001.202309201,20230920,한겨레,소통 대화하는 학교 문화 관료적 교장제 손질이 첫발,학부모 선생님 교육청 서울 아동복지법 평교사 학부모님 교사들 전교조 활성화 교장제 강점기 교육부 교장들 변호사 왜냐면 김천영 첫발 군산 여주지 검찰청 황국신민 청주 후배들 꼬리표,http://www.hani.co.kr/arti/opinion/because/1109401.html,학교일반운영,학교운영협력,관계기관협력,주민참여학교운영,"주민 참여 학교, 지역 개방형 학교, 학교 공동체 운영",0.7431050539016724
1101101.202309041,20230904,한국일보,윤 대통령 교사들 목소리 깊이 새겨 교권확립 교육현장 정상화 만전 기하라,교사들 교육현장 서울 공교육 8가지 복지법 정책요구안 학부모 의사당 의무화 49재 교육당국 교권확립 명가량 윤석열 서이 교사 교육 대통령 추모 목소리 현장 개정 학생,https://www.hankookilbo.com/News/Read/A2023090410170004698,인적자원운용,교직원복지및역량강화,교직원복지,교육활동보호지원,"교권 보호 정책, 교사 폭력 방지, 교사 보호법, 교육활동 안전 확보",0.7418582439422607
1100201.202309252,20230925,국민일보,경기도교육청 최초 사회복지직 공무원 배치,교육복지 공무원 도교육청 교육지원청 맞춤형 김영훈 교육복지안전망 지원청 자격증 교육취약 안전망 경기도교육청 사각지대 전문가 실무경험 협의회 미배치 복지사 통합지원 교육복지과장 학생들 교육복지지원,https://news.kmib.co.kr/article/view.asp?arcid=0018707053&code=61121111&cp=kd,학생복지/교육격차해소,학생복지,교육복지우선,교육복지사인건비,"교육복지사 채용, 교육복지 인력 확충, 취약계층 교육 지원",0.7410507798194885
1100801.20230919,20230919,조선일보,지자체 교육청도 재원 확보 비상,지자체 교육청 11조 지방교육재정교부금 관계자 23조 행안부 59조 잉여금 13조 통합재정안정화 교부금 지방교부세 고기동 구조조정 불요불급 통합교육재정안정화,https://www.chosun.com/economy/economy_general/2023/09/19/BJNPQDJ7MVGYJPJOAG7SKVDHJU/?utm_source=bigkinds&utm_medium=original&utm_campaign=news,학교재무활동,예비비,예비비,예비비,"교육청 예비비, 긴급 예산 편성, 비상 재정 집행",0.7404168248176575
1100901.20230925,20230925,중앙일보,국민을 위한 국민의 기업 장애아가족 양육지원 등 장애아동 생애주기에 맞춘 촘촘한 지원,발달장애인 장애인 한국장애인개발원 장애아 생애주기 보호자 선생님 보건복지부 발달장애인지원센터 김현정 재활치료 뇌손상 사법절차 김씨 중앙장애아동 8개월 제주시 워킹맘 지역발달장애인지원센터 힐링캠프 아이들 후견심판청구지원 전문교육과정 자립준비 주간활동서비스,https://www.joongang.co.kr/article/25195066,기본적교육활동,창의적체험활동,봉사활동,장애학생돌보기,"장애학생 돌봄, 특수학생 지원 활동, 장애인식 개선 봉사, 통합교육 봉사활동",0.7398487329483032
1100751.202309141,20230914,아시아투데이,충남교육청 교육과정평가정보원 학교 관리자 정보 역량 강화 연수 진행,직무연수 교육과정평가정보원 인공지능 정보원 관리자 배무룡 세미나실 김관태 아시아투데이 활용법 파워포인트 ai 산업혁명 만족도 교원들 4차 충남 학생들 교육청 이해도 미래교육,https://www.asiatoday.co.kr/view.php?key=20230914010008734,인적자원운용,교직원복지및역량강화,교직원역량강화,직무연수,"교사 연수, 직무교육, 교사 역량 강화 프로그램",0.7385528087615967
1100501.202309121,20230912,문화일보,정당한 교권 보장 가이드라인 지시,아동학대 교육감 교육법 교육부 교육위 사회상규 경찰청 상규 교사들 법무부,http://www.munhwa.com/news/view.html?no=2023091201070630207001,인적자원운용,교직원복지및역량강화,교직원복지,교육활동보호지원,"교권 보호 정책, 교사 폭력 방지, 교사 보호법, 교육활동 안전 확보",0.7379804253578186
1100301.202309211,20230921,내일신문,초등 2학년 수학의 지도 방법,2학년 자연수 덧뺄셈 삼각형 일상생활 아이들 곱하기 서술형 놀이식 부모님 3학년 사각형 평면도형 덧셈 수연산 파워영재학원 4학년 구구단 연산 이해 수학 곱셈 완성 도형 생활 개념 정도 사각 영역 어려움 나눗셈 시작 깊이 실질적 아이,http://www.naeil.com/news_view/?id_art=474475,기본적교육활동,교과활동,수학교과활동,수학교과운영,"수학 수업, 수학 보충수업, 수학 창의력 프로그램, 수학 체험활동",0.7376893162727356
1101101.202309141,20230914,한국일보,한국생명과학고 찾아가는 봉사 눈길,학업중단 한국생명과학고 유관기관 아웃리치 학생들 학폭 학생회 박종진 봉사활동 경북 안동시 오랫만 경찰서 상담자 안동교육지원청과 사각지대 청소년들 중요성 한국생명과학고등학교 아웃리 시간date 예방 청소년,https://www.hankookilbo.com/News/Read/A2023091407430004886,기본적교육활동,창의적체험활동,봉사활동,봉사캠페인,"학생 봉사활동, 사회공헌 캠페인, 학교 내 봉사 문화, 지역사회 기여",0.7371066808700562
1100501.202309011,20230901,문화일보,교원의 정당한 생활 지도는 아동학대 서 예외 교권회복 법 개정 추진,교육활동 교권회복 교육감 생활지도 위원회 위원장 기본법 교육청 학교장 아동학대 이주호 지역교권 교육법 4자 협의체 법안소위 조희연 임태희 시도교육감,http://www.munhwa.com/news/view.html?no=2023090101039930207001,인적자원운용,교직원복지및역량강화,교직원복지,교육활동보호지원,"교권 보호 정책, 교사 폭력 방지, 교사 보호법, 교육활동 안전 확보",0.7365003228187561
1101101.202309261,20230926,한국일보,이중언어 능통한 이주배경학생 대학 졸업 때까지 장학금 받는다,한국어 다문화 이주배경학생 장학금 교부금 중도입국 예비과정 정책학교 이중언어 우수인재 직업계 110억 000명 다국어 외국인,https://www.hankookilbo.com/News/Read/A2023092614060005229,학생복지/교육격차해소,교육격차해소,기타교육격차해소지원,다문화가정지원,"다문화가정 학생 지원, 다문화 교육 정책, 중도입국 학생",0.7348293662071228
1100611.20230905,20230905,서울신문,사설 그래도 선생님뿐 교사 존경하는 사회 만들어야,교권회복 공교육 교사들 서울 선생님 참가자 아동학 학부모들 추모일 학부모 조치들 무력감 추모제 제주도교육청 교육법 이주호 고시안 재량휴업 아동학대 5000여명 지위법,http://www.seoul.co.kr/news/newsView.php?id=20230905027006,인적자원운용,교직원복지및역량강화,교직원복지,스승의날행사,"스승의날 기념식, 교사 존중 문화, 교원 감사 행사",0.7330308556556702
1100401.20230912,20230912,동아일보,대학이 끌고 지자체가 밀고 직업교육 시대 활짝 열었다,계명문화대 달서구 평생직업교육 전문가 지역민 지자체 종사자 교육과정 온라인 6개 모집난,https://www.donga.com/news/Society/article/all/20230911/121131560/1,선택적교육활동,직업교육,직업교육운영,직업교육운영,"직업교육, 진로직업 교육, 기술교육 강화, 실무형 인재 양성",0.7328997850418091
1100901.20230926,20230926,중앙일보,교육이 미래다 간호 보건계열 전문 인재 양성에 주력,계명문화대학교 신입생 계명대 지원자 학습자 교과전 실습기관 특성화 고전형 치료과 작업치료과 보건계열 최저학력기준 특기자전 응급구조 교육부 간호학과 간호학 치위생과 학년도 정원 모집 수시 교육 학과 가능 고전,https://www.joongang.co.kr/article/25195445,선택적교육활동,직업교육,직업교육운영,직업교육운영,"직업교육, 진로직업 교육, 기술교육 강화, 실무형 인재 양성",0.7313409447669983
1100801.202309042,20230904,조선일보,교사 목소리 깊이 새겨 교권확립 만전 기하라,개정안 교육부 교육법 연결음 교사들 교육위 교원지위법 지위법 본회의 관계자 기하라,https://www.chosun.com/national/education/2023/09/04/NXN2V2JAOJB3DCDQV7VDRPPCSE/?utm_source=bigkinds&utm_medium=original&utm_campaign=news,인적자원운용,교직원복지및역량강화,교직원복지,교육활동보호지원,"교권 보호 정책, 교사 폭력 방지, 교사 보호법, 교육활동 안전 확보",0.7296674847602844
1100401.20230904,20230904,동아일보,자율전공으로 충분한 진로탐색 기회 제공,세종캠퍼스 학생부종합 학생부교과 세종 홍익대 고등학교 서울 서울캠퍼스 학생부 캠퍼스자율 이수 자연계열 학교생활 1단계 자전형 기록부 학년도 학교장추천자전형 미술우수자전형 우수자 논술전형 학교생활기록부 홍익대학교 고른기회,https://www.donga.com/news/Society/article/all/20230902/120985349/1,기본적교육활동,자유학기(년)활동,자유학기활동,진로탐색활동,"진로탐색 프로그램, 자유학기제 활동, 학생 진로 설계, 자기주도 진로활동",0.7288919687271118
