뉴스 식별자,일자,언론사,제목,특성추출(가중치순 상위 50개),URL,대분류,중분류,소분류,세부항목 예시,뉴스 일반 표현,유사도
1100901.202203281,20220328,중앙일보,서울여자대학교 2022년해빙기교육시설안전점검진행,해빙기 안전점검 서울여대 외부전문가 방상석 성기현 학부모 바롬인성교육관 승현우 전문가 서울여자대학교 총학생회 부처장 신체변화 사무처장 겨울철 조대하 도서관 샬롬하우스 누리관 여름철 중요성 교육부 디엔엠엔지니어링 기숙사 처벌법 1층 안전상태,https://www.joongang.co.kr/article/25058922,학생복지/교육격차해소,보건관리,학생및교직원보건안전관리,산업안전보건관리,"학교 산업안전, 작업장 안전, 산업안전 교육, 교직원 안전관리",0.6160475611686707
1100901.20220329,20220329,중앙일보,인사 교육부,위원회 교육부 김선욱 권오상 대구시 지역균형발전특별위원회 장미란 일자리 정책 과장 균형 지역 발전 특별 인수 노동 대통령 지원 교통,https://www.joongang.co.kr/article/25059004,학교일반운영,학교기관운영,부서기본운영,교육행정업무운영,"교육행정 운영, 학교 행정 업무, 학사관리 행정 지원",0.6158995628356934
1100401.202203211,20220321,동아일보,국민 5명 중 1명 감염 주중 누적확진 1000만 돌파할 듯,확진자 코로나19 미국 오미크론 스텔스 의료진 손영래 보건의료노조 20만 전문가 전파력 감소세 위중증 사망자 정은경 대다수 김우주,https://www.donga.com/news/article/all/20220321/112457397/1,학생복지/교육격차해소,보건관리,학생및교직원보건안전관리,감염병예방관리,"코로나19 대응, 학교 방역, 전염병 예방교육, 감염병 관리 지침",0.6158910989761353
1100701.202203081,20220308,세계일보,정상등교 고수에 확진자 폭증 대체교사도 구인난,교육부 확진자 코로나19 만큼 고등학생 일평균 유치원 정상등교 유은혜 서울 대체인력 교직원 입학식 10만 광주 등교수업,http://www.segye.com/content/html/2022/03/08/20220308516464.html,인적자원운용,기타교직원보수,교직원대체인건비,교원대체인건비,"기간제 교사, 대체 교사, 출산휴가 교사, 교사 인력난",0.6157609224319458
1100401.202203061,20220306,동아일보,왜 아직 교복을 안주냐 사복 체육복 입은 학생들 무슨일,체육복 학생들 학부모 대리점 서울 오미크론 코로나19 확진자 코로나 관계자 고등학교 코로나바이러스 딸아이,https://www.donga.com/news/article/all/20220306/112188485/1,학생복지/교육격차해소,학생복지,학생복지운영,교복/체육복구입,"무상 교복, 학생 교복 지원, 체육복 지원 사업",0.615566611289978
1100501.202203171,20220317,문화일보,확진학생 23 증가 숨은감염자 우려도 커 불안한 학교,교육부 감염자 부총리 확진자 키트 검사소 교직원 오미크론 남동구 안성시 유은혜 코로나19 인천 pcr 2배 서울 더블링 2만 27만,http://www.munhwa.com/news/view.html?no=2022031701070803022001,학생복지/교육격차해소,보건관리,학생및교직원보건안전관리,감염병예방관리,"코로나19 대응, 학교 방역, 전염병 예방교육, 감염병 관리 지침",0.6155480742454529
1100901.202203161,20220316,중앙일보,코로나 1급 감염병 서 해제 검토 격리 풀리지만 치료비 부담 늘 듯,감염병 코로나19 1급 확진자 치료비 방대본 손영래,https://www.joongang.co.kr/article/25055939,학생복지/교육격차해소,보건관리,학생및교직원보건안전관리,감염병예방관리,"코로나19 대응, 학교 방역, 전염병 예방교육, 감염병 관리 지침",0.6155410408973694
1100701.202203061,20220306,세계일보,다음주도 등교 가능할까 정점 시기 교내감염 규모 관건,교육부 오미크론 원격수업 다음주 확진자 수도권 영업시간,http://www.segye.com/content/html/2022/03/06/20220306506966.html,학생복지/교육격차해소,보건관리,학생및교직원보건안전관리,감염병예방관리,"코로나19 대응, 학교 방역, 전염병 예방교육, 감염병 관리 지침",0.6155049204826355
1100751.202203031,20220303,아시아투데이,KT G 임직원 자녀 초 중 고 입학 축하선물 전달,임직원 휴직제도 육아휴직 코로나19 직원들 이상선 축하선물 화훼농가 가족부 자녀양육 출산휴가 부여 리프레쉬 고등학교 모범적 가족친화경영 임직원들 ceo 휴직,https://www.asiatoday.co.kr/view.php?key=20220303010001651,인적자원운용,교직원복지및역량강화,교직원복지,생일기념경비,"교직원 생일 축하, 교원 생일 경조비, 복지성 생일 지원, 사기 진작 경비",0.6154353618621826
1100611.202203171,20220317,서울신문,코로나로 아픈데 쉬지 말라 는 직장 회사 말아먹을래 폭언까지,코로나19 자가격리 박씨 자가진단키트 직장인 유급휴가 오미크론 사무실 감염병 진단키트 사망자 이씨 직장인들 pcr 직원들,http://www.seoul.co.kr/news/newsView.php?id=20220317500180,학생복지/교육격차해소,보건관리,학생및교직원보건안전관리,감염병예방관리,"코로나19 대응, 학교 방역, 전염병 예방교육, 감염병 관리 지침",0.6153466105461121
1100701.202203211,20220321,세계일보,학교서 배운 대로 심정지 행인 심폐소생술로 살린 중학생,심폐소생술 흥진중 함주원 심정지 중학교 제세동기 1학년 소생술 김소율 흥진중학교 강순심 6명 생술 모범상 교사들 군포의왕 어른들 이수경 구급대 게티이미지뱅크 심장제세동기 중학생 심장제세 당황 군포시 박수빈 지원청,http://www.segye.com/content/html/2022/03/21/20220321514493.html,교육활동지원,생활지도운영,학생안전교육,응급처치교육,"응급처치 교육, 심폐소생술 교육, 응급 상황 대처",0.6152343153953552
1100751.202203281,20220328,아시아투데이,대전교육청 긴급 수업지원단 오미크론 상황 수업지원 총력,오미크론 대전교육청 지원단 수업지원 수업지원단 장학사 인력풀 미발령자 교육지원청 황현태 이상선 연구사 지원청 직속기관 명예퇴직 구성원 교육전문직 대학교 코로나19 중등학교 전문직 교육연구사 수업공백 확진자,https://www.asiatoday.co.kr/view.php?key=20220328010016165,선택적교육활동,기타선택적교육활동,기타선택적교육운영,위탁교육운영,"위탁 교육 운영, 특수기관 위탁교육, 외부 기관 연계 수업",0.6151471138000488
1100611.20220329,20220329,서울신문,국립대병원 의료진 위중증 치료 한계 인력 충원 시급,의료진 코로나19 국립대병원 국립대 청와대 연대체 의료진들 정재범 한지연 노동조합 위중증 강원대병원 서울 분수대 기자회견 분회장,http://www.seoul.co.kr/news/newsView.php?id=20220329010012,학생복지/교육격차해소,보건관리,학생및교직원보건안전관리,보건실운영,"학교 보건실, 응급처치 공간, 보건실 예산, 보건관리 시설",0.6151438355445862
1100701.202203231,20220323,세계일보,정부 정점 불확실 스텔스 유행에 길어진 듯,확진자 코로나19 감소세 오미크론 고령층 방대본 위중증 서울 박향 손영래 중앙사고수습본부 중수본,http://www.segye.com/content/html/2022/03/23/20220323513522.html,학생복지/교육격차해소,보건관리,학생및교직원보건안전관리,감염병예방관리,"코로나19 대응, 학교 방역, 전염병 예방교육, 감염병 관리 지침",0.6149239540100098
1100611.20220314,20220314,서울신문,2주마다 다른 지침 교사들 확인하기도 버거워,학생들 코로나19 키트 교사들 이씨 확인서 확진자 학부모 오미크론 pcr 중학교 소분 2주 교육당국 유전자,http://www.seoul.co.kr/news/newsView.php?id=20220314010009,학생복지/교육격차해소,보건관리,학생및교직원보건안전관리,감염병예방관리,"코로나19 대응, 학교 방역, 전염병 예방교육, 감염병 관리 지침",0.6149237751960754
1100401.20220318,20220318,동아일보,모텔 전전하는 확진자 회사 학교 기숙사 감염땐 나가라,확진자 기숙사 코로나19 생활치료센터 전남 지자체 재택치료자 재택치료 최선관 치료자 빈집 서울 보건소 감염증 일주일,https://www.donga.com/news/article/all/20220317/112387878/1,학생복지/교육격차해소,보건관리,학생및교직원보건안전관리,감염병예방관리,"코로나19 대응, 학교 방역, 전염병 예방교육, 감염병 관리 지침",0.6148688197135925
1100751.202203021,20220302,아시아투데이,금강환경청 푸른환경지킴이 참가학교 모집,누리집 금강유역환경청 환경교육 충북 활동비 중학교 청소년들 금강환경청 오염도 참가학교 전북 정종선 이상선 환경지킴이 푸른환경지킴이 금강수계 장학금 400만 대전시 참여학생 영동군 세종시 옥천군 진천군 지속가능 금강유역환경청장상 충남 보은군,https://www.asiatoday.co.kr/view.php?key=20220302010001038,기본적교육활동,창의적체험활동,봉사활동,환경미화활동,"학교 환경미화, 교내 청소활동, 녹색 환경 캠페인, 학생 환경 보호활동",0.6148484349250793
1100751.202203061,20220306,아시아투데이,경남도교육청 오미크론 등교 중지 학생 학습권 보장 강화,실시간 온라인 대체학습 오미크론 아이톡톡 유프리즘 쌍방향 박현섭 창원 빅데이터 상호작용 경남,https://www.asiatoday.co.kr/view.php?key=20220306010003027,기본적교육활동,교과활동,교과활동지원,원격수업,"온라인 수업, 비대면 수업, 디지털 학습, 원격 교육",0.6148220300674438
1100751.20220331,20220331,아시아투데이,경남교육청 자유학년제 환경 수업 확대,경남교육청 생태전환교육 중학교 경남 지원청 유상조 허균 창원 공동체 교육청 세자트라숲 통영알씨이 세자트라센터 교육학교 숲교육학교 경남환경교육원 토론회 참석자 참석자들 교육원,https://www.asiatoday.co.kr/view.php?key=20220331010018225,교육활동지원,연구학교운영,연구학교운영,교육지원청지정,"교육지원청 지정 연구학교, 지역 연구학교",0.6147591471672058
1100701.202203021,20220302,세계일보,이재명 학생이 학교 청소하는 부담 없앤다 전문 청소 인력 도입,서울 더불어민주당 정책본부 교무실 이재명 위원회 명동 교육청 교육적 대한민국 인권침해 교직원 선대위 서울교육청 대다수,http://www.segye.com/content/html/2022/03/02/20220302517157.html,교육활동지원,교무업무운영,교무학사운영,환경정리활동,"학교 환경 정비, 정리정돈 활동, 학생 환경 봉사",0.6147423982620239
1100611.20220323,20220323,서울신문,속보 김총리 앞으로 1 2주 코로나 극복 전환점,오미크론 코로나 전환점 코로나19 최소화 중대본 180만 감소세 치료제 방역체계 재택치료 중증도 국무총리 스텔스오미크론 서울청사 확진자 김부겸 2주 입원율 의료현장 전파력 김총리 중증 검사 치료 차이 정부 의료 체계 총리 상황 극복 일반 최소,http://www.seoul.co.kr/news/newsView.php?id=20220323500019,학생복지/교육격차해소,보건관리,학생및교직원보건안전관리,감염병예방관리,"코로나19 대응, 학교 방역, 전염병 예방교육, 감염병 관리 지침",0.6146809458732605
1100101.202203211,20220321,경향신문,취업난 등록금에 대학생 3명 중 1명 고도 스트레스 낮은 가구소득 부모 학력 자녀 스트레스,대학생 장학금 고스트레스 등록금 중스트레스 저스트레스 연구진 교육학 홍세희 이은진 고려대 월평균 가구소득 한국자료 한국자료분석학회지 한국장학패널 학회지 석사과정생 학생들 다자녀 다자녀장학금 국가장학금,https://www.khan.co.kr/national/education/article/202203211539011,학생복지/교육격차해소,학생복지,학생장학금운영,학생장학금지원,"장학금 지급, 학생 장학 제도, 교육비 지원, 장학생 선발 공고",0.6146687269210815
1101001.202203152,20220315,한겨레,오후 9시까지 전국서 44만1423명 확진 정부 예측치 크게 넘어서,확진자 코로나19 치료제 방대본 집중관리군 관리군 신속항원검사 팀장 재택치료 오미크론,http://www.hani.co.kr/arti/society/health/1034984.html,학생복지/교육격차해소,보건관리,학생및교직원보건안전관리,감염병예방관리,"코로나19 대응, 학교 방역, 전염병 예방교육, 감염병 관리 지침",0.6144687533378601
1100701.20220315,20220315,세계일보,다양해지는 코로나 후유증 국가적 대비 필요,코로나19 후유증 코로나 확진자 직장인 코비드 오미크론 3개월 장기간 가려움증 김우주 미국 구로병원 전문가들 코로나바이러스 사람들 만성병 환자들 만큼 헤르페스,http://www.segye.com/content/html/2022/03/15/20220315503912.html,학생복지/교육격차해소,보건관리,학생및교직원보건안전관리,감염병예방관리,"코로나19 대응, 학교 방역, 전염병 예방교육, 감염병 관리 지침",0.6142212748527527
1101101.202203181,20220318,한국일보,의료현장 붕괴 수준 치닫는데 치명률은 낮다 라는 정부,사망자 확진자 오미크론 자영업자 전문가 방역당국 그간 30만 전주 코로나19 권덕철 손영래,https://hankookilbo.com/News/Read/A2022031815240000525,학생복지/교육격차해소,보건관리,학생및교직원보건안전관리,감염병예방관리,"코로나19 대응, 학교 방역, 전염병 예방교육, 감염병 관리 지침",0.6141349077224731
1100501.20220308,20220308,문화일보,서초구 새 학기 맞아 청소년 대상 다양한 북큐레이션 프로그램 운영,북큐레이션 book 도서관 bbti 자료실 태블릿 큐레이션 합성어 일요일 공휴일 화요일 꿈자 람터 mbti 학생들 스마트메이커팩토리 그림책 서울 열람실 청소년들 type indicator curation pc 청소년 지하 운영 미래,http://www.munhwa.com/news/view.html?no=20220308MW080406379733,선택적교육활동,독서활동,독서활동운영,도서관운영,"학교 도서관, 도서관 활성화, 도서관 이용 교육",0.6141076683998108
1100801.2022031,20220310,조선일보,독자 마당 초 중 고교 원격 수업으로 돌려야 외,우크라이나 확진자 1주 협력국 11세 코로나 요충지 우리나라 오미크론 건국대 개발원조 유럽 러시아 이혜진 중앙아시아 지원을 학부모 혜광고 우정렬 유럽연합,https://www.chosun.com/opinion/readers_opinion/2022/03/10/POQKKBO4IFCNVODSPSNECVH4YU/?utm_source=bigkinds&utm_medium=original&utm_campaign=news,학생복지/교육격차해소,보건관리,학생및교직원보건안전관리,감염병예방관리,"코로나19 대응, 학교 방역, 전염병 예방교육, 감염병 관리 지침",0.614107072353363
1100611.202203011,20220301,서울신문,초등학교 입학자녀 둔 건설근로자에 학용품 책가방 지원,근로자 건설근로자 공제회 퇴직공제 증명서 20만 건설근로자공제회 자녀양육 학부모 전자카드 학용품 hanaro 직전년도 적립일수 가족관계증명서 노동부 대상자 바우처 온라인 지원사업 책가방 지원 자녀 신청 카드 직전 산하,http://www.seoul.co.kr/news/newsView.php?id=20220301500061,선택적교육활동,독서활동,독서활동운영,도서구입,"학교 도서 구입, 도서 예산, 교과 연계 도서 지원",0.6141036152839661
1100901.202203011,20220301,중앙일보,경기도 코로나 응급환자 의료기관 이송지연 사고 막는다,코로나19 확진자 경기도 응급환자 보건소 3만 코로나 응급실 소방서 핫라인 5만,https://www.joongang.co.kr/article/25052029,학생복지/교육격차해소,보건관리,학생및교직원보건안전관리,감염병예방관리,"코로나19 대응, 학교 방역, 전염병 예방교육, 감염병 관리 지침",0.6140251755714417
1100401.202203171,20220317,동아일보,박범계 법무장관 신속항원 검사서 코로나19 양성 판정,법무부 박범계 코로나19 재택치료 감염증 간담회 전문가 온라인 속항원 코로나바이러스 rat 장관 검사 기간 양성 판정 치료 결과 신종 재택 확진 업무 현안 보고 각종 방문 참석 화상 현장 일정 접촉,https://www.donga.com/news/article/all/20220317/112377030/1,학생복지/교육격차해소,보건관리,학생및교직원보건안전관리,감염병예방관리,"코로나19 대응, 학교 방역, 전염병 예방교육, 감염병 관리 지침",0.6139388680458069
1100301.202203241,20220324,내일신문,LGCNS 청소년 AI 교육,인헌중학교 ai 서울시 지니어스 lgcns 농어촌 학교 수업 제공 교육 로봇 사진 지역 청소년 학생 자율 주행 시작 연말 중학 무료 특수 포함,http://www.naeil.com/news_view/?id_art=417949,기본적교육활동,교과활동,정보교과활동,정보교과운영,"정보 수업, 코딩 교육, 소프트웨어 교육, 디지털 리터러시",0.613922119140625
1100901.20220317,20220317,중앙일보,이주호의 퍼스펙티브 대학을 살리고 싶은가 교육부 통제부터 풀어야,교육부 혁신생태계 우리나라 미국 인수위 그동안 과학기술정보통신부 고위험 관료주의 위원회 실리콘밸리,https://www.joongang.co.kr/article/25056095,교육활동지원,연구학교운영,연구학교운영,교육부지정,"교육부 지정 연구학교, 시범학교 운영, 정책 실험학교",0.6138898134231567
1100701.202203302,20220330,세계일보,마스크 두 겹에 잘 때도 쓰고 자 음성 아이 지키려는 양성 부모들 이슈,코로나19 자가키트 키트 맘카페 부모들 임씨 일주일 아이들 검사소 상비약 화장실 전염성 의료진 서울역 끼리 해열제 강남구 열경기 인후통 모유수유 서울 응급실 검사키트 개씩 비닐장갑 방역수칙 40도 머릿속,http://www.segye.com/content/html/2022/03/30/20220330517559.html,학생복지/교육격차해소,보건관리,학생및교직원보건안전관리,감염병예방관리,"코로나19 대응, 학교 방역, 전염병 예방교육, 감염병 관리 지침",0.6137741208076477
1100501.202203081,20220308,문화일보,정부 계절독감 운운하더니 위중증 다시 1000명 넘었다,위중증 코로나19 확진자 오미크론 중환자 코로나 방역당국 ba2 중증도 전파력 스텔스 목동병원 천은미 엄중식 중앙방역대책본부 길병원 의료현장 중증환자 중증화,http://www.munhwa.com/news/view.html?no=2022030801031009043001,학생복지/교육격차해소,보건관리,학생및교직원보건안전관리,감염병예방관리,"코로나19 대응, 학교 방역, 전염병 예방교육, 감염병 관리 지침",0.6137316226959229
1100701.20220307,20220307,세계일보,속보 코로나19 신규확진 21만명대 위중증 환자 1000명 육박,코로나19 잠실종합운동장 위중증 코로나바이러스 서울 21만 시민들 진료소 명대 감염증 송파구 육박 임시 신종 환자 시민 선별 확진 검사 신규 마련,http://www.segye.com/content/html/2022/03/07/20220307503908.html,학생복지/교육격차해소,보건관리,학생및교직원보건안전관리,감염병예방관리,"코로나19 대응, 학교 방역, 전염병 예방교육, 감염병 관리 지침",0.6135926842689514
1100401.20220303,20220303,동아일보,문턱 낮춘 서울 청년수당 사회 초년생까지 혜택,근로자 서울 청년수당 취업난 서울시 청년들 50만 코로나바이러스 주거지 지원대상 중위소득 34세 3개월 단기근로자 김철희 통계청 코로나19 감염증 서울시미래청년기획단장 관계자 심리치료,https://www.donga.com/news/article/all/20220303/112125237/1,학생복지/교육격차해소,교육격차해소,학비지원,사회적배려대상자지원,"저소득층 학생 지원, 교육복지 대상자, 취약계층 장학금, 교육소외 해소",0.6135864853858948
1100801.20220322,20220322,조선일보,발언대 코로나 환자에 밀려나는 코로나 환자들,코로나 확진자 비코 환자들 수술실 오미크론 신속항원검사 그동안 맘카페 예방접종 과부하 희생자 엄마들 소아과 노령자 포화상태 음압수술실 40만 확진자수 감기약 기저질환 영유아 진단검사 위중증,https://www.chosun.com/opinion/podium/2022/03/22/ZYHG7IGJQRHDZCXYOAKAE7WUP4/?utm_source=bigkinds&utm_medium=original&utm_campaign=news,학생복지/교육격차해소,보건관리,학생및교직원보건안전관리,감염병예방관리,"코로나19 대응, 학교 방역, 전염병 예방교육, 감염병 관리 지침",0.6135298609733582
1100751.202203071,20220307,아시아투데이,충남도교육청 공부하는 학생선수 육성 주력,운동부 학생선수 안내서 김관태 김지철 충남도교육청 학습권 업무계획 금지법 고등학교 최저학력제 교육활동,https://www.asiatoday.co.kr/view.php?key=20220307010003690,교육활동지원,생활지도운영,학생생활상담지도,학생생활지도운영,"학생 생활지도, 학교 규칙 지도, 생활태도 개선",0.613358199596405
1100101.202203241,20220324,경향신문,코로나 장기화 사이버 학폭 예방 강화한다 SNS 통한 가해학생 접촉 보복금지 법제화도 추진,학교폭력 온라인 코로나19 온라인상 비대면 가해학생 언어폭력,https://www.khan.co.kr/national/education/article/202203241539011,교육활동지원,생활지도운영,학생생활상담지도,체험/공감형예방교육,"학교폭력 예방교육, 공감형 교육, 체험형 인성교육",0.6133138537406921
1100701.20220316,20220316,세계일보,이재갑 코로나19 독감의 치명률과 비교하지 말라,코로나19 이재갑 의료체계 강남성심병원 국민들 방역정책 명씩 코로나바이러스 고위험군 자문위원 위원회 말장난 사망자 감염병 일상회복 치명률 감염증 전문가 확진자 40만 페이스북 한림대 한림대학교 위험군 교수 감염 독감 정부 발생,http://www.segye.com/content/html/2022/03/16/20220316504222.html,학생복지/교육격차해소,보건관리,학생및교직원보건안전관리,감염병예방관리,"코로나19 대응, 학교 방역, 전염병 예방교육, 감염병 관리 지침",0.6131899356842041
1100751.202203221,20220322,아시아투데이,부산시 재택치료자 응급 상황 대처 시스템 마련 등 응급의료기관 협조 당부,코로나19 응급환자 부산 부산시 박형준 조영돌 의료기관 확진자 재택치료 확진자들 격리병상 기관장,https://www.asiatoday.co.kr/view.php?key=20220322010012664,학생복지/교육격차해소,보건관리,학생및교직원보건안전관리,감염병예방관리,"코로나19 대응, 학교 방역, 전염병 예방교육, 감염병 관리 지침",0.613116443157196
1100701.202203031,20220303,세계일보,학생 16만명 코로나19로 등교 못했다 초등생만 9만명 달해,교육부 신속항원검사 유치원 코로나19 참여율 확진자 고등학생 자가진단 유치원생 보건교사 안내문 중학생 9만 키트 코로나바이러스 광주 606만 등록자 정종철,http://www.segye.com/content/html/2022/03/03/20220303507514.html,학생복지/교육격차해소,보건관리,학생및교직원보건안전관리,감염병예방관리,"코로나19 대응, 학교 방역, 전염병 예방교육, 감염병 관리 지침",0.6128180027008057
1100801.20220317,20220317,조선일보,김부겸 코로나 1급 감염병 등급 조정 논의,코로나 감염병 확진자 1급 오미크론 전문가 일상생활 계절독감 김부겸 대다수 전문가들 만큼 치명률,https://www.chosun.com/national/welfare-medical/2022/03/17/EDEN6BA2EZFXDETAO7XDZREKH4/?utm_source=bigkinds&utm_medium=original&utm_campaign=news,학생복지/교육격차해소,보건관리,학생및교직원보건안전관리,감염병예방관리,"코로나19 대응, 학교 방역, 전염병 예방교육, 감염병 관리 지침",0.6126942038536072
1101101.20220323,20220323,한국일보,오늘의 1면 사진 친구들아 어서 돌아오렴,서울 확진자 코로나19 가정학습 재택치료 1만 6만 학생들 서울시교육청 중학교 교직원 친구들 학생 평균 하루 친구 치료 재택 가정 학습 교실 돌파 누적 자리 지역 발생,https://hankookilbo.com/News/Read/A2022032222040000742,학생복지/교육격차해소,보건관리,학생및교직원보건안전관리,감염병예방관리,"코로나19 대응, 학교 방역, 전염병 예방교육, 감염병 관리 지침",0.6126915812492371
1100901.20220324,20220324,중앙일보,시론 누적 확진 1000만 돌파 응급환자 희생 줄여야,코로나 응급실 오미크론 격리실 응급환자 확진자 응급센터 음압격리실 사망자 위중증 화장장,https://www.joongang.co.kr/article/25057844,학생복지/교육격차해소,보건관리,학생및교직원보건안전관리,감염병예방관리,"코로나19 대응, 학교 방역, 전염병 예방교육, 감염병 관리 지침",0.6124466061592102
