뉴스 식별자,일자,언론사,제목,특성추출(가중치순 상위 50개),URL,대분류,중분류,소분류,세부항목 예시,뉴스 일반 표현,유사도
1100751.202309141,20230914,아시아투데이,인천시교육청 교육부 학교복합시설 공모 2개교 선정,학교복합시설 교육부 공모사업 인천시교육청 지자체 사업비 박은영 아시아투데이 하늘1중학교 중학교 중구 도성훈 마을교육지원센터 루원중학교 재정부담 유휴부지 교육감 활성화 도서관 교육청 교육시설 2개 시설 학교 선정 사업 지역 교육 공모 확충 센터 지원 설치 복합 문화 지속,https://www.asiatoday.co.kr/view.php?key=20230914010008601,교육활동지원,연구학교운영,연구학교운영,시도교육청지정,"교육청 지정 연구학교, 시도교육청 시범학교",0.6678945422172546
1100501.202309231,20230923,문화일보,외주 학교급식 못믿어 자녀 도시락 싸는 학부모,학부모 중국 학부모들 외주업체 즉석식품 점심시간 신화사 가공식품 관계자 학생들 공산당 제동중국 교육부 구내식당 위원회 영양식,http://www.munhwa.com/news/view.html?no=2023092301039910080009,학생복지/교육격차해소,급식관리,학교급식운영,급식재료구입비,"학교 급식, 급식 질, 친환경 식자재, 학교 식단",0.6675937175750732
1101001.202309271,20230927,한겨레,Q A 학생 벌 청소 시켜도 되나요 생활지도 매뉴얼 보니,반성문 생활지도 물리적 소지품 학교장 교육부 해설서 시간date 화장실 성찰문,http://www.hani.co.kr/arti/society/schooling/1110385.html,교육활동지원,생활지도운영,학생생활상담지도,학생생활지도운영,"학생 생활지도, 학교 규칙 지도, 생활태도 개선",0.6674134731292725
1100401.20230904,20230904,동아일보,가상현실융합 데이터사이언스학과 신설,기회균형전형 학생부 수시모집 합격자 학생부100 재직자 대상자 논술전형 실기고사 학생부종합전형 미술실기전형 가상현실 사고의전환 덕성 북한이탈주민 수능최저학력기준 덕성인재전형 논술고사 덕성여자대학교 고등학교,https://www.donga.com/news/Society/article/all/20230902/120984517/1,교육활동지원,교무업무운영,교무학사운영,입학전형,"학교 입학전형, 입학전형 관리, 전형 일정 공고",0.6671255826950073
1100201.202309041,20230904,국민일보,재량 휴업 결정한 교장 교사와 학생 모두 위한 조치,학습권 학교장 교육과정 공교육 수업일 서울 김현정 뉴스쇼 선생님 기관장 교사들 아이들 정용주 지도감독 재량휴업 교육활동 휴업일 교육부 재량휴업일 cbs 교사 교장 재량 징계 학생 파행 교육 학교 결정,https://news.kmib.co.kr/article/view.asp?arcid=0018633718&code=61121411&cp=kd,인적자원운용,교직원복지및역량강화,교직원복지,교육활동보호지원,"교권 보호 정책, 교사 폭력 방지, 교사 보호법, 교육활동 안전 확보",0.6669554710388184
1100401.20230922,20230922,동아일보,체육수업 중 여교사 얼굴에 주먹질한 중학생 강제전학 처분,교육청 체육수업 광양시 전남도교육청 중학생 부여 교권보호위원회 심리상담 중학교 특별휴가 보호조치 강제전학 위원회 여교사 심리검사 관계자 주먹질 xxx 시간date 교사 전학 심리 주먹 수업 학생 강제 상담 보호 폭행 얼굴 조치 지도 도중 처분 학교 체육 휴가 욕설,https://www.donga.com/news/Society/article/all/20230922/121307574/2,교육활동지원,생활지도운영,학교폭력예방,가해학생선도,"가해학생 상담, 선도교육 프로그램, 처분대상자 교육",0.6668722629547119
1100801.202309212,20230921,조선일보,XXX아 여교사에 주먹 휘두른 중학생 강제전학 조치,a군 여교사 전남 전남도교육청 관계자 중학생 부여 심리상담 광양시 교권보호위원회 특별휴가 보호조치 중학교 보호위 위원회 심리검사 강제전학 교권보호위 xxx 시간date 교사 주먹 전학 심리 학생 조치 폭행 교권 상담 수업 보호 지도 도중 중학 강제 휴가 특별 권고 위협,https://www.chosun.com/national/regional/honam/2023/09/21/WZML7DJYBFCMBKVC5KG47YBOC4/?utm_source=bigkinds&utm_medium=original&utm_campaign=news,교육활동지원,생활지도운영,학교폭력예방,가해학생선도,"가해학생 상담, 선도교육 프로그램, 처분대상자 교육",0.6664986610412598
1100401.202309181,20230918,동아일보,피부색 조롱하며 찬물 끼얹고 학폭처분 억울 소송낸 가해 학생,학교폭력 교육장 재판부 사회봉사 중학교 고등학생 중학생 불이익 상해 전남도 광주시 광주지법 소년부 학폭위,https://www.donga.com/news/Society/article/all/20230918/121230158/2,교육활동지원,생활지도운영,학교폭력예방,가해학생선도,"가해학생 상담, 선도교육 프로그램, 처분대상자 교육",0.6664559841156006
1100201.202309131,20230913,국민일보,교권보호 4법 아동학대 관련법 정기국회 1호로 처리해야,아동학대 교육법 공교육 위원회 선생님 서울 유아교육법 교원단체 아동복지법 교사운동 뒷받침위 학교네트워크 중등교육법 네트워크 교사노동조합연맹 실천교육교사모임,https://news.kmib.co.kr/article/view.asp?arcid=0018665205&code=61171811&cp=kd,인적자원운용,교직원복지및역량강화,교직원복지,교육활동보호지원,"교권 보호 정책, 교사 폭력 방지, 교사 보호법, 교육활동 안전 확보",0.6664524078369141
1101001.202309061,20230906,한겨레,교권 회복 비정규직까지 노동이 존중받는 학교 만들자,학부모 노동자 비정규직 전남대 학생들 소수자 교육활동 노동자들 중등교육법 조직체계 사회학 교육법 김현미 선생님 유아교육 학부모들 후학교 재교육 왜냐면 절망감 특수교육실무사 간접경험 제도화 노동과정 교사들 관리자,http://www.hani.co.kr/arti/opinion/because/1107430.html,인적자원운용,교직원복지및역량강화,교직원복지,교육활동보호지원,"교권 보호 정책, 교사 폭력 방지, 교사 보호법, 교육활동 안전 확보",0.6663813591003418
1100751.202309251,20230925,아시아투데이,남양주시 초 중등 진로교육 THE캠퍼스레이스 참가자 모집,홈페이지 멘토 구성서 남양주시 중학교 캠퍼스레이스 학생들 연세대학교 서울대학교 성균관대학교 사흘간 추첨제 중학생 참가자 프로그그램 소그룹 남양주시인재 대학교 아시아투데 진로교육 the캠퍼스레이스 신촌 관악,https://www.asiatoday.co.kr/view.php?key=20230925010015293,교육활동지원,교무업무운영,교무학사운영,교내외장학초빙공모제운영,"장학생 선발, 장학 공모제, 우수학생 유치 프로그램",0.6663115620613098
1100701.20230906,20230906,세계일보,제자에게 기절할 때까지 폭행 당한 여교사 되레 학생보호 신고 처벌 말아 달라,b교사 고등학교 여교사 교육청 교권보호위원회 a군 광주 광주시교육청 남학생 교사들 119구조대 심리상담 구조대 남학 관계자 위원회 제비뽑기 학생들 b군,http://www.segye.com/content/html/2023/09/06/20230906504406.html,인적자원운용,교직원복지및역량강화,교직원복지,성폭력피해자지원,"교내 성폭력 피해자 보호, 교사 성희롱 대응, 성폭력 상담 지원, 피해 교원 지원 제도",0.6660260558128357
1100701.202309151,20230915,세계일보,학교폭력 당한 중학생 꾸짖어 극단선택 내몬 도덕교사 징역형 구형,백씨 극단선택 피해자 a군 중학교 피고인 노태헌 서울남부지법 재판부 내몬 징역형 시간date 이수 이듬해 눈물 변호인 학생들 사실관계,http://www.segye.com/content/html/2023/09/15/20230915509335.html,교육활동지원,생활지도운영,학교폭력예방,가해학생선도,"가해학생 상담, 선도교육 프로그램, 처분대상자 교육",0.6656716465950012
1100801.202309111,20230911,조선일보,수업 방해 학생 분리조치 경기도교육청 교권 보호조례 개정안 마련,교육활동 경기도교육청 도의회 경기도 개정안 학교장 교육감 분리조치 본회의 임태희 보호자 학습권,https://www.chosun.com/national/regional/2023/09/11/WGRRAGA6WZHQ5GALNIVU5N66TI/?utm_source=bigkinds&utm_medium=original&utm_campaign=news,인적자원운용,교직원복지및역량강화,교직원복지,교육활동보호지원,"교권 보호 정책, 교사 폭력 방지, 교사 보호법, 교육활동 안전 확보",0.6654858589172363
1100301.202309131,20230913,내일신문,과학기술 특성화대 우수한 이공계 연구 환경 풍부한 지원 매력,포스텍 유니스트 지스트 디지스트 켄텍 2학년 연구실 이현규 고1 이수민 김동혁 박기현 학생들 대학원 태양전지 생태학 박영신 컴퓨터공학 1학년 교수님,http://www.naeil.com/news_view/?id_art=473516,기본적교육활동,교과활동,과학교과활동,실험실습재료지원,"특성화 고교 교과, 전문계열 교육, 직업 연계 교과",0.6653981804847717
1100801.20230905,20230905,조선일보,사설 학부모 지지 받을 수 있는 교권 회복 운동을,교사들 아동학대 집단행동 서울 상임위 학부모 교육위 여의도 가시적 설득력 7차 병가 본회의 맞벌 시종일관 임시휴업 무분별 교육청,https://www.chosun.com/opinion/editorial/2023/09/05/EHBI2C3PB5DFDK5IH67DF2US2U/?utm_source=bigkinds&utm_medium=original&utm_campaign=news,인적자원운용,교직원복지및역량강화,교직원복지,교육활동보호지원,"교권 보호 정책, 교사 폭력 방지, 교사 보호법, 교육활동 안전 확보",0.6653710007667542
1100901.20230904,20230904,중앙일보,대입 내비게이션 2024 수시 특집 지역균형선발전형 고교별 추천 인원 확대,박지원 지역균형선발전형 학생부종합전형 수시모집 기회균형전형 학생부 지원자 교과성적 사회공헌 비교과영역 논술전형 합격자 경영학부 6명 도시사회학과 관계학 중앙일보 수능최저학력기준 특성화 사회학 학교장추천제 통합전형 학교생활 성취도 석차등급 2명 기록부 최종합격자 비교과,https://www.joongang.co.kr/article/25189597,교육활동지원,교무업무운영,교무학사운영,입학전형,"학교 입학전형, 입학전형 관리, 전형 일정 공고",0.6653420329093933
1100101.202309131,20230913,경향신문,보육교사 교권 보호 대책 마련 교육부 유보통합 우선 이행과제 발표,교육부 유치원 어린이집 보육교사 유보통합 협의회 이행과제 이주호 학부모 영유아 복지부 생활지도 아동학대 온라인,https://www.khan.co.kr/national/education/article/202309131218001,인적자원운용,교직원복지및역량강화,교직원복지,교육활동보호지원,"교권 보호 정책, 교사 폭력 방지, 교사 보호법, 교육활동 안전 확보",0.6651771664619446
1100301.2023091,20230910,내일신문,서경대 인생삼모작 인생나눔학교 네트워킹 데이 성료,멘티 네트워킹 참여자 멘토 서경대 서경대학교 문화예술센터 수도권 보수교육 세분화 중장년 박보균 한국문화예술위원회 전문가 위원장 영주제 관광부 대학원 주관기관 한정섭 센터장,http://www.naeil.com/news_view/?id_art=473195,선택적교육활동,기타선택적교육활동,기타선택적교육운영,대학생멘토링제운영,"대학생 멘토링, 학습 멘토 프로그램, 교육기부 멘토링, 취약계층 학습지원",0.665145754814148
1100701.202309131,20230913,세계일보,강원도교육청 교육활동 보호강화 종합대책 발표,교육활동 강원도교육청 변호사 신경호 온라인 교육감 원스톱 교육청 공무원증 대기음,http://www.segye.com/content/html/2023/09/13/20230913509867.html,인적자원운용,교직원복지및역량강화,교직원복지,교육활동보호지원,"교권 보호 정책, 교사 폭력 방지, 교사 보호법, 교육활동 안전 확보",0.6644623875617981
1100201.20230925,20230925,국민일보,경기도교육청 학교에서 디지털 시민교육 5분 실천,도교육청 책임감 경기도교육청 내면화 체험활동 학생들 학교문화 습관화 교육과정 시간date 담당관 디지털 교육 실천 학교 활용 안전 윤리 활동 기준 주제 내면 창의 창의적 정착 습관 우선 교과 문화 공문 의식 소통 책임 태도 사용 체험,https://news.kmib.co.kr/article/view.asp?arcid=0018704235&code=61121111&cp=kd,기본적교육활동,교과활동,국어교과활동,학교자율시간운영,"특성화 고교 교과, 전문계열 교육, 직업 연계 교과",0.6633355021476746
1100201.202309041,20230904,국민일보,기회균형 학생부종합일반 예체능 전형 신설,학생부 일반전형 군사학 1단계 등록금 경남대학교 복수지원 체육교육과전형 학습자 6회 지역인재전형 군사학과전형 일반면접전형 학생부교과 지그재 100m 울산 과학교과 부산 치료학 한마인재면접전형 멀리뛰기 진로선택과목 물리치료학 학년도 2단계 한마 석차등급,,교육활동지원,교무업무운영,교무학사운영,교내외장학초빙공모제운영,"장학생 선발, 장학 공모제, 우수학생 유치 프로그램",0.6632509231567383
1100201.20230905,20230905,국민일보,사상 처음 공교육이 멈췄다 전국서 교권 보호 외침,교육부 서울 부총리 병가 교사들 관련법 합의안 공교육 한마음 강훈식 더불어민주당 용산 추모일 교육청 이주호,,인적자원운용,교직원복지및역량강화,교직원복지,교육활동보호지원,"교권 보호 정책, 교사 폭력 방지, 교사 보호법, 교육활동 안전 확보",0.6630050539970398
1100751.20230919,20230919,아시아투데이,이상일 용인시장 초 중 고 학부모와의 교육환경 개선 간담회 개최,학부모 간담회 용인 회장단 용인시 이상일 홍화표 아시아투데이 중학교 고등학교 경기도교육청 문제점 용인교육지원청 지원청 용인특례시 6회 관계자 특례시 시간date 교육 시장 지역 논의 학교 개선 사안,https://www.asiatoday.co.kr/view.php?key=20230919010010976,학교일반운영,학교운영협력,학부모협력,학부모회활동지원,"학부모 활동, 참여교육 지원, 학교 행사 협조",0.6627923250198364
1100901.202309151,20230915,중앙일보,체육시간에 체육복 입으랬다고 교무실서 선생님 때린 중학생,a군 교무실 체육복 중학생 중학교 부산 부산시 b교사 위원회 북부경찰서 경찰서 체육시간 수업방해 선생님 관계자 14세 강제전학 폭행 형사 검찰 혐의 개최 지적 경찰 대상 모욕 결과 수업 북구 방해 송치 학교 보호 교권,https://www.joongang.co.kr/article/25192817,기본적교육활동,교과활동,체육교과활동,특성화중학교(체육)운영,"체육 수업, 체력 증진 활동, 체육대회, 학생 스포츠 활동",0.6625807881355286
1100611.202309041,20230904,서울신문,광주시교육청 교권 회복의 날 긴급상황반 운영,긴급상황반 장학사 광주시교육청 교육청 교육행정직원 전문직 이정선 상황반 아이들 광주시 교육감 학습권 시교육청 병가 학교현장 안전지도 49재 가용인력 광주 생활지도 인력풀 교사들 교육전문직 교육전문직원,http://www.seoul.co.kr/news/newsView.php?id=20230904500141,교육활동지원,생활지도운영,학교폭력예방,학교폭력전담기구운영,"학교폭력 전담기구, 학교폭력대응 조직, 학교폭력대책위 운영",0.6623389720916748
1100901.202309251,20230925,중앙일보,로엘법무법인 한국학교폭력예방연구소와 업무협약 MOU 체결,로엘법무법인 변호사 학교폭력 연구소 로엘 한국학교폭력예방연구소 성균관대 권상진 관계자 한국학교 업무협약 전문성 주혜진 김현우 법률자문 곽내원 최창무 학교폭력전담팀 정보교환 예방안 기본사항 교육학 겸임교수 정재준,https://www.joongang.co.kr/article/25195253,교육활동지원,생활지도운영,학교폭력예방,학교폭력전담기구운영,"학교폭력 전담기구, 학교폭력대응 조직, 학교폭력대책위 운영",0.6619029641151428
1100751.202309181,20230918,아시아투데이,경남교육청 하반기 사무행정원 직무 연수 개최,사무행정원 행정원 창원대학교 참여자 안승기 허균 아시아투데이 행정실 각급 아이들 생태전환교육 경남도교육청 만족도 학습관 시시각각 공무직 시간date 경남교육청 교육 직무 연수,https://www.asiatoday.co.kr/view.php?key=20230918010010367,인적자원운용,교직원복지및역량강화,교직원역량강화,직무연수,"교사 연수, 직무교육, 교사 역량 강화 프로그램",0.6617787480354309
1100901.20230904,20230904,중앙일보,대입 내비게이션 기회균형전형은 별도의 지원자격 충족해야,한국사 학교장추천전형 기회균형전형 학생부종합전형 서울캠퍼스 학생부 1과목 한국외대 논술전형 학년도 생부종합전형 학교장 수능최저학력기준 지원자격 서울 글로벌캠퍼스 4등급 서류형,https://www.joongang.co.kr/article/25189629,교육활동지원,교무업무운영,교무학사운영,입학전형,"학교 입학전형, 입학전형 관리, 전형 일정 공고",0.6616160869598389
1100701.202309191,20230919,세계일보,전북교육청 교원안심 서비스 전면 운영 학교안전 지킴이 확대하고 갑질 근절 가이드라인 도 배부,갑질 전북교육청 구성원 학교별 학교안전지킴이 안전지킴이 사용법 안심번호 2학기 휴대전화 사회복무요원 전북,http://www.segye.com/content/html/2023/09/19/20230919516483.html,인적자원운용,교직원복지및역량강화,교직원복지,성폭력피해자지원,"교내 성폭력 피해자 보호, 교사 성희롱 대응, 성폭력 상담 지원, 피해 교원 지원 제도",0.6615691184997559
1100201.20230906,20230906,국민일보,단독 코로나 최전선에 투입해놓고 정부 의료진 피해엔 나몰라라,의료진 코로나 관계자 코로나19 간호사 감염병 근로복지공단 분들 질병관리청 역학조사 관리청 팬데믹 의료인력 후유증,https://news.kmib.co.kr/article/view.asp?arcid=0924319680&code=11131900,학생복지/교육격차해소,보건관리,학생및교직원보건안전관리,감염병예방관리,"코로나19 대응, 학교 방역, 전염병 예방교육, 감염병 관리 지침",0.6614890694618225
1100611.202309261,20230926,서울신문,10년 새 3배 늘어난 이주배경 학생 한국어 교육 늘린다,다문화 한국어 교육부 장학금 3배 고등학교 전문가 일대일 8곳 5곳 장관회의 고숙련 중학교,http://www.seoul.co.kr/news/newsView.php?id=20230926500199,학생복지/교육격차해소,교육격차해소,기타교육격차해소지원,다문화가정지원,"다문화가정 학생 지원, 다문화 교육 정책, 중도입국 학생",0.661451518535614
1100201.202309111,20230911,국민일보,충남교육청 교권침해 피해 교직원 전수조사 추진,현장체험학습 도교육청 교육감 교직원 선생님 교권침해 교육청 김지철 상황실 법제처 전수조사 유권해석 악성민원 체험학습 충남도교육청 형사상 학습권 충남 교육활동 충남도 충남교육청 학교 현장 선생,https://news.kmib.co.kr/article/view.asp?arcid=0018655295&code=61121111&cp=kd,인적자원운용,교직원복지및역량강화,교직원복지,교육활동보호지원,"교권 보호 정책, 교사 폭력 방지, 교사 보호법, 교육활동 안전 확보",0.6612189412117004
1100101.202309042,20230904,경향신문,직설 학교를 끝까지 함께 다니고 싶다,특수학교 장애인 장애학생 해결책 친구들 절뚝이 바나 발달장애인 책임감 시간date 노장애인존 합리화 소수자정책연구자 변재원 완주 소수자 전문대학 고등학교 당사자 한동안 모욕적 갈음 비장애학생 비장애 목발 선생님 교육권 양다리,https://www.khan.co.kr/opinion/column/article/202309042030005,기본적교육활동,창의적체험활동,봉사활동,장애학생돌보기,"장애학생 돌봄, 특수학생 지원 활동, 장애인식 개선 봉사, 통합교육 봉사활동",0.6610474586486816
1100901.20230908,20230908,중앙일보,라이프 트렌드 초등학생 문해력 키우는 최적화된 학습 구성,재능스스로국어 문해력 재능교육 아이들 김민정 홈페이지 육하원칙 요소들 부사어 목적어 사고력 팀장 마인드맵 범교과적 최적화 글들 융복합 중학생 연구소 도입부 재능스스로 아이 주제 이해 학습 교육 교재 재능 구성 흥미 능력 국어 결국 지식 배경 업그레이드 문장,https://www.joongang.co.kr/article/25190890,선택적교육활동,독서활동,독서활동운영,독서교육역량강화,"독서 교육, 문해력 강화, 책읽기 활동, 학생 독서 습관",0.6609411835670471
1101101.20230918,20230918,한국일보,뉴스룸에서 학교 서비스에 칸막이를,교육부 늘봄학교 학부모 교사들 수요자 이명박 전담사 선생님 이주호 부총리 늘봄 전담교사 경제적 교원단체 맞벌이 노무관리,https://www.hankookilbo.com/News/Read/A2023091612510001212,선택적교육활동,방과후학교운영,늘봄학교운영,늘봄학교(교실)운영,"늘봄학교 운영, 돌봄교실 확장, 온종일 교육체계, 학교 중심 돌봄",0.6608168482780457
1100751.202309051,20230905,아시아투데이,박용근 전북도의원 공립 다문화 대안학교 설립 촉구,다문화 전북 박용근 임시회 다문화가정 교육지원 아시아투데이 박윤근 전북도의회 대안학교 유치원 실효성 정주여건 국공립 공교육,https://www.asiatoday.co.kr/view.php?key=20230905010002433,선택적교육활동,기타선택적교육활동,다문화교육운영,다문화교육중점학교,"다문화중점학교, 다문화교육 시범학교, 다문화 특화 교육기관",0.6607121229171753
1101101.202309041,20230904,한국일보,공교육 멈춤의 날 추모 물결 교장 장학사까지 수업 투입,병가 장학사 교사들 광주 공교육 교육부 교육청 서울 부산 000 7 체험학습 시도교육청 추모일 지원청 검은색,https://www.hankookilbo.com/News/Read/A2023090414550002150,학교일반운영,학교기관운영,부서기본운영,교육행정업무운영,"교육행정 운영, 학교 행정 업무, 학사관리 행정 지원",0.6606868505477905
1101001.202309041,20230904,한겨레,우리 아이 싸가지 교육 은 가정에서 그래야 괴물 막는다,싸가지 가정교육 학부모 1학기 대상자 생활지도 중학교 대면상담 고군분투 모범생 그중 빡침 세계대전 이기심 교사들 류승연 프로이트 학교생활 무관심 부모들 첫걸음 얘길 모습 부모 사춘기 상담 담임 교사 감정 학교,http://www.hani.co.kr/arti/society/schooling/1107055.html,교육활동지원,생활지도운영,학생생활상담지도,체험/공감형예방교육,"학교폭력 예방교육, 공감형 교육, 체험형 인성교육",0.6605604290962219
1100751.202309261,20230926,아시아투데이,보령시 추석 연휴 비상방역 응급진료 대책반 가동,종사자 감염병 비상방역 보령아산병원 상황실 보건소 응급진료 보호자 코로나19 김관태 응급실 아시아투데이 선별진료소 진료소 버스종합터미널 만큼 다중이용시설 귀성객 대천역 식중독 귀성객들 삼육오연합의원 전경희 대천중앙병원 의사소견 감염취약시설종사자 전통시장 충남 60세 삼육오연합 호흡기,https://www.asiatoday.co.kr/view.php?key=20230926010015893,학생복지/교육격차해소,보건관리,학생및교직원보건안전관리,감염병예방관리,"코로나19 대응, 학교 방역, 전염병 예방교육, 감염병 관리 지침",0.6601317524909973
1100901.20230904,20230904,중앙일보,대입 내비게이션 국제화 이끌 로욜라국제대학 신입생 선발,수시모집 국제학부 글로벌한국학부 2024학년도 학년도 신입생 계약학과 게페르트국제학부 학생부 한국학부 모집단위 전형별 로욜라국제대학 서강대학교 학생부종합 글로벌융합학부 자연계열 학생부교과 외국인 하이닉스 한국어 한국어교육전공 반도체 지역균형 시스템반도체공학과 융합미디어대학,https://www.joongang.co.kr/article/25189637,교육활동지원,교무업무운영,교무학사운영,입학전형,"학교 입학전형, 입학전형 관리, 전형 일정 공고",0.660009503364563
1100901.202309271,20230927,중앙일보,세종사이버대 경영학과 정현오토파킹과 산업체위탁교육 협약 체결,메타버스 전문가 경영학 정현오토파킹 세종사이버대학교 산업체 봄학기 윤남수 임직원 esg 신편입생 대학원 수업료 ai 세종사이버대 자격증,https://www.joongang.co.kr/article/25195994,선택적교육활동,기타선택적교육활동,기타선택적교육운영,대학교육실습생운영,"교육실습 운영, 예비교사 실습, 대학교 연계 실습",0.6597801446914673
