뉴스 식별자,일자,언론사,제목,특성추출(가중치순 상위 50개),URL,대분류,중분류,소분류,세부항목 예시,뉴스 일반 표현,유사도
1100751.202204251,20220425,아시아투데이,청도군 초등학생 영어체험학습 추진,영어체험학습 대구경북영어마을 청도 중학교 황영호 학생들 청도군 박영만 원어민 코로나19 의사소통 생필품점 학부모 체험실 사교육비 합숙형 장소들 전문인력 나라들 통학형 교육환경 교육시설 생활회화 권한대행 경북 칠곡군 생활영어,https://www.asiatoday.co.kr/view.php?key=20220425010014729,기본적교육활동,교과활동,외국어교과활동,창의경영학교(영어),"영어 수업, 외국어 말하기 대회, 원어민 수업, 글로벌 언어 교육",0.6792608499526978
1100301.202204151,20220415,내일신문,18일부터 거리두기 전면해제 마스크 유지,코로나19 감염병 오미크론 중대본 확진자 치료비 요양원 영업시간 4주 코로나 일평균 코호트 월요일 독박진료 오미크론변 생활비 안착단계,http://www.naeil.com/news_view/?id_art=420300,학생복지/교육격차해소,보건관리,학생및교직원보건안전관리,감염병예방관리,"코로나19 대응, 학교 방역, 전염병 예방교육, 감염병 관리 지침",0.6792030930519104
1100401.202204281,20220428,동아일보,KT G장학재단 대학 상상장학생 모집 기초수급자 차상위 대상 200명 선발,장학금 인당 홈페이지 관계자 상상장학생 수급자 300만 차상위 kt 신청서 온라인 수혜자 학생들 장학사업 대학교 대학생 모집 장학 대학 재단 지원 대상 어려움 교육 세대 미래 선발 계층,https://www.donga.com/news/article/all/20220428/113124510/1,학생복지/교육격차해소,학생복지,학생장학금운영,학생장학금지원,"장학금 지급, 학생 장학 제도, 교육비 지원, 장학생 선발 공고",0.6791470050811768
1100701.20220429,20220429,세계일보,내주부터 실외 마스크 의무 해제 10명 이하 모임 등 조건 붙을 듯,코로나19 실외마스크 인수위 명대 확진자 위원회 손영래 10만 안철수 위중증 통의동 서울 로드맵 김부겸 감염병 월요일 코로나바이러스,http://www.segye.com/content/html/2022/04/28/20220428516873.html,학생복지/교육격차해소,보건관리,학생및교직원보건안전관리,감염병예방관리,"코로나19 대응, 학교 방역, 전염병 예방교육, 감염병 관리 지침",0.6788362264633179
1100751.202204071,20220407,아시아투데이,경기과천교육도서관 학생 맞춤 독서활동 프로그램 지원,경기과천교육도서관 독서활동 도서관 고등학교 의왕 중학교 군포 인문학 김주홍 수원 하석종 고등학생 부천 과천 광명 235교 꿈드림 수업자료 테미 전문가 아카 안양 북드림 과천교육도서관 상승효과 학생주 학생들,https://www.asiatoday.co.kr/view.php?key=20220407010003683,선택적교육활동,독서활동,독서활동운영,독서교육역량강화,"독서 교육, 문해력 강화, 책읽기 활동, 학생 독서 습관",0.6787859201431274
1100611.202204271,20220427,서울신문,코로나 유행 첫해만 반짝 소홀해진 손 씻기 실천,당뇨병 우울감 코로나19 정은경 사용률 정신건강 개인방역 경험률 만성질환 비만율 관리청 30세 하락세 체질량지수 장기화 관리청장 첫해 코로나 실천율 유행 포인트 전년,http://www.seoul.co.kr/news/newsView.php?id=20220427500168,학생복지/교육격차해소,보건관리,학생및교직원보건안전관리,감염병예방관리,"코로나19 대응, 학교 방역, 전염병 예방교육, 감염병 관리 지침",0.6786912679672241
1100751.202204181,20220418,아시아투데이,오산시청소년상담복지센터 13개 학교에 전문 상담 서비스 지원,상담실 학교상담사 코로나 오산시청 장이준 코로나19 오산 심리상담서비스 상담사 오산원 매홀중 매홀,https://www.asiatoday.co.kr/view.php?key=20220418010010261,교육활동지원,생활지도운영,학생생활상담지도,위클래스운영,"위클래스 상담실, 학생 정서 지원, 학교 상담센터",0.6776123642921448
1100751.202204221,20220422,아시아투데이,울산교육청 장애 학생 진로 직업 학부모연수,학부모 교육청 울산교육청 모수영 장애학생 안병철 이승준 울산 아이들 지역사회 고슴도치쌤 대학진학박람회 장애인 학령기 중요성 김해 은혜학교 한국 취업지원부장 박람회 지원부장 일자리 다산홀 관계자 취업희망교실 학부모연수 직업교육 플랜b 진로 취업 직업 연수,https://www.asiatoday.co.kr/view.php?key=20220421010012684,학교일반운영,학교운영협력,학부모협력,학부모회연수운영,"학부모 연수, 학부모 교육 프로그램, 보호자 교육",0.6768702864646912
1101001.20220412,20220412,한겨레,이젠 수업이 즐거워요 부산 반송초 한국어 학급 가보니,한국어 다문화 부산 1명 한국 이젠 2명 아이샤,http://www.hani.co.kr/arti/area/yeongnam/1038489.html,선택적교육활동,기타선택적교육활동,다문화교육운영,다문화교육/학급운영,"다문화 학급 운영, 다문화 학생 교육, 다문화 통합 교육",0.6767619848251343
1100751.202204051,20220405,아시아투데이,강원도교육청 86개교 선정 강원도형 수학나눔학교 운영,시범학교 한재혁 이중택 춘천 강원도교육청 강원도 사내중 강원사대부고 양덕중 강원고 퇴계중 협의회 대성고 지역협의회 원주삼육고 강원수학 9개 문해력 홍천고 부스 600만 강원 50만 도교육청,https://www.asiatoday.co.kr/view.php?key=20220405010002394,교육활동지원,연구학교운영,연구학교운영,시도교육청지정,"교육청 지정 연구학교, 시도교육청 시범학교",0.6766351461410522
1101101.202204081,20220408,한국일보,교육부 시교육청 확진 학생 중간고사 응시 제한 유지,교육부 코로나19 지원단 전검 교육청 중간고사 시교육청 학생들 교육당국 유지 확진 교육 제한 결과 개최 회의 긴급 응시 학생 당국 원칙 결정,https://hankookilbo.com/News/Read/A2022040818030005371,학생복지/교육격차해소,보건관리,학생및교직원보건안전관리,감염병예방관리,"코로나19 대응, 학교 방역, 전염병 예방교육, 감염병 관리 지침",0.6762160658836365
1100301.202204071,20220407,내일신문,미국 명문 대학의 합격생 선발 과정,미국 입상자 한국 학생들 외국인 아시안 대다수 최우선 지원자 사정관,http://www.naeil.com/news_view/?id_art=419491,교육활동지원,교무업무운영,교무학사운영,입학전형,"학교 입학전형, 입학전형 관리, 전형 일정 공고",0.6761526465415955
1100751.202204051,20220405,아시아투데이,문경교육지원청 문경지역학생상담자원봉사자연합회 신입 오리엔테이션 실시,문경 학생들 봉사자 학생상담자원봉사자 장성훈 경북 신입회원 지원청 문경교육지원청 자아의식 사회생활 청소년들 적응력 교육장 중요성 정진표 지역사회 집단상담 아시아투데이 연합회 학생상담자원봉사자들 wee 학생 오리엔테이션 신입 상담 봉사 지역 회원 노력 성장 관내,https://www.asiatoday.co.kr/view.php?key=20220405010002257,기본적교육활동,창의적체험활동,현장체험학습활동,수련활동,"수련회, 인성 함양 수련활동, 학생 공동체 훈련, 학교 수련 교육",0.675946831703186
1101101.202204081,20220408,한국일보,감소세 확신한 정부 곧 코로나 감염병 등급 내린다,고위험군 감염병 코로나 2급 확진자 치료비 의료체계 1급 위험군 코로나19 호흡기 중수본 다중이용시설,https://hankookilbo.com/News/Read/A2022040813070002276,학생복지/교육격차해소,보건관리,학생및교직원보건안전관리,감염병예방관리,"코로나19 대응, 학교 방역, 전염병 예방교육, 감염병 관리 지침",0.6757043600082397
1100751.202204191,20220419,아시아투데이,군포시 중 고등학생 1대1 맞춤형 진로 진학 상담서비스 진행,고등학생 1대 엄명수 군포시 군포 학생들 고등학생들 상담서비스 홈페이지 9명 한대희 응답자 군포시장 기록부 지원청 군포시청 생활기록부 청소년들 군포시학원연합회 모의고사 군포의왕 전문강사 수요일 진학전략 소통방 신청자 만족도 성적표 군포의왕교육지원청 자기주도적 상담내용 시간date 상담,https://www.asiatoday.co.kr/view.php?key=20220419010010818,기본적교육활동,창의적체험활동,진로활동,진로상담활동,"진로 상담, 진로 멘토링, 학생 진로 설계 지도, 진로코칭 프로그램",0.6754751801490784
1100301.202204291,20220429,내일신문,3단계 산학연협력 선도대학 76개교 육성,산학연협력 교육부 산학연 산업계 산학협력 수도권 그간 기술혁신선도형 유은혜 인재양성 부총리 고려대 강원대 성균관대 연협력 포항공대,http://www.naeil.com/news_view/?id_art=421853,선택적교육활동,직업교육,직업교육운영,산학훈련연계교육,"산학협력 교육, 산학 연계 프로그램, 현장연계 수업",0.6751794815063477
1100101.202204292,20220429,경향신문,사설 기대와 우려 속 실외 마스크 해제 일상회복 안착 계기로,코로나19 일상회복 확진자 1m 중증병상 정은경 안철수 중환자 신구 감염병 프랑스 뉴질랜드 싱가포르,https://www.khan.co.kr/opinion/editorial/article/202204292046025,학생복지/교육격차해소,보건관리,학생및교직원보건안전관리,감염병예방관리,"코로나19 대응, 학교 방역, 전염병 예방교육, 감염병 관리 지침",0.6750680208206177
1100751.202204121,20220412,아시아투데이,고혈압 당뇨병 등 만성질환 관리지표 악화 코로나로 인한 의료공백 탓,코로나19 당뇨병 고혈압 코로나 실천율 보건소 신체활동 경험률 정은경 일대일 비만율 아시아투데이 이선영,https://www.asiatoday.co.kr/view.php?key=20220412010006605,학생복지/교육격차해소,보건관리,학생및교직원보건안전관리,감염병예방관리,"코로나19 대응, 학교 방역, 전염병 예방교육, 감염병 관리 지침",0.6750568151473999
1100901.202204131,20220413,중앙일보,속보 중대본 코로나 종식 위한 집단면역 어려워 소규모 유행 반복,코로나19 손영래 동절기 가능성 소규모 사람들 코로나바이러스 코로나 사회전략반장 대유행 방역당국 집단면역체계 감염증 우리나라 취재진 계속적 확진자 겨울철 면역력 중대본 유행들 유행 종식 반장 체계 가능 면역 반복,https://www.joongang.co.kr/article/25063074,학생복지/교육격차해소,보건관리,학생및교직원보건안전관리,감염병예방관리,"코로나19 대응, 학교 방역, 전염병 예방교육, 감염병 관리 지침",0.6747275590896606
1100701.202204121,20220412,세계일보,일상회복 기지개 켜나 전국 수도권 코로나위험도 하향,확진자 교육부 코로나19 서울 손영래 정호영 해외입국 5개 선제검사 방대본 구로구 서대문구 기대감 인천국제공항 일평균 코로나바이러스 후보자 이상원,http://www.segye.com/content/html/2022/04/12/20220412515192.html,학생복지/교육격차해소,보건관리,학생및교직원보건안전관리,감염병예방관리,"코로나19 대응, 학교 방역, 전염병 예방교육, 감염병 관리 지침",0.6744964122772217
1100901.202204111,20220411,중앙일보,계절성 독감화 1년내내 지속 코로나19 향후 행로는,코로나19 계절성 전파력 그간 인플루엔자 오미크론 김은진 김우주 전문가 전문가들 겨울철 감염병 김탁 가능성 코로나 상대적 호흡기 구로병원 부천병원 집단면역 정재훈,https://www.joongang.co.kr/article/25062552,학생복지/교육격차해소,보건관리,학생및교직원보건안전관리,감염병예방관리,"코로나19 대응, 학교 방역, 전염병 예방교육, 감염병 관리 지침",0.6744909882545471
1101101.2022043,20220430,한국일보,모두가 학교폭력 멈춰 를 외쳐야 하는 이유,학교폭력 방관자 피해자 구성원 감시자 경찰관 학교전담경찰관 가해자 관계자 탁상행정 감염병 방관자들 자리매김 사회관계 대구 코로나바이러스 코로나19 주변인들 사회관계망 극대화 유머란 일등공신 주변인 청소년들 신학기 성서경찰서 신조어 러시안룰렛 예방책 교사들 만큼 구성원들 전문가,https://hankookilbo.com/News/Read/A2022042715430005792,교육활동지원,생활지도운영,학교폭력예방,학교폭력전담기구운영,"학교폭력 전담기구, 학교폭력대응 조직, 학교폭력대책위 운영",0.6744806170463562
1100301.202204271,20220427,내일신문,강원도형 그린스마트미래학교 교육 기획가 투입해 교육 공간 최적화,그린스마트미래학교 강원도교육청 교육과정 기획가 사전기획 양지선 도교육청 장학사 강원도 그린학교 대상학교 염혜현,http://www.naeil.com/news_view/?id_art=421490,교육활동지원,연구학교운영,연구학교운영,교육지원청지정,"교육지원청 지정 연구학교, 지역 연구학교",0.6742780208587646
1100801.202204182,20220418,조선일보,교육부 지방대 지원 권한 새 정부 지자체 이관할 듯,지방대 지자체 교육부 수도권 인수위 보조금 윤영덕 지원자 3만 비수도권 4만 일반대 비수도 전문대,https://www.chosun.com/national/education/2022/04/18/BOPPHOVFAJC5TFNWYCUYOCPA2M/?utm_source=bigkinds&utm_medium=original&utm_campaign=news,학생복지/교육격차해소,학생복지,학생장학금운영,도비특별장학금,"지방정부 장학금, 도비 장학 지원, 지역 인재 양성 장학금",0.6740726828575134
1100611.202204071,20220407,서울신문,국립중앙과학관과 함께 하는 미래 직업 알아봐요,국립중앙과학관 온라인 중앙과학관 진로체험 중학생 과학관 이석래 실시간 진로특강 대덕 4주 대전시민천문대 대전시청자미디어센터 대전솔로몬로파크 대전시 위원회 한국지질자원연구원 한국조폐공사 한국 목요일 수요일 이응노미술관 지질학자 사람들 24회 16회 6개 청소년들 연구개발특구진흥재단 대전선거관리위원회 누리집 유관기관 연구원 신청접수 체험교육,http://www.seoul.co.kr/news/newsView.php?id=20220407500046,기본적교육활동,창의적체험활동,진로활동,진로체험,"직업체험 활동, 진로체험학습, 현장직업 체험, 미래직업 탐색",0.6739708185195923
1100701.202204061,20220406,세계일보,의료방역체계도 일상 전환 확진자 7일 격리 축소될까,확진자 코로나19 오미크론 손영래 치료비 2급 감염병 비상시 대응체계 보건소 외래진료센터 1급 중수본,http://www.segye.com/content/html/2022/04/06/20220406516260.html,학생복지/교육격차해소,보건관리,학생및교직원보건안전관리,감염병예방관리,"코로나19 대응, 학교 방역, 전염병 예방교육, 감염병 관리 지침",0.6739497780799866
1100101.202204101,20220410,경향신문,이틀연속 10만명대 확진 내일부터 보건소 선별진료소 신속항원검사 중단,코로나19 진료소 보건소 신속항원검사 10만 확진자 키트 홈페이지 호흡기 방대본 명대 관련자 60세 치료제 일주일 대응체계 오미크론 임시선별진료소 위중증 팍스로비드 화이자 일평균 고령자,https://www.khan.co.kr/national/health-welfare/article/202204101051001,학생복지/교육격차해소,보건관리,학생및교직원보건안전관리,감염병예방관리,"코로나19 대응, 학교 방역, 전염병 예방교육, 감염병 관리 지침",0.6738169193267822
1100751.202204131,20220413,아시아투데이,울산교육청 학생 교육복지 예산 3216억 원 편성,농어촌 울산 기숙사비 교육비 울산교육청 안전망 교육청 대상자 울산행복쌤 원스톱 3216억 유아학비 교복비 299억 복지비 고등학교 후학교 이승준,https://www.asiatoday.co.kr/view.php?key=20220413010007215,학생복지/교육격차해소,학생복지,교육복지우선,교육복지사업운영비,"교육복지사업, 취약계층 학생 프로그램, 교육복지 프로그램 운영",0.673439085483551
1100101.202204121,20220412,경향신문,같은 반 확진돼도 고위험 유증상 학생만 검사 학교 방역 일부 완화,교육부 확진자 신속항원검사 유증상 3회 일상회복 코로나19 교육감 오미크론 고위험 질환자 교직원 유증 접촉자 유증상자 6만 학생들 류혜숙 기저질환자,https://www.khan.co.kr/national/education/article/202204121517001,학생복지/교육격차해소,보건관리,학생및교직원보건안전관리,감염병예방관리,"코로나19 대응, 학교 방역, 전염병 예방교육, 감염병 관리 지침",0.673237681388855
1100201.202204111,20220411,국민일보,정부 마스크 해제 여부 포함 거리두기 조정 논의 착수,코로나19 이번주 오미크론 감염병 백브리핑 정은경 손영래 전체회의 가능성 확진자 위원회 음압병실 대면진료 치명률 중수본 거리두기 일상회복,http://news.kmib.co.kr/article/view.asp?arcid=0016962224&code=61121911&cp=kd,학생복지/교육격차해소,보건관리,학생및교직원보건안전관리,감염병예방관리,"코로나19 대응, 학교 방역, 전염병 예방교육, 감염병 관리 지침",0.6724258065223694
1100701.20220429,20220429,세계일보,다음 주부터 마스크 벗고 다닐까 정부 실외 노마스크 29일 발표,코로나19 팍스로비드 방대본 미국 입원자 인수위 투여군 미투여군 18세 중증화 가능성 고위험군 치료제 5곳 풍토병 박영준 중구 서울 확진자 임상시험 사망률,http://www.segye.com/content/html/2022/04/28/20220428519292.html,학생복지/교육격차해소,보건관리,학생및교직원보건안전관리,감염병예방관리,"코로나19 대응, 학교 방역, 전염병 예방교육, 감염병 관리 지침",0.6722524762153625
1100401.20220414,20220414,동아일보,온라인에 만든 또 하나의 캠퍼스 교육 혁신 물꼬 튼다,온라인 교육부 학생들 재학생 일반대학 순천향대 오프라인 원격수업 국내대학 종사자 이수 전문가 대학원 권지현 김현수 코로나19 김혜정 석사과정 창의라이프 네트워크 부원장,https://www.donga.com/news/article/all/20220414/112869831/1,기본적교육활동,교과활동,교과활동지원,원격수업,"온라인 수업, 비대면 수업, 디지털 학습, 원격 교육",0.6722191572189331
1100301.202204221,20220422,내일신문,예비교사 대학생 6900명 교육결손 해소 나서,대학생 교육부 학습지원 코로나19 연세대 비대면 교육회복 광주교대 개인지도 1만 유은혜 부총리 강원도 한국장학재단,http://www.naeil.com/news_view/?id_art=421020,선택적교육활동,기타선택적교육활동,기타선택적교육운영,대학생멘토링제운영,"대학생 멘토링, 학습 멘토 프로그램, 교육기부 멘토링, 취약계층 학습지원",0.6718754768371582
1100701.202204131,20220413,세계일보,안철수 실외 마스크 착용 해제 검토 성급 감염 확산 우려,위원장 안철수 위원회 교육부 인수위 홍익대 서울 코로나19 확진자 관리청 질병관리청 20만 고등학교 코로나비상 교직원 방역청 학생들 조치들 사범대 10만 사람들 마포구 간담회 코로나특위 감염 마스크,http://www.segye.com/content/html/2022/04/13/20220413510892.html,학생복지/교육격차해소,보건관리,학생및교직원보건안전관리,감염병예방관리,"코로나19 대응, 학교 방역, 전염병 예방교육, 감염병 관리 지침",0.6718133687973022
1100701.202204032,20220403,세계일보,코로나로 인한 교육결손 회복 중장기 방안 모색해야,학부모 교육부 교육회복 학생들 팬데믹 교육결손 코로나19 교육회 아이들 세계일보 대학생 친구관계 원격수업 실효성 인력부족 불평등 부여 사대생 교대생 위기상황 위원회 의구심 가정환경 방학기간,http://www.segye.com/content/html/2022/03/23/20220323519621.html,학생복지/교육격차해소,보건관리,학생및교직원보건안전관리,감염병예방관리,"코로나19 대응, 학교 방역, 전염병 예방교육, 감염병 관리 지침",0.6709728240966797
1100611.202204291,20220429,서울신문,유치원 학교 대상 신속항원검사 시사점은,신속항원검사 교직원 보고서 코로나19 유치원 확진자 예측도 양성예측 rat 교육부 선제검사 pcr 효용성 1365만 최소화,http://www.seoul.co.kr/news/newsView.php?id=20220429500143,학생복지/교육격차해소,보건관리,학생및교직원보건안전관리,감염병예방관리,"코로나19 대응, 학교 방역, 전염병 예방교육, 감염병 관리 지침",0.6704334020614624
1100701.202204201,20220420,세계일보,나홀로 마스크 라도 코로나19 예방 효과 어느 정도 있어,코로나19 미국 감염자 린지 전문가 코로나바이러스 의무화 오미크론 실험실 스위스 스텔스,http://www.segye.com/content/html/2022/04/20/20220420508007.html,학생복지/교육격차해소,보건관리,학생및교직원보건안전관리,감염병예방관리,"코로나19 대응, 학교 방역, 전염병 예방교육, 감염병 관리 지침",0.6698331832885742
1100101.202204281,20220428,경향신문,간호직 공무원 공채 감염병 업무 부담 완화 위해 한달반 앞당겨 실시,간호직 행안부 보건소 공무원 필기시험 감염병 코로나 수험생 시험장 코로나19 누리집 1만,https://www.khan.co.kr/national/national-general/article/202204281200011,학생복지/교육격차해소,보건관리,학생및교직원보건안전관리,감염병예방관리,"코로나19 대응, 학교 방역, 전염병 예방교육, 감염병 관리 지침",0.6697950959205627
1100751.202204181,20220418,아시아투데이,대전교육청 미래지향형 온 오프라인 연계 수업사례 화요수업 나눔 운영,화요수업 수업혁신 대전교육청 미래지향형 24주 박현덕 이상선 오프라인 활성화 장기화 일상수 시교육청 공동체 학교교육 코로나19 교사학습공동체 화요일 미래지향적 지원단 수업연구 코로나 학년도 공감릴레이 지원정책 수업,https://www.asiatoday.co.kr/view.php?key=20220418010010493,선택적교육활동,기타선택적교육활동,기타선택적교육운영,위탁교육운영,"위탁 교육 운영, 특수기관 위탁교육, 외부 기관 연계 수업",0.6695353388786316
1100901.202204291,20220429,중앙일보,현장맞춤형 스마트 실습센터 통합교육과정 운영 경복대 5년 연속 수도권대학 취업률 1위 견인,검사실 실습실 4차 lab 실습센터 실습공간 경복대 창의놀이 교육과정 인재양성 간호대학 경복대학교 서비스경영 클라우드 교육부 2천 리테일 직무별,https://www.joongang.co.kr/article/25067616,선택적교육활동,기타선택적교육활동,기타선택적교육운영,대학교육실습생운영,"교육실습 운영, 예비교사 실습, 대학교 연계 실습",0.6694357991218567
1100101.202204122,20220412,경향신문,코로나만 신경썼나 만성질환 관리에 구멍,코로나19 만성질환 고혈압 보건소 당뇨병 우울감 치료율 경험자 건강행태 19세 인지율,https://www.khan.co.kr/national/health-welfare/article/202204122209005,학생복지/교육격차해소,보건관리,학생및교직원보건안전관리,감염병예방관리,"코로나19 대응, 학교 방역, 전염병 예방교육, 감염병 관리 지침",0.6693081259727478
1101001.202204101,20220410,한겨레,기고 정부 방역과 따로 노는 교육부 방역지침,교육부 확진자 감염병 지역사회 접촉자 방역당국 코로나19 선제검사 전국보건교사노조 오미크론 콜센터 16만 전문가,http://www.hani.co.kr/arti/opinion/column/1038284.html,학생복지/교육격차해소,보건관리,학생및교직원보건안전관리,감염병예방관리,"코로나19 대응, 학교 방역, 전염병 예방교육, 감염병 관리 지침",0.669277548789978
1101001.202204261,20220426,한겨레,벗을까 말까 야외 마스크 경계심 해이 막을 뾰족수 고심중,방대본 확진자 연구진 장영욱 감소세 2m 김우주 안철수 인수위 전문가들 코로나19 이상원,http://www.hani.co.kr/arti/society/health/1040491.html,학생복지/교육격차해소,보건관리,학생및교직원보건안전관리,감염병예방관리,"코로나19 대응, 학교 방역, 전염병 예방교육, 감염병 관리 지침",0.669213593006134
1100701.20220413,20220413,세계일보,당국 실내 마스크 착용 중요 실외에선 상대적으로 감염 위험 높지 않아,오미크론 방대본 코로나19 의료체계 영업시간 김어준 손영래 확진자 감염병 감소세 재감염률 가능성,http://www.segye.com/content/html/2022/04/12/20220412512588.html,학생복지/교육격차해소,보건관리,학생및교직원보건안전관리,감염병예방관리,"코로나19 대응, 학교 방역, 전염병 예방교육, 감염병 관리 지침",0.6691790819168091
