뉴스 식별자,일자,언론사,제목,특성추출(가중치순 상위 50개),URL,대분류,중분류,소분류,세부항목 예시,뉴스 일반 표현,유사도
1100751.202203241,20220324,아시아투데이,대전교육청 에듀힐링센터 상담 코칭 전문가 네트워크 워크숍,코칭 에듀힐링센터 심리상담 에듀 대전교육청 네트워크 윤기원 학부모 에듀힐링 위촉장 대전교원치유지원센터 메타버스 전문가 감염병 코로나19 이은옥 이상선 아버지학교 대전교육정보원 상담가,https://www.asiatoday.co.kr/view.php?key=20220324010013984,인적자원운용,교직원복지및역량강화,교직원역량강화,기타역량강화지원,"교직원 자기개발, 역량강화 프로그램, 교사 성장 지원, 교원 역량 개발 사업",0.6386283040046692
1100751.202203021,20220302,아시아투데이,카카오톡으로 코로나19 자가진단 받으세요,코로나19 챗봇 카카오톡 코로나 재택치료 이용자 관리군 신속항원검사 주의사항 자가진단 대상자,https://www.asiatoday.co.kr/view.php?key=20220302010000629,학생복지/교육격차해소,보건관리,학생및교직원보건안전관리,감염병예방관리,"코로나19 대응, 학교 방역, 전염병 예방교육, 감염병 관리 지침",0.6384020447731018
1100701.20220308,20220308,세계일보,부산교육청 교육회복 종합방안 발표,코로나19 교육회복 종합방안 중학교 부산 학생들 감염증 9개 직업계 일상회복 김석준 ai 그린스마트,http://www.segye.com/content/html/2022/03/07/20220307505668.html,학생복지/교육격차해소,보건관리,학생및교직원보건안전관리,감염병예방관리,"코로나19 대응, 학교 방역, 전염병 예방교육, 감염병 관리 지침",0.6380226016044617
1100611.202203091,20220309,서울신문,학생 교직원 코로나 확진자 급증 일부 학교 원격수업,확진자 교직원 대체교사 원격수업 코로나19 이틀간 울산시교육청 첫날 일주일간 울산 코로나,http://www.seoul.co.kr/news/newsView.php?id=20220309500115,학생복지/교육격차해소,보건관리,학생및교직원보건안전관리,감염병예방관리,"코로나19 대응, 학교 방역, 전염병 예방교육, 감염병 관리 지침",0.6378633379936218
1100701.20220309,20220309,세계일보,농협 축산관련 종사자교육 미이수자 기한 내 이수해야,온라인 농협 이수 이수자 과태료 희망자 교육운영기관 종사자교육 미이수자 코로나19 축산법 안병우 서면교육 온라인지원반 금차 서면 교육기한 운영기관 이성희 지역축협 농림축산식품부 축협 축산경제 지원반 축산경제대표이사 미이수 학습지원센터 정보시 교육정보시스템,http://www.segye.com/content/html/2022/03/08/20220308517842.html,학생복지/교육격차해소,보건관리,학생및교직원보건안전관리,감염병예방관리,"코로나19 대응, 학교 방역, 전염병 예방교육, 감염병 관리 지침",0.6377553343772888
1100801.20220302,20220302,조선일보,교직원 잇단 확진 초중고 시간강사 확보 비상,학부모 서울시교육청 확진자 담임교사 1학기 교육청 소지자 교육부 코로나 4명 교직원 시간date 간편식 키트 메시 조리원,https://www.chosun.com/national/education/2022/03/02/CWXBAHQHTJHUZJ63HFR2VOC4VQ/?utm_source=bigkinds&utm_medium=original&utm_campaign=news,인적자원운용,기타교직원보수,교직원대체인건비,교원대체인건비,"기간제 교사, 대체 교사, 출산휴가 교사, 교사 인력난",0.6376951336860657
1101101.20220316,20220316,한국일보,코로나 1급 감염병서 변경되나 김부겸 상황에 맞게 조정 논의,코로나19 감염병 1급 오미크론 김부겸 전문가들 전문가 의료계 코로나바이러스 중대본 사업장 전파력 치명률 확산세 의료현장 세종청사 감염증 국무총리 음압격리 확진자 시간date 코로나 의료 정부 등급 총리 논의 변경 격리 일상 사이 신종 이날 조정,https://hankookilbo.com/News/Read/A2022031608510002204,학생복지/교육격차해소,보건관리,학생및교직원보건안전관리,감염병예방관리,"코로나19 대응, 학교 방역, 전염병 예방교육, 감염병 관리 지침",0.6376361846923828
1100701.20220321,20220321,세계일보,정점 늦어지고 교사 급식 조리사 등 확진 급증 일선 학교들 시름 깊어져,확진자 학부모 서울 코로나19 중학교 뉴스1 급식조리사 교직원 조리사 동거인 감염병 일평균 코로나바이러스,http://www.segye.com/content/html/2022/03/20/20220320509372.html,학생복지/교육격차해소,보건관리,학생및교직원보건안전관리,감염병예방관리,"코로나19 대응, 학교 방역, 전염병 예방교육, 감염병 관리 지침",0.6375409364700317
1101101.202203301,20220330,한국일보,안동 경안고 총동창회 후배들에게 장학금,경안고 동창회 장학금 경북 정휘동 전달식 지역사회 학부모 권태조 사학의 4명 후배들 동창회장 졸업생 2만 20학급 동문들 인성함양 50만 원씩 7명 안동경안고 우수입학생 학생들 안동,https://hankookilbo.com/News/Read/A2022032920530003030,교육활동지원,교무업무운영,교무학사운영,교내외장학초빙공모제운영,"장학생 선발, 장학 공모제, 우수학생 유치 프로그램",0.6374663710594177
1100301.202203301,20220330,내일신문,읍 면 지역과 대도시 학업중단 시기 달라,대도시 고등학생 청소년들 한국청소년정책연구원 지원방안 학생들 미인정 김희진 아이들 보고서 중학교 면접조사 오프라인 해외출국 농산어촌 읍면지역,http://www.naeil.com/news_view/?id_art=418574,교육활동지원,생활지도운영,학생생활상담지도,학교부적응학생상담,"학교 부적응 학생, 위기학생 상담, 적응력 강화 교육",0.6374536156654358
1100201.20220316,20220316,국민일보,거지같은 X 나중에 XX서 일할 것 욕설 성희롱 선생님을 고발합니다,제주여고 졸업생 제주평화인권연구소왓 교사들 제주 학생들 제주도교육청 피해자 응답자 성희롱 보고서 선생님 교육청 애들 개연성 막말 관성화 사립여고 생활부 진상조사 제주도 보도자료 술집 성평등인식 개인정보 극소수 문제점,http://news.kmib.co.kr/article/view.asp?arcid=0924235991&code=11131426,인적자원운용,교직원복지및역량강화,교직원복지,성폭력피해자지원,"교내 성폭력 피해자 보호, 교사 성희롱 대응, 성폭력 상담 지원, 피해 교원 지원 제도",0.6373435854911804
1100901.202203021,20220302,중앙일보,새 학기 등교 시작 의무냐 권고냐 자가검사 놓고 혼선,자가검사 서울 교육부 오미크론 아이들 학부모 확진자 교직원 도곡중학교 오랜만 정해웅 조희연 서울시 학부모들 학교들 양자택일,https://www.joongang.co.kr/article/25052332,학생복지/교육격차해소,보건관리,학생및교직원보건안전관리,감염병예방관리,"코로나19 대응, 학교 방역, 전염병 예방교육, 감염병 관리 지침",0.6373164057731628
1100101.202203251,20220325,경향신문,골치 아픈 학생부 작성 AI로 돕는 스쿨로직 정부기관 공식 인증 받아,스쿨로직 투비유니콘 학교생활기록부 한국교육학술정보원 신기술 학생부 유니콘 교사들 윤진욱 학교생활 체험관 neis 교육부 기록부 학생들 ai 투비 미래교육체험관,https://www.khan.co.kr/national/education/article/202203251038001,교육활동지원,교무업무운영,교무학사운영,교육과정평가,"교육과정 평가, 학교 운영 평가, 수업 평가",0.6372887492179871
1100611.202203291,20220329,서울신문,채유미 서울시의원 경계선지능 학생 학창생활 즐기며 안정적 공교육 서비스 필요,경계선 대안학교 채유미 필요성 공교육 서울시의회 학령기 임시회 교육청 예룸예술학교 예하학교 서울특별시의회 학생들 노원 노원5 조희연 교육감 국립형 본회의 더불어민주당 공립대안학교 사회성 위탁교육기관,http://go.seoul.co.kr/news/newsView.php?id=20220329500148,학교일반운영,학교운영협력,관계기관협력,주민참여학교운영,"주민 참여 학교, 지역 개방형 학교, 학교 공동체 운영",0.6372605562210083
1100301.202203021,20220302,내일신문,111개 대학에서 진로 취업 상담,대학일자리플러스센터 고용부 그간 경성대 안경덕 청년들 일자리 325억 상담사 수원대 182억 일원화 노동부 영남이공대 학생들 고용노동부 21억 구직난 접근성 자리매김 취업서비스 지원체계 대학들 대학일자리센터 대학 센터 사업,http://www.naeil.com/news_view/?id_art=415696,선택적교육활동,직업교육,직업교육운영,취업역량강화지원,"취업 지원, 학생 취업역량 강화, 취업 연계 교육",0.6370501518249512
1100751.202203021,20220302,아시아투데이,청도군 오미크론 확산에 발빠른 대처,코로나19 오미크론 청도 신속항원검사키트 황영호 종사자 이용자 박영만 청도군 방역패스 목욕탕 11종 키트 어린이집 다중이용시설 영유아 전환점 예방접종 요양시설 신속항원검사키트9700개 군민들 권한대행 취약계층 변경사항 독거노인응급안전서비스 확진자 확산세 경북 의료체계 방역체계,https://www.asiatoday.co.kr/view.php?key=20220302010000856,학생복지/교육격차해소,보건관리,학생및교직원보건안전관리,감염병예방관리,"코로나19 대응, 학교 방역, 전염병 예방교육, 감염병 관리 지침",0.6370100975036621
1100611.202203311,20220331,서울신문,충북교육청 성비위 재발 확실히 막는다,성비위 도교육청 이수 성폭력 교직원 지원단 성인식 내부위원 피해자 외부위원 충북도교육청 성희롱 충북교육청 피해학생 개선팀 관계자 사회봉사 의무화 전문강사,http://www.seoul.co.kr/news/newsView.php?id=20220331500055,인적자원운용,교직원복지및역량강화,교직원복지,성폭력피해자지원,"교내 성폭력 피해자 보호, 교사 성희롱 대응, 성폭력 상담 지원, 피해 교원 지원 제도",0.6370096206665039
1100701.202203081,20220308,세계일보,자가검사 의무 10일 격리 제각각 기준에 혼돈의 새 학기 뉴스,교육부 학부모 신속항원검사 코로나 코로나19 뉴시스 확진자 등교중지 김씨 등교수업 자가진단 학생들 의심증상 서울 학부모들 방역당국 온라인,http://www.segye.com/content/html/2022/03/08/20220308505043.html,학생복지/교육격차해소,보건관리,학생및교직원보건안전관리,감염병예방관리,"코로나19 대응, 학교 방역, 전염병 예방교육, 감염병 관리 지침",0.6369960904121399
1100751.202203071,20220307,아시아투데이,코로나19 위험도 전국 수도권 비수도권 모두 매우높음,코로나19 위험도 오미크론 방대본 직전주 60세 수도권 박아람 코로나바이러스 아시아투데이 확진자 중환자실 감염증 위중증 스텔스 가동률 비수도권 검출률 6주 중앙방역대책본부 비수도,https://www.asiatoday.co.kr/view.php?key=20220307010003769,학생복지/교육격차해소,보건관리,학생및교직원보건안전관리,감염병예방관리,"코로나19 대응, 학교 방역, 전염병 예방교육, 감염병 관리 지침",0.6366793513298035
1100301.202203101,20220310,내일신문,성공적인 대입을 위한 세특 관리의 모든 것,세특 학생부 데오럭스 고등학교 학종 심화탐구활동 보고서 장광원 고1 학생부종합전형 학생들 심화탐구활동주제 특별반 중학생 학부모 호기심,http://www.naeil.com/news_view/?id_art=416531,교육활동지원,교무업무운영,교무학사운영,입학전형,"학교 입학전형, 입학전형 관리, 전형 일정 공고",0.6366759538650513
1100901.202203151,20220315,중앙일보,중수본 거리두기 조정 앞두고 최근 치명률은 계절독감 수준,사망자 코로나19 위중증 치명률 일상회복 중수본 30만 확진자 손영래 프랑스 미국 일평균 효율화 소상공인 자영업자 중앙사고수습본부 위원회 영업시간,https://www.joongang.co.kr/article/25055531,학생복지/교육격차해소,보건관리,학생및교직원보건안전관리,감염병예방관리,"코로나19 대응, 학교 방역, 전염병 예방교육, 감염병 관리 지침",0.6361405849456787
1100101.202203021,20220302,경향신문,경향포토 대면 강의 시작 코로나 검사소 운영하는 이화여대,이화 서울 검사소 서대문구 학생들 진단검사 예약제 코로나 코로나19 대면수업 이화여대 이화여자대학교 세이프 학기 학생 운영 시작 검사 대면 수업 예약 시행 설치 교내 스테이션 개강 강의,https://www.khan.co.kr/national/national-general/article/202203021153011,학생복지/교육격차해소,보건관리,학생및교직원보건안전관리,감염병예방관리,"코로나19 대응, 학교 방역, 전염병 예방교육, 감염병 관리 지침",0.635783851146698
1100301.202203021,20220302,내일신문,코로나 환자도 응급실 진료 받는다,코로나19 코호트 응급실 호흡기 확진자 유증 오미크론 지자체 응급환자 코로나 서울시 음압병상 응급의료기관 위중증 유증상자 환자들 가벽 개정안 사망자 분주 질병청 지자체들 환기장치 감염병 94병상,http://www.naeil.com/news_view/?id_art=415718,학생복지/교육격차해소,보건관리,학생및교직원보건안전관리,감염병예방관리,"코로나19 대응, 학교 방역, 전염병 예방교육, 감염병 관리 지침",0.6356232762336731
1101101.202203081,20220308,한국일보,인사 교육부 외,대학원장 부처장 부총장 본부장 교학부장 이창수 강태영 산림청 감사관 부원장 아시아경제 조현숙 부단장 고준성 김광용 전지영 제주대 기상청 박태완 김학조 조문제 교무처장 임태훈 원도연 이강성 염준영 한서대 대학원 한경근 심은수 김한일 교육부 환경부 대학장 이근 전애 덕성여대 여인규 이진우 이상훈 김유식 강전훈 박수경 황성훈 성평등상담센터,https://hankookilbo.com/News/Read/A2022030815010004740,학교일반운영,학교기관운영,부서기본운영,교육행정업무운영,"교육행정 운영, 학교 행정 업무, 학사관리 행정 지원",0.6356180310249329
1100901.202203131,20220313,중앙일보,가족 확진돼도 음성 이면 등교 14일부터 바뀌는 학교 방역,교육부 학부모 신속항원검사 확진자 pcr 전문가용 잠복기 오미크론 전문가 학부모들 코로나19 유치원 고등학생 보완책 중학생 유전자,https://www.joongang.co.kr/article/25054968,학생복지/교육격차해소,보건관리,학생및교직원보건안전관리,감염병예방관리,"코로나19 대응, 학교 방역, 전염병 예방교육, 감염병 관리 지침",0.635495662689209
1100701.202203311,20220331,세계일보,5 11세 소아 접종 시작 해외여행 위해 자율적 참여도,코로나19 미즈메디병원 학부모 고위험군 김민균 이상반응 의료진 광주 서울 이씨 보건소 친구들,http://www.segye.com/content/html/2022/03/31/20220331510325.html,학생복지/교육격차해소,보건관리,학생및교직원보건안전관리,감염병예방관리,"코로나19 대응, 학교 방역, 전염병 예방교육, 감염병 관리 지침",0.635188639163971
1101101.202203291,20220329,한국일보,초 중 고 기숙사 학생은 4월에도 자가진단키트 주 2회,키트 교육부 2회 기숙사 코로나19 교직원 시도교육청 선제검사 자가진단키트 교육청 확진자 pcr 120여,https://hankookilbo.com/News/Read/A2022032912310003310,학생복지/교육격차해소,보건관리,학생및교직원보건안전관리,감염병예방관리,"코로나19 대응, 학교 방역, 전염병 예방교육, 감염병 관리 지침",0.6351587176322937
1100901.202203291,20220329,중앙일보,모든 동네 병 의원서 확진자 대면 진료 한의원 포함,확진자 코로나19 외래진료센터 재택치료 호흡기 279곳 의료기관 박향 코로나 그간 시간date 한의원,https://www.joongang.co.kr/article/25059164,학생복지/교육격차해소,보건관리,학생및교직원보건안전관리,감염병예방관리,"코로나19 대응, 학교 방역, 전염병 예방교육, 감염병 관리 지침",0.6351339221000671
1100401.20220315,20220315,동아일보,동네 병 의원 신속검사 북새통 2차 감염 우려도,서울 전문가 관계자 확진자 선별진료소 rat 코로나19 감염증 진료소 신속검사 정은경 이비인후과의원 고양시 과의원 마포구,https://www.donga.com/news/article/all/20220315/112331232/1,학생복지/교육격차해소,보건관리,학생및교직원보건안전관리,감염병예방관리,"코로나19 대응, 학교 방역, 전염병 예방교육, 감염병 관리 지침",0.6349880695343018
1100101.202203221,20220322,경향신문,노숙인도 일반 동네병원 종합병원에서 진료 코로나19 비상조치,복지부 노숙인 감염병 코로나19 개선책 곽숙영 종합병원 한시적 보건소 위원회 민간병원 지방자치단체 국가인권위원회 정책관 수도권 만큼 보건복지부 노숙인들 비상조치 문제점 의료지원제도 노숙인의료급여 진료과목 복지정책관 7만 진료시설 노숙 진료 의료 조치 병원,https://www.khan.co.kr/national/health-welfare/article/202203221611021,학생복지/교육격차해소,보건관리,학생및교직원보건안전관리,감염병예방관리,"코로나19 대응, 학교 방역, 전염병 예방교육, 감염병 관리 지침",0.6349570751190186
1100301.202203241,20220324,내일신문,강남 학교 진학 선생님 중앙대학교사범대학부속고등학교 허충범 교사 진학지도부장,고려대 중대부고 학생들 연세대 학생부 학추 선생님 변호사 학부모 학교장추천전형 대다수 강남 서울 중앙대학교사범대학부속고등학교 오랫동안 서울특별시교육청 경쟁력,http://www.naeil.com/news_view/?id_art=418018,교육활동지원,교무업무운영,교무학사운영,입학전형,"학교 입학전형, 입학전형 관리, 전형 일정 공고",0.6349436640739441
1100401.20220323,20220323,동아일보,코로나의 다양한 증상 이럴땐 이렇게 대처하세요,오미크론 인후통 코막힘 코로나19 닭고기 바깥쪽 해열제 코로나바이러스 비대면 합곡혈 한의원 족삼리혈 목구멍 손허리뼈 소화불량 확진자 건강관리,https://www.donga.com/news/article/all/20220322/112469470/1,학생복지/교육격차해소,보건관리,학생및교직원보건안전관리,감염병예방관리,"코로나19 대응, 학교 방역, 전염병 예방교육, 감염병 관리 지침",0.6349060535430908
1100701.202203291,20220329,세계일보,방역당국 모든 거리두기 일시 해제 시 유행 증폭 가능성 점진적 완화 중,조정안 일상회복지원위원회 가능성 위원회 코로나19 손영래 일상회복 점심시간 다중이용시설 오미크론 중수본 치명률 이동량 지자체 중구 사회전략반장 서울 정례브리핑 다음주 무교동 중앙사고수습본부 방역당국 거리 가능 조치 완화 방역,http://www.segye.com/content/html/2022/03/29/20220329510581.html,학생복지/교육격차해소,보건관리,학생및교직원보건안전관리,감염병예방관리,"코로나19 대응, 학교 방역, 전염병 예방교육, 감염병 관리 지침",0.6348836421966553
1100901.202203241,20220324,중앙일보,코로나 사망자 역대 최다 에 이재갑 한숨 이래서 경고한 것,사망자 코로나19 의료진 이재갑 페이스북 의료체계 국민들 중앙방역대책본부 강남성심병원 코로나바이러스 명씩 위원회 관리청 방대본 감염증 치명률 말장난 일상회복 수차례 확진자 자문위원직 생지옥 한림대학교 40만 코로나,https://www.joongang.co.kr/article/25057950,학생복지/교육격차해소,보건관리,학생및교직원보건안전관리,감염병예방관리,"코로나19 대응, 학교 방역, 전염병 예방교육, 감염병 관리 지침",0.6345518827438354
1100201.202203201,20220320,국민일보,전남도 소아 확진자 관리 강화 거점전담병원 운영,전남도 거점전담병원 전남 11세 코로나19 확진자 6개월 사각지대 보건소 의료공백 시군 3만 외래진료센터 소방본부 후송체계 단순화 전남소방본부 102건 통합관리 구급대 통합진료,http://news.kmib.co.kr/article/view.asp?arcid=0016886928&code=61121111&cp=kd,학생복지/교육격차해소,보건관리,학생및교직원보건안전관리,감염병예방관리,"코로나19 대응, 학교 방역, 전염병 예방교육, 감염병 관리 지침",0.6344690918922424
1100801.202203241,20220324,조선일보,코로나로 사이버 학폭 늘어 온라인 보복도 법으로 금지한다,소셜미디어 온라인 피해자 카카오톡 고등학교 코로나 교육부 정보통신망 통신망 기록부 학교생활 오프라인 위원회 인스타그램 소셜 텔레그램 학교생활기록부 틱톡 학교폭력대책위원회 페이스북 학교폭력예방법 휴대전화,https://www.chosun.com/national/education/2022/03/24/IUZVLK76ONC45LPK4TZ6KQONYU/?utm_source=bigkinds&utm_medium=original&utm_campaign=news,학생복지/교육격차해소,보건관리,학생및교직원보건안전관리,감염병예방관리,"코로나19 대응, 학교 방역, 전염병 예방교육, 감염병 관리 지침",0.6343953609466553
1100751.202203151,20220315,아시아투데이,국민 10명 중 6명 우리 사회 코로나19 통제 불가능,코로나19 완료자 오미크론 실천도 신뢰도 교수팀 이선영 서울대 감염병 유명순 아시아투데이 코로나바이러스 그동안 가능성,https://www.asiatoday.co.kr/view.php?key=20220315010007915,학생복지/교육격차해소,보건관리,학생및교직원보건안전관리,감염병예방관리,"코로나19 대응, 학교 방역, 전염병 예방교육, 감염병 관리 지침",0.6342012882232666
1101001.202203042,20220304,한겨레,나홀로 방역 과 재택치료자 사망,확진자 재택치료 장애인 고위험군 60살 면역저 취약계층 박준용 방역당국 비대면 치료자 독거노인 관리군 오미크론 뉴스레터 집중관리군 코로나19 65살 실태조사 응급상황 심근경색 기입식 의료기관,http://www.hani.co.kr/arti/society/health/1033601.html,학생복지/교육격차해소,보건관리,학생및교직원보건안전관리,감염병예방관리,"코로나19 대응, 학교 방역, 전염병 예방교육, 감염병 관리 지침",0.6340733766555786
1101001.202203101,20220310,한겨레,코로나 의료체계 전환 가속화 일반병실에서도 치료한다,코로나19 감염병 확진자 오미크론 중환자 상급종합병원 손영래 환자들 서울대병원 1급,http://www.hani.co.kr/arti/society/health/1034385.html,학생복지/교육격차해소,보건관리,학생및교직원보건안전관리,감염병예방관리,"코로나19 대응, 학교 방역, 전염병 예방교육, 감염병 관리 지침",0.6336468458175659
1100401.20220303,20220303,동아일보,교과전형 생각한다면 관심 대학의 교과 반영 방법 살펴야,1학기 고3 이투스 진학사 학생부 연구소장 진로선택과목 학생들 교과전형 1학년 교과별 김병진 우연철,https://www.donga.com/news/article/all/20220303/112125874/1,교육활동지원,교무업무운영,교무학사운영,입학전형,"학교 입학전형, 입학전형 관리, 전형 일정 공고",0.6334043741226196
1100201.202203011,20220301,국민일보,충북 학부모 50 4 전면 원격수업 바람직,학부모 코로나19 원격수업 온라인 급식소 학교별 충북 유치원 고교생,http://news.kmib.co.kr/article/view.asp?arcid=0016821665&code=61121111&cp=kd,기본적교육활동,교과활동,교과활동지원,원격수업,"온라인 수업, 비대면 수업, 디지털 학습, 원격 교육",0.6333599090576172
1100501.202203301,20220330,문화일보,속도 빨라지는 일상회복 시민들 감염 피할 방법 없다 걱정,확진자 의료기관 직장인 코로나19 일상회복 위원회 만큼 다중이용시설 직장인들 팀원 대중교통 영업시간 인수위 인원제한 파모 호흡기 확진자들,http://www.munhwa.com/news/view.html?no=2022033001070221000001,학생복지/교육격차해소,보건관리,학생및교직원보건안전관리,감염병예방관리,"코로나19 대응, 학교 방역, 전염병 예방교육, 감염병 관리 지침",0.6333001852035522
1101001.202203031,20220303,한겨레,인권위 코로나 예방 이유로 외출 외박 통제는 인권침해,인권위 교육원 교육생 집합교육 자유권 교육원장 인권침해 코로나19 코로나 원격수업 청원휴가 위험요소 진료입원 청원 집단감염 소정기간 대체방안 국가인권위원회 행정편의 현장배치 순식간 특별휴가 장기간 가능성,http://www.hani.co.kr/arti/society/society_general/1033352.html,학생복지/교육격차해소,보건관리,학생및교직원보건안전관리,감염병예방관리,"코로나19 대응, 학교 방역, 전염병 예방교육, 감염병 관리 지침",0.6332085132598877
