뉴스 식별자,일자,언론사,제목,특성추출(가중치순 상위 50개),URL,대분류,중분류,소분류,세부항목 예시,뉴스 일반 표현,유사도
1100501.202412161,20241216,문화일보,소진공 교육기부 대상 교육부 장관 표창 수상,교육기부 소진공 교육부 고양시 대한민국 부총리 박성효 전통시장 이사장 수여식 소상공인 장진흥공단 소상공인시장진흥공단 킨텍스 시상식 표창 경기 수상 장관 대상 기획 프로그램 학습 경제 실물 사회 지역 방문 시장 수여 전통 기관 청소년 기여 어린이 참석 기부 활성,http://www.munhwa.com/news/view.html?no=2024121601072907170001,인적자원운용,교직원복지및역량강화,교직원복지,교직원포상,"우수 교사 포상, 교원 격려, 교직원 사기 진작, 교육 공로상",0.643861711025238
1100301.202412181,20241218,내일신문,최소 시간 들여 최대 효과 추구하는 초등 통합영어 수업 진행,오세용 다산 고등학교 학생들 2025학년도 기본기 오세용어학원 학년도 5학년 영어전문학원 매직영어,https://www.naeil.com/news/read/532725?ref=bigkinds,기본적교육활동,교과활동,외국어교과활동,창의경영학교(영어),"영어 수업, 외국어 말하기 대회, 원어민 수업, 글로벌 언어 교육",0.6438250541687012
1100401.20241206,20241206,동아일보,다문화 이주여성 정착 돕는 한국 엄마,다문화 한국 경남 수상자 전북 우수상 동아 특별상 나주시 한국어 이주민 일대일 김제 임소현 가족센터 서울 중랑구 화성시 이사회 박수진,https://www.donga.com/news/Society/article/all/20241206/130580151/2,학생복지/교육격차해소,교육격차해소,기타교육격차해소지원,다문화가정지원,"다문화가정 학생 지원, 다문화 교육 정책, 중도입국 학생",0.6437559723854065
1100901.2024122,20241220,중앙일보,초등 여교사 제자 성폭행 혐의로 구속 학교 측이 신고,중앙일보 여교사 성폭행 시부모 관계자 교육청 인사위원회 대전교육청 부조금 더중플 50만 위원회 대전경찰청 미성년자 제강간 남학생 다음날 mc 교사 구속 수사 경찰 학교 혐의 신고 임종 요구 장례 징계 개시 대전 제자,https://www.joongang.co.kr/article/25301562,인적자원운용,교직원복지및역량강화,교직원복지,성폭력피해자지원,"교내 성폭력 피해자 보호, 교사 성희롱 대응, 성폭력 상담 지원, 피해 교원 지원 제도",0.643631637096405
1100901.20241219,20241219,중앙일보,대입 내비게이션 가 나 다군 모두 선발 군별 복수지원 가능 수능일반전형 수능 80 학생부 20 반영,상지대 한의예과 입학처 수험생 학과들 군별 수시이월 수능일반전형 실기일반전형 홈페이지 메디컬 융복합 백분위 학생들 다군,https://www.joongang.co.kr/article/25301176,교육활동지원,교무업무운영,교무학사운영,입학전형,"학교 입학전형, 입학전형 관리, 전형 일정 공고",0.6435679793357849
1100701.20241225,20241225,세계일보,IB교육 고교 확산 걸림돌은 대입 관련 전형 확대 힘쓸 것 심층기획 미래역량 키우는 IB교육,ib 한국 1기 경북대사대부고 학생들 대구시교육청 대구 강은희 토론토 졸업생 아이들 캐나다 설명회,http://www.segye.com/content/html/2024/12/24/20241224512450.html,선택적교육활동,기타선택적교육활동,창의교육운영,영재교육운영,"영재교육, 영재학생 발굴, 수월성 교육, 창의인재 육성",0.6435081958770752
1100751.202412131,20241213,아시아투데이,전국 시도교육청 최초 위험성 평가 우수사업장에 경기교육청,우수사업장 사업장 교육청 도교육청 한국산업안전보건공단 경기도교육청 남부청사 사업주 김주홍 아시아투데이 배영환 경기도교육청교육연수원,https://www.asiatoday.co.kr/view.php?key=20241213010007707,교육활동지원,연구학교운영,연구학교운영,시도교육청지정,"교육청 지정 연구학교, 시도교육청 시범학교",0.6424537301063538
1100611.202412131,20241213,서울신문,서울시의회 예산결산특별위원회 2025년도 서울시 교육청 예산안 의결,예산안 서울시 사업비 교육청 위원장 위원회 서울시교육청 예비비 코로나19 계획안 정례회 예산결산특별위원회 마을버스 고등학교 부담액 911억 기금운용계획안 서울시의회 최민규,http://go.seoul.co.kr/news/newsView.php?id=20241213500156,학교재무활동,예비비,예비비,예비비,"교육청 예비비, 긴급 예산 편성, 비상 재정 집행",0.6419533491134644
1100401.2024121,20241210,동아일보,고려대 안산병원에 초등 영재교육센터 문 연다,영재교육센터 고려대 안산병원 안산시 연다 이민근 실습비 교육생 3차원 홈페이지 고려대안산병원 의공학 교육비 안산시청 질의응답 로봇팔 5학년 안산 의학관 교수진 학교장 청진기 대회의실,https://www.donga.com/news/Society/article/all/20241210/130605108/2,선택적교육활동,기타선택적교육활동,창의교육운영,영재교육운영,"영재교육, 영재학생 발굴, 수월성 교육, 창의인재 육성",0.641525387763977
1100751.202412111,20241211,아시아투데이,경북구미 원당 월항초 질문하는 학교 평가서 우수사례 선정,경북교육청 선도학교 경북 우수사례 평가서 고등학교 중학교 특수학교 교육부 문봉현 아시아투데이 원당 성주 임종식 4개 교육감 구미 월항 학생들,https://www.asiatoday.co.kr/view.php?key=20241211010006357,교육활동지원,교무업무운영,교무학사운영,교육과정평가,"교육과정 평가, 학교 운영 평가, 수업 평가",0.6408069729804993
1100401.20241226,20241226,동아일보,늘봄학교 전도사 5인이 전하는 아이들 행복 지원,늘봄학교 아이들 식습관 경북 늘봄 아산 시군 경북교육청 대학교,https://www.donga.com/news/Society/article/all/20241225/130703329/1,선택적교육활동,방과후학교운영,늘봄학교운영,늘봄학교(교실)운영,"늘봄학교 운영, 돌봄교실 확장, 온종일 교육체계, 학교 중심 돌봄",0.6406047344207764
1100751.20241204,20241204,아시아투데이,경찰청 사회적 약자 보호 추진위원회 발족 범죄 근절 강화,경찰청 위원회 피해자 전문가 정기회의 피해자보호 설소영 자문단 법조계 형사국장 조정관 사이버수사심의관 감사관 민간위원 심의관 수시회의 시민단체 생활안전교통국장 조지호 수사기획조정관 민간단체 대책관 정책토론회 여성안전학교폭력대책관,https://www.asiatoday.co.kr/view.php?key=20241204010002075,교육활동지원,생활지도운영,학교폭력예방,학교폭력전담기구운영,"학교폭력 전담기구, 학교폭력대응 조직, 학교폭력대책위 운영",0.6405857801437378
1100701.20241218,20241218,세계일보,탈북청소년의 버팀목 글로벌 인재로 키워야죠 차 한잔 나누며,장대현학교 미국 독일 대한민국 장대현중 체험학습 탈북학생 기숙사 학생들 2명 통일인재 졸업생 풀브라이트 강서구 부산 탈북대안학교 전문가,http://www.segye.com/content/html/2024/12/17/20241217515108.html,학생복지/교육격차해소,교육격차해소,기타교육격차해소지원,탈북학생지원,"탈북학생 지원, 북한이탈주민 교육, 다문화 학생 지원 확대",0.6404003500938416
1100701.202412231,20241223,세계일보,잘못 쓴 원서 수정될까 정시 원서 접수 전 확인할 사항은 입시톡톡,경쟁률 진학사 원서접수 학년도 1개 전문대 대행사 수험생 정시모집 이중등록 제출서류 경찰대학 복수지원 입학원서 입시톡톡,http://www.segye.com/content/html/2024/12/23/20241223511256.html,교육활동지원,교무업무운영,교무학사운영,입학전형,"학교 입학전형, 입학전형 관리, 전형 일정 공고",0.640224039554596
1101101.202412021,20241202,한국일보,교육 변혁은 당면 과제 한국 성공사례 세계에 공유,유네스코 교육청 보고서 한국 경기도교육청 회원국 불평등 하이러닝 경기교육 미래교육 수원컨벤션센터 임태희 공교육,https://www.hankookilbo.com/News/Read/A2024120215500004268,교육활동지원,교무업무운영,교무학사운영,교육과정평가,"교육과정 평가, 학교 운영 평가, 수업 평가",0.6399298310279846
1100501.202412111,20241211,문화일보,서울시교육청 14일 중학생 대상 진로 진학 설명회 대입 고교생활 강의한다,설명회 중학생 서울시교육청 중학교 고교생활 학교생활 교육연구정보원 정근식 서울교육 사정관 서울 고려대 유튜브 정보원 학부모 공교육 2번 서울시 정상화 전문성 교육감 기록부 학교생활기록부,http://www.munhwa.com/news/view.html?no=2024121101039921043001,기본적교육활동,창의적체험활동,진로활동,진로상담활동,"진로 상담, 진로 멘토링, 학생 진로 설계 지도, 진로코칭 프로그램",0.6398196220397949
1100201.202412032,20241203,국민일보,제주 학교비정규직 6일 파업 일부 학교 대체식 제공,총파업 대체식 교육청 유치원 연대회의 제주도교육청 급식실 기본급 교육당국 전년도 학교급식 종사자들 노동자,https://www.kmib.co.kr/article/view.asp?arcid=0020834747&code=61121111&cp=kd,학생복지/교육격차해소,급식관리,학교급식운영,위탁급식비,"급식 외주 운영, 급식 위탁 서비스, 민간 급식 위탁, 위탁급식 예산",0.6395413875579834
1100901.20241224,20241224,중앙일보,교육이 미래다 LINC3 0 마이스터대학 등 교육부 주요 사업에서 최우수평가받아,연성대 대한민국 교육부 클라우드 2개 마이스터대학 등록금 최우수평가 정시모집 전문대학 140여 1학기 고등학교 반값 전문대 학생부 어학연수,https://www.joongang.co.kr/article/25302381,교육활동지원,연구학교운영,연구학교운영,교육부지정,"교육부 지정 연구학교, 시범학교 운영, 정책 실험학교",0.6394442915916443
1100751.202412181,20241218,아시아투데이,충남교육청 겨울방학 석면해체 학교 안전교육,겨울방학 관계자 교육부 학부모 모니터단 김관태 아시아투데이 건축물 충남교육청 충남도교육청 불안감 학교장 사무관 대리인 시민단체 현장대리인 안전성 감독관 교육청 관리인,https://www.asiatoday.co.kr/view.php?key=20241218010010581,교육활동지원,생활지도운영,학생안전교육,안전교육,"학생 안전교육, 생활안전 교육, 학교 안전 지침",0.639257550239563
1100101.202412192,20241219,경향신문,감기 조심하세요 20일 전국에 독감 유행주의보 발령,인플루엔자 입원환자 호흡기 감염증 코로나19 연령층 표본감시 의원급 4주 질병청 65세 마이코플라즈마 rsv 의사환자 주의보 여름철 pdm09 백일해,https://www.khan.co.kr/article/202412192059001,학생복지/교육격차해소,보건관리,학생및교직원보건안전관리,감염병예방관리,"코로나19 대응, 학교 방역, 전염병 예방교육, 감염병 관리 지침",0.6390604972839355
1100701.202412161,20241216,세계일보,4년제 영유아교육과 등장할까 유보통합 교원 전문성 높여야,영유아 교육부 5세 정교사 영유아교육과 2세 개편안 김은설 전문성 공청회 일원화 학회장 고영미 연계성 박대림 교육과 유보통합,http://www.segye.com/content/html/2024/12/16/20241216514171.html,인적자원운용,교직원복지및역량강화,교직원역량강화,직무연수,"교사 연수, 직무교육, 교사 역량 강화 프로그램",0.6387991309165955
1100751.202412301,20241230,아시아투데이,부산교육청 겨울방학 고1 2학년 대상 창의 융합 강좌 개설,부산시교육청 겨울방학 교육과정 학생들 고등학교 이수 7교 부산교육청 조영돌 아시아투데이 창체 특목고 자율고 일반고 기록부,https://www.asiatoday.co.kr/view.php?key=20241230010016130,기본적교육활동,교과활동,교과활동지원,공동교육과정운영,"고교 공동교육과정, 학교 간 교육과정 공유, 맞춤형 수업 운영, 교육과정 다양화",0.6385712027549744
1100751.202412291,20241229,아시아투데이,경북도 최중중 발달장애인 24시간 개인별 맞춤형 서비스,장애인 경북도 최중증 1대 사회생활 통합돌봄서비스 18세 대상자 통합돌 의사소통 거주지 권영문 문봉현 아시아투데이 경주 시군 4곳 통합돌봄센터,https://www.asiatoday.co.kr/view.php?key=20241229010015226,기본적교육활동,창의적체험활동,봉사활동,장애학생돌보기,"장애학생 돌봄, 특수학생 지원 활동, 장애인식 개선 봉사, 통합교육 봉사활동",0.6385040879249573
1100701.20241202,20241202,세계일보,한국직업능력교육원 2025학년도 고교위탁 신입생 모집,고등학교 신입생 한직교 일반고 한국직업능력교육원 고교위탁과정 자격증 필기시험 교육비 2학년 특화과정 학년도 홈페이지 멀티미디어 영상편집 스마트내선전기 교육부 그래픽디자인 노동부 직업능력개발사업 기숙사 부여 대학진학 학생들 교육과정 시흥 고용노동부 장려금,http://www.segye.com/content/html/2024/12/02/20241202503996.html,교육활동지원,교무업무운영,교무학사운영,입학전형,"학교 입학전형, 입학전형 관리, 전형 일정 공고",0.6384196877479553
1100301.202412122,20241212,내일신문,국어를 잘하는 방법,고등학교 모의고사 중학교 문해력 비문학 학부모 이해력 사고력 학생들 파주 운정 김호경 아공 주기능 평가원 화작 중학생 지문씩 언매 문제집 45문제 어휘력 학부모들 독해력,https://www.naeil.com/news/read/532109?ref=bigkinds,기본적교육활동,교과활동,국어교과활동,국어교과운영,"국어 교과 수업, 국어과 교육활동, 국어 학습 프로그램, 국어 교과 운영",0.6381500363349915
1101101.202412192,20241219,한국일보,전국에 독감 유행주의보 발령 예방접종 서둘러야,인플루엔자 백신주 질병청 50주차 주의보 유행주의보 지영미 코로나19 12세 호흡기 감염병 감염위험 49세 면역저 18세 나이별 관리청 의사환자분률 세계보건기구 47주 5개월 방역당국 예방접종,https://www.hankookilbo.com/News/Read/A2024121921030000553,학생복지/교육격차해소,보건관리,학생및교직원보건안전관리,감염병예방관리,"코로나19 대응, 학교 방역, 전염병 예방교육, 감염병 관리 지침",0.6381147503852844
1100801.20241204,20241204,조선일보,교육부 모든 업무와 학사일정 정상운영 정상 등교,교육부 비상계엄 정상운영 종북 대통령실 계엄사 학사일정 예산탄핵 입법독재 민주당 각급 용산 기자단 자유헌정질서 대한민국 교육청 윤석열 정상 자유 공지 세력 변동 위협 일정 학사 긴급 대통령 별도 통보 선포 안내 등교,https://www.chosun.com/politics/politics_general/2024/12/04/T5F3M2KFCNB5HP7JXYIAZ2UW5U/?utm_source=bigkinds&utm_medium=original&utm_campaign=news,교육활동지원,교무업무운영,교무학사운영,교무학사운영,"학사 운영, 교육행정 운영, 학교 일정 관리",0.6381018757820129
1100301.20241219,20241219,내일신문,내신 영문법 정리와 제2외국어 전공어 학습에 대하여,스페인어 중계동 중학교 국제고 전공어 외국어 뉴욕어학원 js뉴욕어학원 영문법 넥서스 한국식 은행사거리 선생님 que 1등급 특목고 대일외고 서울외고 뉴욕주립대학교 제2외국어 중1,https://www.naeil.com/news/read/532733?ref=bigkinds,기본적교육활동,교과활동,외국어교과활동,외국어교과운영,"영어 수업, 외국어 말하기 대회, 원어민 수업, 글로벌 언어 교육",0.637395977973938
1100501.202412181,20241218,문화일보,박형덕 동두천시장 경기교육대상 교육협력분야 표창 수상,경기도 교육청 동두천시 동두천 경기교육대상 동두천시장 박형덕 학생들 장학금 교육협력분야 임태희 수강료 5억,http://www.munhwa.com/news/view.html?no=2024121801039927204013,인적자원운용,교직원복지및역량강화,교직원복지,교직원포상,"우수 교사 포상, 교원 격려, 교직원 사기 진작, 교육 공로상",0.6370627284049988
1100201.202412191,20241219,국민일보,나군 일반전형 최초합격자 2년간 장학금 지급,한양대 장학금 자연계열 일반전형 가군 나군 군별 무전공 한양인터칼리지학부 다군 수험생 상경계열 합격자 입학처 정시모집 홈페이지 위원회 충원율,https://www.kmib.co.kr/article/view.asp?arcid=1734410395&code=11131300,학생복지/교육격차해소,학생복지,학생장학금운영,학생장학금지원,"장학금 지급, 학생 장학 제도, 교육비 지원, 장학생 선발 공고",0.6368969082832336
1100301.202412282,20241228,내일신문,서울시립대 동계 글로벌봉사단 발대식,캄보디아 글로벌봉사단 서울시립대학교 발대식 봉사단 프놈펜 교직원 재학생 기념관 활용법 기획법 주년 봉사단원 치어리딩 해외봉사 봉사단원들 사전교육 원용걸 봉사활동 찬윤국제학교 케이팝 sdgs 한국어 운동회 학년도 wfk 시간date wfk공통교육과정 서울시립대,https://www.naeil.com/news/read/533656?ref=bigkinds,기본적교육활동,창의적체험활동,봉사활동,봉사캠페인,"학생 봉사활동, 사회공헌 캠페인, 학교 내 봉사 문화, 지역사회 기여",0.6366321444511414
1100611.202412271,20241227,서울신문,청소년부터 사회복지사까지 챙긴 도봉 복지 칭찬해,도봉 도봉구 사회복지사 온라인 독거노인 자격증 복지사 청바지 복지사업 5개 도봉구민 자체평가 밥먹,http://www.seoul.co.kr/news/newsView.php?id=20241227500185,학생복지/교육격차해소,학생복지,교육복지우선,교육복지사인건비,"교육복지사 채용, 교육복지 인력 확충, 취약계층 교육 지원",0.6359944939613342
1100201.202412021,20241202,국민일보,인천시교육청 해외대학 교육감 추천 전형 선발 추진,한국뉴욕주립대 교육감 대상자 인천 시교육청 겐트대 뉴욕주립대 인천시교육청 관계자 한국 법정차상위계층 재원자 수급자 국립대만대 한부모가족지원대상자 인도네시아국립대 국립대 고등학교 호주테잎퀸즐랜드대 김민 산동대 대만국립청화대 아동복지시설 중국 8곳 사회통합대상자 장학금 한국조지메이슨대 인천글로벌캠퍼스 학년도 학생들 인천시,https://www.kmib.co.kr/article/view.asp?arcid=0020812655&code=61122012&cp=kd,교육활동지원,연구학교운영,연구학교운영,시도교육청지정,"교육청 지정 연구학교, 시도교육청 시범학교",0.6359387636184692
1100611.202412261,20241226,서울신문,광주시교육청 공립중등교사 1차시험 합격자 발표,합격자 선정경쟁시험 광주 교직적성심층면접 광주시교육청 광주체육고등학교 온라인 교직원 전문상담 교수교과 서미애 최종합격자 누리집 전체교과 전남공업고등학교 실기시험 일반교과 후보자 중등학교 학년도,http://www.seoul.co.kr/news/newsView.php?id=20241226500078,교육활동지원,교무업무운영,교무학사운영,교육과정평가,"교육과정 평가, 학교 운영 평가, 수업 평가",0.6358559131622314
1100901.20241226,20241226,중앙일보,급식조리원들 폐암 부르는 주방의 살인자 정부 대기오염물질 지정,조리흄 대기오염물질 미국 발병 교육청 배출량 총파업 급식실 환경부 내년도 노동자 조리원 배출원,https://www.joongang.co.kr/article/25302843,학생복지/교육격차해소,보건관리,학교환경위생관리,공기질관리,"미세먼지 대응, 학교 공기질, 환기 시스템, 공기청정기 설치",0.6353741884231567
1100301.202412191,20241219,내일신문,서울특별시교육청 2025학년도 국제고 외국어고 자사고 자기주도학습전형 원서접수 현황,자사고 일반전형 지원율 2025학년도 사회통합전형 국제고 외국어고 학년도 원서접수 서울 휘문고 서울특별시교육청 중동고 지원자 신일고,https://www.naeil.com/news/read/532890?ref=bigkinds,교육활동지원,교무업무운영,교무학사운영,입학전형,"학교 입학전형, 입학전형 관리, 전형 일정 공고",0.6351955533027649
1100101.20241204,20241204,경향신문,속보 교육부 비상계엄에 모든 업무 학사일정 정상운영,비상계엄 정상운영 윤석열 교육부 학사일정 업무 정상 일정 학사 계엄 비상 대통령 선포 운영,https://www.khan.co.kr/article/202412040054001,교육활동지원,교무업무운영,교무학사운영,교무학사운영,"학사 운영, 교육행정 운영, 학교 일정 관리",0.6349817514419556
1100611.202412041,20241204,서울신문,임태희 경기교육감 교육행정 업무 학사 일정 정상 유지 지시,교육감 비상계엄 임태희 경기도 결의안 교직원분들 교직원 학부모 학생들 sns 업무 학생 지시 교육 국회 선포 해제 일정 정상 유지 학사 도내 행정 현장 자신 학교 안전 이날 걱정 요구,http://www.seoul.co.kr/news/newsView.php?id=20241204500166,학교일반운영,학교기관운영,부서기본운영,교육행정업무운영,"교육행정 운영, 학교 행정 업무, 학사관리 행정 지원",0.6349226832389832
1100611.202412161,20241216,서울신문,제주특별자치도교육청 탐라교육원 AI 디지털교과서 적용 교원 맞춤형 연수 성료,ai 탐라교육원 제주 그동안 교육청 관리자,http://www.seoul.co.kr/news/newsView.php?id=20241216500039,인적자원운용,교직원복지및역량강화,교직원역량강화,기타역량강화지원,"교직원 자기개발, 역량강화 프로그램, 교사 성장 지원, 교원 역량 개발 사업",0.6348811984062195
1100701.202412041,20241204,세계일보,비상계엄이 뭐냐면 교사들 자발적 자료 공유하고 수업 활용,비상계엄 계엄령 민주주의 교사들 ppt 대한민국 인디스쿨 시간대 아이들 문서파일 교육자료 사람들 민주화 첫날 시민단체 전국역사교사모임 불법성 필요성 민주공화국 24페이지 서울,http://www.segye.com/content/html/2024/12/04/20241204510155.html,기본적교육활동,교과활동,교과활동지원,교과협의회운영,"교과협의회 운영, 교사 수업 공유, 수업 전문성 강화, 교사 간 공동체",0.6346926093101501
1100201.20241223,20241223,국민일보,2025학년도 의대 수시 정시 이월인원 이번주 발표,합격자 학년도 모집인원 교육부 이주호 부총리 교육위 교육당국 서울,,교육활동지원,교무업무운영,교무학사운영,입학전형,"학교 입학전형, 입학전형 관리, 전형 일정 공고",0.6345260143280029
1100301.202412031,20241203,내일신문,AI 디지털교과서 한 곳에서 본다,한국교과서연구재단 ai 교육격차 76종 출원사 사후보상 사전게재 인공지능 저작권 교과용 교육부 민원바로처리 황보은 고등학교 이사장 교사들 홈페이지 학습자 학생들 시간date 교과서 학습 사용 교사 제공 학교 해소 전국 작용 즉시 도서 지위 피드백 전시,https://www.naeil.com/news/read/530923?ref=bigkinds,기본적교육활동,교과활동,정보교과활동,교육용SW확충,"정보 수업, 코딩 교육, 소프트웨어 교육, 디지털 리터러시",0.6344956755638123
1100301.202412081,20241208,내일신문,서울사이버대 심리학과 마음챙김 명상 특강,심리학 zoom 심리사 서울사이버대 사이버대 교육부 자격증 상담사 이우경 미산 심리학과 상반기 연구소 코칭 서울 대학교 사이버대학 옥스퍼드대학교 kaist 온라인 시니어,https://www.naeil.com/news/read/531514?ref=bigkinds,교육활동지원,생활지도운영,학생생활상담지도,치유프로그램,"심리치유 프로그램, 학생 정서 회복, 정신건강 프로그램",0.6343031525611877
1100751.202412011,20241201,아시아투데이,김대중 전남교육감 일로 청망분교 찾아 농어촌 학교 현장 소통 2030교실 준비 만전,전남 글로컬 나광국 농어촌학교 농어촌 김대중 청망 교육감 2030교실 교육청 박재현 청망분교 분교장 전남교육청 대중교통 청망분교장 김보훈 이명남 아시아투데이,https://www.asiatoday.co.kr/view.php?key=20241201010000049,교육활동지원,연구학교운영,연구학교운영,시도교육청지정,"교육청 지정 연구학교, 시도교육청 시범학교",0.6337401270866394
1100301.20241201,20241201,내일신문,한성대 진로 취업 페스티벌 진행,공기업 외국계 한성대 장명희 졸업생 재직자 현직자 센터장 학생들 작성법 재학생 대학일자리 대학일자리플러스센터 활용법 한국데이터산업진흥원,https://www.naeil.com/news/read/530722?ref=bigkinds,선택적교육활동,기타선택적교육활동,기타선택적교육운영,대학교육실습생운영,"교육실습 운영, 예비교사 실습, 대학교 연계 실습",0.6333932280540466
