뉴스 식별자,일자,언론사,제목,특성추출(가중치순 상위 50개),URL,대분류,중분류,소분류,세부항목 예시,뉴스 일반 표현,유사도
1100301.202203281,20220328,내일신문,대입 성패 가르는 수학 성적 맞춤형 개별수업으로 올린다,학생들 진도 제이샘 제이샘수학 중학교 개별수업 분당지역 문제해결력 고등학교 해결력 고1 학습상황 학습관리 자사고 화성고 재원생 강의력 교육과정 용인외대부고 선택과목 학부모 극대화,http://www.naeil.com/news_view/?id_art=418313,기본적교육활동,교과활동,수학교과활동,창의경영학교운영,"수학 수업, 수학 보충수업, 수학 창의력 프로그램, 수학 체험활동",0.665388822555542
1100201.20220331,20220331,국민일보,대면 비대면은 교수님 마음대로 대학생들 발만 동동,비대면 서울대 온라인 한양대 고려대 학생들 성균관대 한국외대 서울 오미크론 코로나 엄문영,http://news.kmib.co.kr/article/view.asp?arcid=0924238530&code=11131300,기본적교육활동,교과활동,교과활동지원,원격수업,"온라인 수업, 비대면 수업, 디지털 학습, 원격 교육",0.6653567552566528
1100701.202203071,20220307,세계일보,방역당국 전문가용 신속항원검사로 확진 판정 내리는 방안 마련 중,전문가용 pcr 신속항원검사 확진자 전문가 감염병 코로나19 방역당국 권덕철 지자체 검사량 과부하 정은경 중구 서울 코로나바이러스 진료소 유전자증폭,http://www.segye.com/content/html/2022/03/07/20220307515922.html,학생복지/교육격차해소,보건관리,학생및교직원보건안전관리,감염병예방관리,"코로나19 대응, 학교 방역, 전염병 예방교육, 감염병 관리 지침",0.6651757955551147
1100701.202203231,20220323,세계일보,의료체계 붕괴 위기 의료진 환자 보호 대책 필요,코로나19 의료진 확진자 위중증 서울 기자회견 전국보건의료산업노동조합 감염병 종로구 사무실 격리기간 치료비 통의동 위원회 세종문화회관,http://www.segye.com/content/html/2022/03/23/20220323513661.html,학생복지/교육격차해소,보건관리,학생및교직원보건안전관리,감염병예방관리,"코로나19 대응, 학교 방역, 전염병 예방교육, 감염병 관리 지침",0.6649979948997498
1100901.202203141,20220314,중앙일보,동작구 자원봉사센터 자원봉사자 전문교육 운영,봉사자 동작구 자원봉사자 서울시자원봉사센터 코로나19 자원봉사센터 봉사단 손가방 코바늘 겨울철 병충해 최성연 봉사활동 센터장 동작구민 수료증 동작 이웃들 미니담요 아이들 보수교육 온라인 수강후기 자원봉사,https://www.joongang.co.kr/article/25055283,선택적교육활동,직업교육,직업교육운영,직업교육운영,"직업교육, 진로직업 교육, 기술교육 강화, 실무형 인재 양성",0.6647903323173523
1100751.202203271,20220327,아시아투데이,영광교육지원청 꿈을 키우는 영재 세상을 바꿀 인재 키운다 영광영재교육원 개강,영광영재교육원 영광 학생들 영재교육원 영재교육 지도교사 개강식 임명장 영광교육지원청 학부모 김춘곤 사고력 신동준 교육장 지원청 영광여중 김나현 팀원들 세미나실 지역사회 심화융합교육 터즈 6학년 스타세미나실 서포,https://www.asiatoday.co.kr/view.php?key=20220327010015155,선택적교육활동,기타선택적교육활동,창의교육운영,영재교육운영,"영재교육, 영재학생 발굴, 수월성 교육, 창의인재 육성",0.6647465229034424
1101001.202203111,20220311,한겨레,인천 경찰 학폭 예방도 맞춤형으로,학폭 설문조사 프로파일링 학원가 학생들 그동안 인천 맞춤형 여성청소년계장 논현 백승철 하굣길 방송시설 방송실 논현서 상담소 서창 3곳 경찰관 논현경찰서 학교전담경찰관 예방교육 예방 학생 경찰 학교 활동 맞춤,http://www.hani.co.kr/arti/area/capital/1034524.html,교육활동지원,생활지도운영,학교폭력예방,학교폭력관련연수지원,"학교폭력 연수, 교사 연수 프로그램, 폭력 예방 교육",0.6646257638931274
1101101.20220308,20220308,한국일보,교사 확진에도 원격수업 중 대체교사 7만5000명은 어딜 갔나,서울 교육부 경북 7만 교육청 대체교사 오미크론 확진자 수도권 원격수업 병가,https://hankookilbo.com/News/Read/A2022030716590000435,인적자원운용,기타교직원보수,교직원대체인건비,교원대체인건비,"기간제 교사, 대체 교사, 출산휴가 교사, 교사 인력난",0.6644458174705505
1100201.202203031,20220303,국민일보,총신대 장애인 교육 강화한 디지털 콘텐츠 제작,총신대 장애인 교육사업자 에프엔제이 손병덕 과학기술정보통신부 사업자 경기도 대국민 지자체 진흥원 한국 연구소 에프 부총장 한국지능정보사회진흥원 협력단 엔제이 총신미디어연구소 이재서 트위그팜 교육과정 리터 디지털 교육 사업 총신,http://news.kmib.co.kr/article/view.asp?arcid=0016831230&code=61121111&cp=kd,기본적교육활동,교과활동,특수교육교과활동,특수교육지도사인건비,"특수교과 운영, 장애학생 교과 수업, 통합교육 교과 지원",0.6643787026405334
1100101.202203291,20220329,경향신문,코로나 교원 부족에 시간강사 학교장 교감 휴직자 등 총동원령,교육부 교육청 신속항원검사 시도교육청 키트 공공물량 총동원령 교직원 경남 장학사 선제검사 지원청 오미크론 확진자,https://www.khan.co.kr/national/education/article/202203291557011,학생복지/교육격차해소,보건관리,학생및교직원보건안전관리,감염병예방관리,"코로나19 대응, 학교 방역, 전염병 예방교육, 감염병 관리 지침",0.6643215417861938
1100301.202203151,20220315,내일신문,코로나 나도 감염가능 인식 최고,코로나19 서울대 유명순 신뢰도 확진자 오미크론 실천도 감염가능 대학원 오미크론변 그간 최저치 인식조사 최고치 가능성 코로나 인식 조사 감염 국민 통제 자제 교수 응답 최고 비율 기록 가능 결과,http://www.naeil.com/news_view/?id_art=416873,학생복지/교육격차해소,보건관리,학생및교직원보건안전관리,감염병예방관리,"코로나19 대응, 학교 방역, 전염병 예방교육, 감염병 관리 지침",0.6643187403678894
1101101.202203151,20220315,한국일보,섹시하다 제자 상습 성추행 중학 교사 파면 교장 교감 전보,성희롱 중학교 교육청 부산교육청 위원회 성추행 징계위원회 성폭력 학부모 여학생 복지법 여학생들 관계자 징계위 피해자 부산 고충심의 중징계,https://hankookilbo.com/News/Read/A2022031512200000569,인적자원운용,교직원복지및역량강화,교직원복지,성폭력피해자지원,"교내 성폭력 피해자 보호, 교사 성희롱 대응, 성폭력 상담 지원, 피해 교원 지원 제도",0.6643114686012268
1100751.202203241,20220324,아시아투데이,코로나 비대면 확대로 사이버 폭력 증가 학교폭력 대책 강화,학교폭력 온라인 김부겸 코로나19 부총리,https://www.asiatoday.co.kr/view.php?key=20220324010014263,학생복지/교육격차해소,보건관리,학생및교직원보건안전관리,감염병예방관리,"코로나19 대응, 학교 방역, 전염병 예방교육, 감염병 관리 지침",0.6640708446502686
1100751.202203021,20220302,아시아투데이,예천군 중 고등학교 신입생 입학준비금 지원,고등학교 신입생 입학준비금 예천군 장성훈 예천 거주지 준비금 제외대상 중복지원 학부모 고등학생들 보호자 행정복지센터 30만 풍천중 관계자 고등학생 1인 원씩 풍산중 아시아투데이 경북 지원 교육 신입,https://www.asiatoday.co.kr/view.php?key=20220302010000522,학생복지/교육격차해소,학생복지,학생장학금운영,학생장학금지원,"장학금 지급, 학생 장학 제도, 교육비 지원, 장학생 선발 공고",0.6637305021286011
1100401.20220303,20220303,동아일보,거리두기 조기완화 이르면 내일 발표,확진자 코로나19 오미크론 사실상 의료계 손영래 사망자 영업시간 방역당국 위중증 코로나바이러스 가천대길병원 중환자,https://www.donga.com/news/article/all/20220303/112125430/1,학생복지/교육격차해소,보건관리,학생및교직원보건안전관리,감염병예방관리,"코로나19 대응, 학교 방역, 전염병 예방교육, 감염병 관리 지침",0.6636942028999329
1100501.202203031,20220303,문화일보,제주항공 대학들과 항공 안전 산학협력 나서,제주항공 안전관리 항공안전 산학협력 제주 관계자 항공인 실습비행 명지전문대 교육장 학창시절 산학협력관계 안전의식 광주대 항공서비스과 극동대 항공산업 현장체험 현장실습 학과들 항공안전교육 대학들 항공 교육 안전 협력 서비스 대학 현장 실습 의식 중심 사내 산학 학과 예정 비행,http://www.munhwa.com/news/view.html?no=20220303MW104201519932,선택적교육활동,직업교육,직업교육운영,산학훈련연계교육,"산학협력 교육, 산학 연계 프로그램, 현장연계 수업",0.663587212562561
1100751.202203271,20220327,아시아투데이,소방호스 대신 마술봉 잡은 소방관들,소방안전교육 집중도 소방본부 충남 김영배 김관태 다목적회의실 소방서 참가자 소방관들 팀장 참가자들 회의실 소방관 마술봉 충남내포 딜라이트 삼색로프 강의기법 상대적 마술사 근무자 소방안전강사 차별화 충남소방본부 스토리텔링 참가들 양선,https://www.asiatoday.co.kr/view.php?key=20220327010015118,교육활동지원,생활지도운영,학생안전교육,소방훈련,"학교 소방훈련, 화재 대피 훈련, 소방 안전 교육",0.6633593440055847
1100751.202203111,20220311,아시아투데이,원포인트건강 코로나 검사로 약해진 코점막 어떻게 관리하나,코로나19 호흡기 키트 코점막 미세먼지 코로나 아이들 김시영 코로나바이러스 이종훈 콧물 면역력 오메가3 오메가 영양제 가능성 식습관 공진단 상대적 생활관리 경옥고 혈액순환 남녀노소,https://www.asiatoday.co.kr/view.php?key=20220311010006259,학생복지/교육격차해소,보건관리,학생및교직원보건안전관리,감염병예방관리,"코로나19 대응, 학교 방역, 전염병 예방교육, 감염병 관리 지침",0.6632732152938843
1100301.202203101,20220310,내일신문,새 학기 유 초등생에게 필요한 영어 공부,어바인어학원 파닉스 미국 자신감 부천 정작 리딩 문해력 수행평가 영어교육 사고력,http://www.naeil.com/news_view/?id_art=416385,기본적교육활동,교과활동,외국어교과활동,외국어교과운영,"영어 수업, 외국어 말하기 대회, 원어민 수업, 글로벌 언어 교육",0.6630319356918335
1100701.20220318,20220318,세계일보,HIV 검사 신고 급감 코로나19 유행 파급,hiv 코로나19 보건소 감염병 질병청 대한적십자사 우리나라 이환,http://www.segye.com/content/html/2022/03/18/20220318504232.html,학생복지/교육격차해소,보건관리,학생및교직원보건안전관리,감염병예방관리,"코로나19 대응, 학교 방역, 전염병 예방교육, 감염병 관리 지침",0.6628885865211487
1100751.20220302,20220302,아시아투데이,충남도서관 상반기 평생학습강좌 진행,그림책 상반기 지도사 보호자 김관태 충남도서관 캘리그라피 수채화 펜드로잉 도서관 도서관장 나병준 준비과정 발표력 여행영어 주민들 자격증 연령대 양성과정 교육기관,https://www.asiatoday.co.kr/view.php?key=20220302010000441,선택적교육활동,독서활동,독서활동운영,도서관운영,"학교 도서관, 도서관 활성화, 도서관 이용 교육",0.6628189086914062
1100201.20220301,20220301,국민일보,일주학술문화재단 30기 국내학사 장학생 선발,태광그룹 대학교 수급자 장학생 거주자 설립자 일주학술문화재단 이임용 생활비 공동생활 전공자 일주재단 허승조 등록금 세분화 이사장 가산점 장학사업 봉사활동 부여 창업자 학년도 선발 장학,http://news.kmib.co.kr/article/view.asp?arcid=0924233776&code=11151400,학생복지/교육격차해소,학생복지,학생장학금운영,학생장학금지원,"장학금 지급, 학생 장학 제도, 교육비 지원, 장학생 선발 공고",0.662816047668457
1100301.20220322,20220322,내일신문,영어 배운다 가 아닌 즐겁게 받아들인다 가 중요합니다,강동원더랜드 아이들 필리핀 미국 국제학교 바서티 딸들 유아영어교육 영어교육 esl 어머니들 한국 유아기 눈높이 자신감 엘카미노 컬리지 더존한얼국제학교 알라방 1등 전국대회 사람과 제2외국어 외국어 학교장 고등학교 직장인 varsity,http://www.naeil.com/news_view/?id_art=417718,기본적교육활동,교과활동,외국어교과활동,외국어교과운영,"영어 수업, 외국어 말하기 대회, 원어민 수업, 글로벌 언어 교육",0.6627910733222961
1100751.202203141,20220314,아시아투데이,이천시 다문화가족 자녀 대상 방문학습지 지원 사업 참여자 모집,다문화 다문화가정 중리동 전년도 참여자 이천시 다문화가족 학습지 9개월 남명우 이천 중도입국 한국어 만4 조손 수급자 10세 수업비 한부모 주민등록 장애인 3000원 3층 대상자 2순위 3자녀,https://www.asiatoday.co.kr/view.php?key=20220314010007462,선택적교육활동,기타선택적교육활동,다문화교육운영,다문화교육프로그램운영비,"다문화 교육 프로그램, 중도입국자 교육, 다문화 체험 활동",0.6627247333526611
1100901.20220317,20220317,중앙일보,THE CREATIVE 2022 AR VR 활용한 실감형 실습 교육으로 몰입도 높여,메타버스 입학식 순천향대 교육과정 대한민국 실시간 블렌디드 이프랜드 ar 대학교 online 순천향 팬데믹 코로나19 미디어인사이드센터 영상학 오프라인 몰입도 offline 간호학과 스칼라 순천향대학교 애니메이션학 하이브리드 아바타 높여 공연영상학과 ifland skt 비대면,https://www.joongang.co.kr/article/25056046,선택적교육활동,기타선택적교육활동,기타선택적교육운영,대학교육실습생운영,"교육실습 운영, 예비교사 실습, 대학교 연계 실습",0.6625921726226807
1100301.202203241,20220324,내일신문,코딩교육 아이들에게 검증된 목동 소엔코딩과 함께 하세요,소엔코딩 아이들 학생들 파이썬 목동 소엔코딩학원 양천구 공모전 가능성 동기부여 센트럴프라자 잠재력 목동서 주입식 부여 코드페어 작품들 창의력 코딩교육 소엔코딩이 휴머노이드 눈앞,http://www.naeil.com/news_view/?id_art=418003,기본적교육활동,교과활동,정보교과활동,코딩교육활동,"정보 수업, 코딩 교육, 소프트웨어 교육, 디지털 리터러시",0.6625447273254395
1100611.202203111,20220311,서울신문,지금 중국 학교는 코로나19 환자와 학생 한 곳에 몰아넣고 쉬쉬,학생들 코로나19 중국 지린농업과학기술대학 관계자 지린성 소셜미디어 확진자 자원봉사자 sns 조회수 온라인 봉사자 누리꾼,http://nownews.seoul.co.kr/news/newsView.php?id=20220311601005,학생복지/교육격차해소,보건관리,학생및교직원보건안전관리,감염병예방관리,"코로나19 대응, 학교 방역, 전염병 예방교육, 감염병 관리 지침",0.6624568104743958
1101101.202203311,20220331,한국일보,코로나 원격수업에 직업계고 학생 64 전공 실습 줄어,원격수업 직업계 학생들 김남희 직능연 코로나19 보고서 교육부 국무총리 카카오톡 필요성 유튜브 한국직업능력연구원 부연구 등교수업 부연구위원 직업계고 실습키트 키트 온라인,https://hankookilbo.com/News/Read/A2022033110320001683,기본적교육활동,교과활동,교과활동지원,원격수업,"온라인 수업, 비대면 수업, 디지털 학습, 원격 교육",0.6619748473167419
1101101.202203011,20220301,한국일보,대학 일자리센터 이제 동네 청년 도 지원한다,대학일자리플러스센터 구직난 일자리 안경덕 노동부 고용부 재학생 고용노동부 졸업생 부산,https://hankookilbo.com/News/Read/A2022030111000005016,선택적교육활동,직업교육,직업교육운영,취업역량강화지원,"취업 지원, 학생 취업역량 강화, 취업 연계 교육",0.6619137525558472
1100751.202203241,20220324,아시아투데이,내일부터 60세 이상 고위험군도 셀프방역,관리군 확진자 고위험군 집중관리군 60세 치료제 코로나19 팍스로비드 일반관리군 의료기관 신속항원검사 그간 재택치료 이대목동병원 천은미 아시아투데이 코로나바이러스 박아람 라게브리오 셀프방역 면역저하자,https://www.asiatoday.co.kr/view.php?key=20220324010014398,학생복지/교육격차해소,보건관리,학생및교직원보건안전관리,감염병예방관리,"코로나19 대응, 학교 방역, 전염병 예방교육, 감염병 관리 지침",0.6615384817123413
1100611.202203171,20220317,서울신문,서울포토 코로나19 자가진단키트 소분작업 하는 조희연 교육감,적십자사 코로나19 조희연 소분 교육감 서울 봉사자 학생들 서울특별시 키트 자원봉사자들 관계자 소분작업 진단키트 서울시 송파구 자가 작업 자원 지사 진단 학생 학교,http://www.seoul.co.kr/news/newsView.php?id=20220317500083,학생복지/교육격차해소,보건관리,학생및교직원보건안전관리,감염병예방관리,"코로나19 대응, 학교 방역, 전염병 예방교육, 감염병 관리 지침",0.661532998085022
1100101.202203171,20220317,경향신문,수업할 교사가 없다 코로나 확진자 폭증에 학교도 대란,서울시교육청 확진자 교육청 소분 교직원 코로나19 오미크론 교육당국 대체교사 교사들 아이들 고등학교 학부모 서울 교육부 인력풀 보결 자가진단키트 대체인력풀 코로나 정소영 채용조건 전교조,https://www.khan.co.kr/national/education/article/202203171623001,인적자원운용,기타교직원보수,교직원대체인건비,교원대체인건비,"기간제 교사, 대체 교사, 출산휴가 교사, 교사 인력난",0.6611537337303162
1100401.20220315,20220315,동아일보,한반 23명중 6명 격리에 담임도 확진 초등교 코로나 노이로제,확진자 코로나19 학부모 담임교사 동아일보 등교수업 서울 6명 대면수업 이대목동병원 원격수업 천은미 교육부 코로나바이러스,https://www.donga.com/news/article/all/20220315/112331276/1,학생복지/교육격차해소,보건관리,학생및교직원보건안전관리,감염병예방관리,"코로나19 대응, 학교 방역, 전염병 예방교육, 감염병 관리 지침",0.6611412167549133
1100201.20220311,20220311,국민일보,새 학기 적응 주간 끝나도 현행 등교 방식 유지,교육부 코로나19 오미크론 확산세 원격수업 강원 교직원 전담병원 정상등교 대면진료 유치원 대구 세종,http://news.kmib.co.kr/article/view.asp?arcid=0924235461&code=11131300,학생복지/교육격차해소,보건관리,학생및교직원보건안전관리,감염병예방관리,"코로나19 대응, 학교 방역, 전염병 예방교육, 감염병 관리 지침",0.6609324812889099
1100301.202203081,20220308,내일신문,세종대 대학일자리플러스센터 사업 선정,일자리 세종대 고용노동부 지역청년 황용식 종합서비스 진로취업 취창업 사업비 노동부 산업체 지원사업 환경변화 공기업 졸업생 생활심리 일본취업 반도체 원스톱 세종대학교 재학생 배덕효 일본 거점형 사업단,http://www.naeil.com/news_view/?id_art=416227,선택적교육활동,직업교육,직업교육운영,취업역량강화지원,"취업 지원, 학생 취업역량 강화, 취업 연계 교육",0.6606976985931396
1101101.202203311,20220331,한국일보,미래사회 이끌 역량 교육 글로벌 인재 로,문경 교육과정 특성화 gvcs글로벌선진학교 4개 ai 인공지능 빅데이터 외국어 제2외국어 일본어 스페인어 독일어 모국어 블록체인 미래산업사회 독서교육 이사장 세종 미국 미래사회 교육현장 남진석 문경캠퍼스 혁신안 캠퍼스별 학생들 교육환경 science bio sports gvcs design sports트랙 design트랙 교육 트랙 인재,https://hankookilbo.com/News/Read/A2022033110020001555,선택적교육활동,직업교육,직업교육운영,직업교육운영,"직업교육, 진로직업 교육, 기술교육 강화, 실무형 인재 양성",0.6603845357894897
1100611.202203141,20220314,서울신문,정부 거리두기 검토 이번 주에 시작 정점 늦어도 다음 주,위중증 코로나19 손영래 예측치 위원회 일상회복 대응체계 중수본 영업시간 일상회복지원위원회 방향성 사회전략반장 확진자 일요일 이달말 거리 반장 검토 환자 조치 적용 유행 현행,http://www.seoul.co.kr/news/newsView.php?id=20220314500098,학생복지/교육격차해소,보건관리,학생및교직원보건안전관리,감염병예방관리,"코로나19 대응, 학교 방역, 전염병 예방교육, 감염병 관리 지침",0.6602566242218018
1100501.202203171,20220317,문화일보,검사 폭증 약 품귀 진료 마비 의료체계 셧다운 될라,코로나19 의료진 서울 상급종합병원 확진자 관계자 rat 감염병 키트 최지영 유전자 유전자증폭 전문가 감기약 끼리 전세원 의료체계 해열제 60만,http://www.munhwa.com/news/view.html?no=2022031701070821338001,학생복지/교육격차해소,보건관리,학생및교직원보건안전관리,감염병예방관리,"코로나19 대응, 학교 방역, 전염병 예방교육, 감염병 관리 지침",0.6598621606826782
1100301.202203081,20220308,내일신문,그린스마트 미래학교 공정한 민주시민 키워낼 창의적 공간,교육부 미래학교 사용자 학부모 교육과정 ai 한국 사전기획 그린학교 미래교육 공간혁신 공감대 사고력,http://www.naeil.com/news_view/?id_art=416250,교육활동지원,연구학교운영,연구학교운영,교육지원청지정,"교육지원청 지정 연구학교, 지역 연구학교",0.659844160079956
1100401.20220317,20220317,동아일보,사설 확진자 늘수록 더 푸는 방역 과연 이게 정상인가,확진자 코로나19 오미크론 영국 한국 중환자 감염병 일주일 위중증 스텔스 치료자 사망자 재택치료자 화장시설 타이레놀 감기약 과부하 50만 의료체계 미국 입국자 파급효과 국무총리,https://www.donga.com/news/article/all/20220316/112368318/1,학생복지/교육격차해소,보건관리,학생및교직원보건안전관리,감염병예방관리,"코로나19 대응, 학교 방역, 전염병 예방교육, 감염병 관리 지침",0.6597844362258911
1100701.202203101,20220310,세계일보,새 학기 적응기간 이후에도 전면 원격수업 가능,교육부 키트 확진자 코로나19 교직원 서울 학교장 1주일 조달청 유은혜 오미크론 교육청 전면원격수업 2개 적응기간 신설학교,http://www.segye.com/content/html/2022/03/10/20220310507948.html,기본적교육활동,교과활동,교과활동지원,원격수업,"온라인 수업, 비대면 수업, 디지털 학습, 원격 교육",0.6596591472625732
1100801.2022031,20220310,조선일보,대면수업 하다가 코로나로 결석자 있다 갑자기 줌 수업,코로나 비대면 강의실 서울대 서울 확진자 학생들 사립대 대학가 연세대 그중 대면수업 화상회의 녹화본 교내외,https://www.chosun.com/national/national_general/2022/03/10/32TWAVTHUBCJ7CCHWHC7UCHD5Y/?utm_source=bigkinds&utm_medium=original&utm_campaign=news,학생복지/교육격차해소,보건관리,학생및교직원보건안전관리,감염병예방관리,"코로나19 대응, 학교 방역, 전염병 예방교육, 감염병 관리 지침",0.6595989465713501
1100611.20220325,20220325,서울신문,코로나 이후 결국 사람이 해답이다,사회계약 문제들 코로나 샤피크 공유해 미노슈 공공복리 팬데믹 코로나19 기성세대 청년층 1만 현재진행형 7500원 324쪽 시민들 피해자 전환기 해결책 안정성 인간다 실업자 21세기 조건들 감염병 이주만 고정불변 노인층 구성원 사람들 그중,http://www.seoul.co.kr/news/newsView.php?id=20220325020002,학생복지/교육격차해소,보건관리,학생및교직원보건안전관리,감염병예방관리,"코로나19 대응, 학교 방역, 전염병 예방교육, 감염병 관리 지침",0.659199059009552
1100611.20220323,20220323,서울신문,1000만명 국민 5명 중 1명 코로나 확진,코로나19 확진자 오미크론 호흡기 스텔스 치료제 의료체계 중환자실 손영래 장기전 1명 정은경 접종자 감소세 한림대성심병원 준중증 정기석 가동률 1000만,http://www.seoul.co.kr/news/newsView.php?id=20220323001009,학생복지/교육격차해소,보건관리,학생및교직원보건안전관리,감염병예방관리,"코로나19 대응, 학교 방역, 전염병 예방교육, 감염병 관리 지침",0.6590896248817444
