뉴스 식별자,일자,언론사,제목,특성추출(가중치순 상위 50개),URL,대분류,중분류,소분류,세부항목 예시,뉴스 일반 표현,유사도
1100701.202204062,20220406,세계일보,다문화칼럼함께하는세상 그녀들은 자라난다 기대한 만큼,한국어 참가자 학부모 시부모 한마디 정종운 모국어 결혼이민여성 호기심 서울 다정 여성들 캄보디아 시아버지 한국어교실 지은씨 지은 남편들 구로구가족센터장 구로구 1학년 구석구석 코로나19 중국어 연애결혼 한국 소통언어 그간 자가격리 친구들 가족들 1단계 센터장 이야길,http://www.segye.com/content/html/2022/04/06/20220406514038.html,기본적교육활동,창의적체험활동,봉사활동,다문화가정,"다문화가정 이해교육, 다문화 학생 봉사, 문화다양성 교육, 국제이해 교육",0.6398101449012756
1101001.202204071,20220407,한겨레,확진 학생도 중간고사 볼 수 있을까 방역당국 허용 검토,교육부 확진자 코로나19 중간고사 방대본 인정점 대면시험 위원회 교육청 운영계획 방역당국 안철수 학부모 박영준 공무원,http://www.hani.co.kr/arti/society/schooling/1037957.html,교육활동지원,교무업무운영,교무학사운영,교육과정평가,"교육과정 평가, 학교 운영 평가, 수업 평가",0.6397435069084167
1100751.202204261,20220426,아시아투데이,아산교육지원청 충남교육발전 유공자 표창패 수여,아산 충남 김정순 유공자 강지현 이동현 사회통합 이영경 손정희 권나연 교통안전 이사장 이경범 임도훈 교육감 류덕희 아산교육지원청 표창패 이신학 아산시 권은하 미래장학회 분들,https://www.asiatoday.co.kr/view.php?key=20220426010015626,인적자원운용,교직원복지및역량강화,교직원복지,교직원포상,"우수 교사 포상, 교원 격려, 교직원 사기 진작, 교육 공로상",0.639703631401062
1100401.20220418,20220418,동아일보,아프면 쉬고 마스크 쓰고 하루 3번 환기 생활 속 자가방역 3원칙,코로나19 가림막 기정사실 질환자 올가을 일주일 재유행 전문가 안산병원 배상환 한국건설기술연구원 성심병원 청정기 호흡기 최원석 정기석,https://www.donga.com/news/article/all/20220418/112935245/1,학생복지/교육격차해소,보건관리,학생및교직원보건안전관리,감염병예방관리,"코로나19 대응, 학교 방역, 전염병 예방교육, 감염병 관리 지침",0.6394771933555603
1100751.202204061,20220406,아시아투데이,충남도교육청 배움 과 쉼 이 있는 학교 운동장 만든다,운동장 마사토 마사토운동장 질의응답 설명회 체육활동 김지철 70여명 배수로 김관태 충남도교육청 환경개선사업 행정실장 70억 학생들 충남 비구망 학교장 주민들 유해물질 지원청 교육청 교육감 유지관리 탈바꿈 환경친화적,https://www.asiatoday.co.kr/view.php?key=20220406010003210,기본적교육활동,교과활동,체육교과활동,체육교육활성화,"체육 수업, 체력 증진 활동, 체육대회, 학생 스포츠 활동",0.6394644975662231
1100201.202204211,20220421,국민일보,광주동부교육청 장애학생 인권보호 업무협약,정낙주 광주동부교육지원청 박정선 지원청 쉼터 광주 협력체계 협약식 인권침해 구심점 곽행숙 광주광역시피해 교육장 광주동부교육청 장애인 장애학생들 유관기관 팀장 학교교육,http://news.kmib.co.kr/article/view.asp?arcid=0016998565&code=61121111&cp=kd,기본적교육활동,창의적체험활동,봉사활동,장애학생돌보기,"장애학생 돌봄, 특수학생 지원 활동, 장애인식 개선 봉사, 통합교육 봉사활동",0.6394073367118835
1100901.202204201,20220420,중앙일보,서경대학교 국가근로장학 취업연계 중점대학 사업 3년 연속 선정,서경대학교 한국장학재단 취업역량 학생들 최영철 서경대 국가근로 서울 산업체 장학금 취업연계중점대학사업,https://www.joongang.co.kr/article/25064976,학생복지/교육격차해소,학생복지,학생장학금운영,학생장학금지원,"장학금 지급, 학생 장학 제도, 교육비 지원, 장학생 선발 공고",0.6392879486083984
1100401.202204131,20220413,동아일보,정부 코로나 집단면역 쉽지 않아 소규모 유행 반복,오미크론 집단면역 가능성 손영래 감염증 중대본 코로나19 집단면역체계 코로나 대통령직인수위원회 영업시간 대유행 tbs 우리나라 위원회 사회전략반장 인수위 조정안 일상회복 코로나바이러스 방역당국 겨울철,https://www.donga.com/news/article/all/20220413/112859542/2,학생복지/교육격차해소,보건관리,학생및교직원보건안전관리,감염병예방관리,"코로나19 대응, 학교 방역, 전염병 예방교육, 감염병 관리 지침",0.6392574310302734
1100751.202204201,20220420,아시아투데이,문체부 관광공사 신중년 경단녀 대상 관광분야 취업 교육 진행,신중년 실무자 한국관광공사 경력단절여성 김성환 홈페이지 아시아투데이 워크위즈 현장실습 문화체육관광부 수도권 관광공사 심화반 전직자 관광부 지역소멸 무장애여행 대상별 경력자 200여 관광기업 관광정보통신기술 경단녀 8회,https://www.asiatoday.co.kr/view.php?key=20220420010012089,선택적교육활동,직업교육,직업교육운영,직업교육운영,"직업교육, 진로직업 교육, 기술교육 강화, 실무형 인재 양성",0.6391279697418213
1100401.20220422,20220422,동아일보,신문과 놀자 주니어를 위한 사설 따라잡기 코로나와의 전쟁 아직 끝 아니다,코로나 팬데믹 치료제 동아이지에듀 좌지우지 우왕좌왕 오미크론 문제점 실내외 발병 다중이용시설 고령층 규제들 기저질환자 자가격리 위중증 전문가 확진자,https://www.donga.com/news/article/all/20220421/113018159/1,학생복지/교육격차해소,보건관리,학생및교직원보건안전관리,감염병예방관리,"코로나19 대응, 학교 방역, 전염병 예방교육, 감염병 관리 지침",0.6390050649642944
1100301.202204221,20220422,내일신문,장애인들이 거리에 나선 이유 이동권 등하교 출근도 이동권 보장돼야 가능 사회와 연결 시작점,장애인 이동권 저상버스 장애인들 보급률 교통약자 전장연 서울 이동편 출근길 교통수단 전국장애인차별철폐연대 지역별 목표치 서울시 시작점 콜택시 우리나라,http://www.naeil.com/news_view/?id_art=421044,교육활동지원,교육여건개선,교육환경개선,장애인편의시설관리,"장애인 편의시설, 무장애 학교, 장애인 접근성 개선",0.6389456987380981
1100751.202204111,20220411,아시아투데이,남양주시 2022년 청소년 집단상담 및 교육 운영,남양주시 청소년들 남경화 지역아동센터 구성서 남양주 고위기 공동체 고등학교 학생들 의사소통 감정조절 자격증 스마트폰 남양주시청 대인관계 자존감 존중감 학교폭력 과의존 남양주시청소년상담복지센터 일시청소년쉼터 위기청소년 안전망 위기청소년들,https://www.asiatoday.co.kr/view.php?key=20220411010005885,교육활동지원,생활지도운영,학생생활상담지도,위클래스운영,"위클래스 상담실, 학생 정서 지원, 학교 상담센터",0.6388513445854187
1100101.20220428,20220428,경향신문,2년 만에 숙박형 교육프로그램 부활 5월부터 교육현장 정상화,정상화 확진자 특수학교 교육활동 교육현장 각급 방역체계 중등학교 점심시간 유증 유증상자 질환자 분류일 기저질환자 유치원 도교육청 오미크론 선제검사 후학교 바깥놀이,https://www.khan.co.kr/national/national-general/article/202204280804001,선택적교육활동,방과후학교운영,늘봄학교운영,늘봄학교(교실)운영,"늘봄학교 운영, 돌봄교실 확장, 온종일 교육체계, 학교 중심 돌봄",0.6387654542922974
1101001.202204201,20220420,한겨레,11회 비정규 노동 수기 공모전 나는 초등돌봄전담사입니다 상 김현희,아이들 시간date 전담사 배움터 자격증 선생님 체험학습 담사 김현희 교육청 낙오자 사명감 자존감 경력단절 무기계약 노동시간 학교장 천근만근 교통정리 발버둥 최우선 불안감 체력고갈 내외곽 봄전,http://www.hani.co.kr/arti/opinion/column/1039749.html,학생복지/교육격차해소,학생복지,교육복지우선,교육복지사인건비,"교육복지사 채용, 교육복지 인력 확충, 취약계층 교육 지원",0.6387203931808472
1101101.202204211,20220421,한국일보,성희롱 의혹 홍대 미대 교수 해임 학생들 환영,피해자 홍익대 변호사 a교수 박예림 거짓말 정상혁 가해자 징계위 인권센터 피해자들 교수윤리헌장 학생들 성희롱 성폭력 양희도,https://hankookilbo.com/News/Read/A2022042110390003549,인적자원운용,교직원복지및역량강화,교직원복지,성폭력피해자지원,"교내 성폭력 피해자 보호, 교사 성희롱 대응, 성폭력 상담 지원, 피해 교원 지원 제도",0.6386972069740295
1100701.20220413,20220413,세계일보,정부 집단면역 도달 일상회복 기지개 켜나,코로나19 확진자 오미크론 방대본 일상회복 재감염 교육부 영국 서울 일평균 접종군 재조합 xl 집단면역 사망자 손영래 정호영 해외입국,http://www.segye.com/content/html/2022/04/12/20220412517572.html,학생복지/교육격차해소,보건관리,학생및교직원보건안전관리,감염병예방관리,"코로나19 대응, 학교 방역, 전염병 예방교육, 감염병 관리 지침",0.6384190320968628
1100401.202204141,20220414,동아일보,질병청 코로나19 유행 정점 완전히 지났다 새 일상 준비,일평균 대변인 정점기 확진자 코로나19 고재영 고령자 80대 코로나바이러스 감소세 고위험군 최소화 62만,https://www.donga.com/news/article/all/20220414/112879775/2,학생복지/교육격차해소,보건관리,학생및교직원보건안전관리,감염병예방관리,"코로나19 대응, 학교 방역, 전염병 예방교육, 감염병 관리 지침",0.638384222984314
1100701.20220412,20220412,세계일보,인천대 과학영재교육원 수도권 권역센터 지정,인천대 과학영재교육원 교육원 권역센터 온라인 한국과학창의재단 대학부설 그간 인천시 목포대 인천대학교 중학생 호남,http://www.segye.com/content/html/2022/04/11/20220411506471.html,교육활동지원,연구학교운영,연구학교운영,교육지원청지정,"교육지원청 지정 연구학교, 지역 연구학교",0.6383175849914551
1100801.20220416,20220416,조선일보,감염병 2급 낮춘 정부 재확산땐 다시 1급 전문가들 간보기하나,코로나 감염병 확진자 이행기 엔데믹 사망자 코로나19 오미크론 1급 팬데믹 간보기 종교시설 2급 2주,https://www.chosun.com/national/welfare-medical/2022/04/16/TVJV3VHWQNEBTBN4535MXYFEZI/?utm_source=bigkinds&utm_medium=original&utm_campaign=news,학생복지/교육격차해소,보건관리,학생및교직원보건안전관리,감염병예방관리,"코로나19 대응, 학교 방역, 전염병 예방교육, 감염병 관리 지침",0.6382636427879333
1100701.20220406,20220406,세계일보,공기정화식물로 초교 교실 숲 꾸며요,현대모비스 임직원 서울 이현복 트리플래닛 임직원들 사무국장 공기정화식물들 환경수업 학생들 연구소 매력적 교실숲 밀알학교 식목일 밀알 공기정화식물 용인 600여명 esg사무국장 esg 교실 화분 학교 사회 프로젝트 환경 기업,http://www.segye.com/content/html/2022/04/05/20220405515522.html,기본적교육활동,창의적체험활동,봉사활동,환경미화활동,"학교 환경미화, 교내 청소활동, 녹색 환경 캠페인, 학생 환경 보호활동",0.6382334232330322
1100751.202204131,20220413,아시아투데이,전남교육청 한국섬진흥원과 섬지역 교육 발전 협의회 운영,한국섬진흥원 협의회 팀장 김유동 전남교육청 섬학교 네트워크 전남 이명남 진흥원 남악 한국섬 전라남도교육청 영상회의실 교육청,https://www.asiatoday.co.kr/view.php?key=20220413010007329,교육활동지원,연구학교운영,연구학교운영,교육지원청지정,"교육지원청 지정 연구학교, 지역 연구학교",0.638165295124054
1100901.20220429,20220429,중앙일보,issue 전시 공연 지원에 VR 직업훈련까지 장애인의 자립과 사회참여 응원,장애인 vr 포스코 나눔재단 이훈 이훈씨 포스코1 포항 음악가 장애인들 코로나19 직업훈련 목함 발달장애인들 예술인 명도학교 보조기구 유공자 음악회,https://www.joongang.co.kr/article/25067393,기본적교육활동,창의적체험활동,봉사활동,장애학생돌보기,"장애학생 돌봄, 특수학생 지원 활동, 장애인식 개선 봉사, 통합교육 봉사활동",0.6381313800811768
1100501.202204061,20220406,문화일보,사고 심리치료 안아드림 10월까지 무료상담 제공,심리치료 피해자 대상자 고속도 고속도로 교통사고 안아드림 도로공사 온라인 후유증 대학생 100만 500만 비전캠프 장학금 사회관계망 김진숙 한국도로공사 희망자 고속도로장학재단 피해가족 피해자들 로장학재단 심리 사고,http://www.munhwa.com/news/view.html?no=2022040601032621087001,교육활동지원,생활지도운영,학생생활상담지도,치유프로그램,"심리치유 프로그램, 학생 정서 회복, 정신건강 프로그램",0.6380585432052612
1100201.202204071,20220407,국민일보,방역당국 확진자 격리기간 7일 지나도 전파 위험성 있어,확진자 자가격리 격리기간 전파력 박영준 이상원 코로나19 팀장 방역당국 생존력 생활치료센터 무증상 관리청 감염력 위험도 역학조사분석단장 각국 일상생활 감염차단 재택치료 격리시설 전파감염력 대응가능 주변인 감염법 기간 격리,http://news.kmib.co.kr/article/view.asp?arcid=0016950695&code=61121111&cp=kd,학생복지/교육격차해소,보건관리,학생및교직원보건안전관리,감염병예방관리,"코로나19 대응, 학교 방역, 전염병 예방교육, 감염병 관리 지침",0.6379663944244385
1100501.202204051,20220405,문화일보,코로나 항체 보유자 얼마나 될까 1만명 표본설계 방법 등 논의 돌입,코로나19 확진자 참여자 안철수 위원회 보건소 1426만 표본설계 주민등록인구현황 이대목동병원 천은미 단기간 1만 전문가,http://www.munhwa.com/news/view.html?no=2022040501070909043001,학생복지/교육격차해소,보건관리,학생및교직원보건안전관리,감염병예방관리,"코로나19 대응, 학교 방역, 전염병 예방교육, 감염병 관리 지침",0.6379024982452393
1101001.202204271,20220427,한겨레,한평생 장애 어머니 보며 약자 위한 사회운동 다짐했죠,이사장 장애인 학생운동 인생학교 이동일 공동체 발달장애인 마을공동체 현대식 외조모 조정법 성균관대 한국 살림집 아이들 횡성군,http://www.hani.co.kr/arti/culture/book/1040654.html,기본적교육활동,창의적체험활동,봉사활동,장애학생돌보기,"장애학생 돌봄, 특수학생 지원 활동, 장애인식 개선 봉사, 통합교육 봉사활동",0.6376731991767883
1100611.202204181,20220418,서울신문,안철수 마스크 관련 방역조치 완화 신중하게 검토,코로나19 안철수 위원장 위원회 전문가 전문가들 인수위 고위험군 60세 대국민 감염병 면역수준 대유행 최소화 의료분 방위적 코로나비상 코로나특위,http://www.seoul.co.kr/news/newsView.php?id=20220418500147,학생복지/교육격차해소,보건관리,학생및교직원보건안전관리,감염병예방관리,"코로나19 대응, 학교 방역, 전염병 예방교육, 감염병 관리 지침",0.6375965476036072
1100201.20220417,20220417,국민일보,영진전문대 뷰티융합과에서 복현중 진로체험,진로체험 복현중학교 영진전문대 중학생 1학년 홍정아 복현중 전문가 뷰티융합 전문기기 신정민 손채연 브레이드 체험학습 친구들 뷰티아티스트 교수님 교육기부 학생들 시간date 융합학 융합과 영진전문대학교,http://news.kmib.co.kr/article/view.asp?arcid=0016982439&code=61122020&cp=kd,기본적교육활동,창의적체험활동,진로활동,진로체험,"직업체험 활동, 진로체험학습, 현장직업 체험, 미래직업 탐색",0.6372860670089722
1100401.20220421,20220421,동아일보,글로벌 스탠다드 MBA로 실무형 교육 초점,mba ku 장학금 차세대 인사조직 미국 등록금 장관상 통찰력 전공과목 고품질 국제인증 경영자 건국대학교 건국대,https://www.donga.com/news/article/all/20220420/112982072/1,선택적교육활동,직업교육,직업교육운영,직업교육운영,"직업교육, 진로직업 교육, 기술교육 강화, 실무형 인재 양성",0.6371784806251526
1100751.202204111,20220411,아시아투데이,안산시 코로나19 확산에 따라 민방위 교육 사이버로 추진,민방위 통지서 코로나19 대원 홈페이지 이수 엄명수 민방위대원 안산 민방위교육 카카오페이 네이버 이수증 전자통지서 행정복지센터 직장민방위대원 과태료 관계자 종이통지서 안산시 지역민방위대원 미수신 스마트폰 자원봉사활동 민방위법 서면교육 서면,https://www.asiatoday.co.kr/view.php?key=20220411010005497,학생복지/교육격차해소,보건관리,학생및교직원보건안전관리,감염병예방관리,"코로나19 대응, 학교 방역, 전염병 예방교육, 감염병 관리 지침",0.6370662450790405
1100751.202204111,20220411,아시아투데이,이르면 5월 실외서 마스크 벗는다 내주 거리두기 전면 해제,코로나19 위중증 오미크론 월요일 9만 방역조치 중환자실 확진자 손영래 개정안 1주 의무화,https://www.asiatoday.co.kr/view.php?key=20220411010005849,학생복지/교육격차해소,보건관리,학생및교직원보건안전관리,감염병예방관리,"코로나19 대응, 학교 방역, 전염병 예방교육, 감염병 관리 지침",0.6370524764060974
1100701.202204141,20220414,세계일보,선원건설 참사랑평화학교에 컴퓨터 기증,선원건설 참사랑평화학교 맹학열 송순현 참사랑 청소년들 학생들 신원건설 대표이사 13대 네트워크망 손글씨 아이들 주변기기 웹캠 지배구조 감사장 협력사 사회공헌사업 다문화 참사랑학교 기념촬영 컴퓨터들 esg 청심it 컴퓨터 학교 기증 청소년 사회 지원 교육 학생,http://www.segye.com/content/html/2022/04/14/20220414509781.html,교육활동지원,교육여건개선,교육환경개선,PC구입,"PC 교체, 학교 컴퓨터 구매, 교육용 컴퓨터",0.6369775533676147
1100701.20220408,20220408,세계일보,한국도박문제관리센터 서울경찰 여성청소년과와 청소년 도박 문제 업무협약,한국도박문제관리센터 서울경찰청 도박문제 사무국장 한국 박영대 공봉석 사무국 학생들 학교전담경찰관 여성청소년과장 경찰관 학교전담 서울경찰 업무협약,http://www.segye.com/content/html/2022/04/07/20220407509479.html,교육활동지원,생활지도운영,학교폭력예방,학교폭력전담기구운영,"학교폭력 전담기구, 학교폭력대응 조직, 학교폭력대책위 운영",0.6369447112083435
1101001.202204221,20220422,한겨레,인수위 감염병 위기대응기금 신설 중앙감염병전문병원 건립,감염병 인수위 위원회 코로나특위 공감대 코로나 코로나19 홍경희 만큼 관리청 재조정 질병관리청 서울 재검토 통의동,http://www.hani.co.kr/arti/politics/politics_general/1040025.html,학생복지/교육격차해소,보건관리,학생및교직원보건안전관리,감염병예방관리,"코로나19 대응, 학교 방역, 전염병 예방교육, 감염병 관리 지침",0.6369289755821228
1100201.202204081,20220408,국민일보,누적 1500만 확진 총리 감염병 등급 늦지않게 조정,사망자 감염병 코로나19 확진자 가동률 위중증 1500만 생활치료센터 20만 중등증 치료제 코로나 김부겸,http://news.kmib.co.kr/article/view.asp?arcid=0016953886&code=61121111&cp=kd,학생복지/교육격차해소,보건관리,학생및교직원보건안전관리,감염병예방관리,"코로나19 대응, 학교 방역, 전염병 예방교육, 감염병 관리 지침",0.6367179155349731
1100751.202204141,20220414,아시아투데이,에듀윌 기업문화 임직원 대상 사내 심리 상담실 운영,에듀윌 임직원 임직원들 백수원 상담실 집중휴식시간 시차출근제 사회생활 상담사 상주 건강검진 복지제도 아시아투데 관계자 정신건강 운영 마음 건강 사내 프로그램 가족 소통 센터 상담 복지,https://www.asiatoday.co.kr/view.php?key=20220414001326358,교육활동지원,생활지도운영,학생생활상담지도,상담실운영,"상담실 운영, 학생 상담 공간, 심리 상담 환경",0.6363504528999329
1100201.20220404,20220404,국민일보,전남 시군 보건소 11일부터 신속항원검사 중단,보건소 신속항원검사 전남도 코로나 진료소 의료체계 전남 검사소 속항원 pcr 재배치 인력들 효율화 수급자 독거노인 차상위계층 수용력 유효기간 취약계층 검체채취 확진자,http://news.kmib.co.kr/article/view.asp?arcid=0016937075&code=61121111&cp=kd,학생복지/교육격차해소,보건관리,학생및교직원보건안전관리,감염병예방관리,"코로나19 대응, 학교 방역, 전염병 예방교육, 감염병 관리 지침",0.6363353133201599
1100611.20220414,20220414,서울신문,거리두기 완전해제 결론 독한 변이 대응책 짜라,오미크론 코로나19 일상회복 그동안 손영래 가능성 중증도 한림대강남성심병원 이재갑,http://www.seoul.co.kr/news/newsView.php?id=20220414009046,학생복지/교육격차해소,보건관리,학생및교직원보건안전관리,감염병예방관리,"코로나19 대응, 학교 방역, 전염병 예방교육, 감염병 관리 지침",0.6363150477409363
1100701.202204221,20220422,세계일보,코로나 임시검사소 단계적 축소 서울광장 등 23곳 문 닫아,검사소 코로나19 임시검사소 임시선별검사소 주차장 서울광장 남양주시 박향 감염병 23곳 팍스로비드 중수본 시흥시 서울 강원 라게브리오 개정안 봉서홀 이행기 이동형,http://www.segye.com/content/html/2022/04/22/20220422510733.html,학생복지/교육격차해소,보건관리,학생및교직원보건안전관리,감염병예방관리,"코로나19 대응, 학교 방역, 전염병 예방교육, 감염병 관리 지침",0.6362848281860352
1100101.202204281,20220428,경향신문,인수위 지역균형특위 규제 완화한 교육자유특구 만든다,학부모 세종 교육자유특구 인수위 대안학교 보고회 자율학교 위원장 교과과정 제주 중원 다음달 김병준 연구소 차등화 국정과제 대전컨벤션센터 대국민 교통망 베드 학부모조합 성공모델 비전체계 의사당 교육장벽,https://www.khan.co.kr/politics/politics-general/article/202204281702001,교육활동지원,연구학교운영,연구학교운영,교육지원청지정,"교육지원청 지정 연구학교, 지역 연구학교",0.6360743045806885
1100611.202204151,20220415,서울신문,수업 중 성희롱 발언 혐의 부산 초등교사 수사,부산 성희롱 부산시교육청 교육청 부산지역 a씨 복지법 학부모 학생들 연제경찰서 수업중 수사의뢰 시간date 조사 경찰 발언 교사 수사 학생 수업 몸매 의뢰 확인 특정 신체 행위 혐의 표현 소지,http://www.seoul.co.kr/news/newsView.php?id=20220415500061,인적자원운용,교직원복지및역량강화,교직원복지,성폭력피해자지원,"교내 성폭력 피해자 보호, 교사 성희롱 대응, 성폭력 상담 지원, 피해 교원 지원 제도",0.6358756422996521
1100611.202204271,20220427,서울신문,KISDI 과학기술 분야의 교육 기회 형평성 제고 논의,학생들 stem 일자리 ict 과학기술 보고서 형평성 kisdi 최지은 원격수업,http://www.seoul.co.kr/news/newsView.php?id=20220427500056,기본적교육활동,교과활동,과학교과활동,특수목적고과학중점운영,"과학 실험 수업, 과학탐구 활동, 과학 체험 교육, 과학실습 지원",0.6356764435768127
1100701.202204131,20220413,세계일보,신속항원검사 계속 무료 당국 계속 유지 여부 논의 중,코로나19 rat 검사비 신속항원검사 박향 위험군 전문가 중수본 지자체 400만 확진자 방역총괄반장 감염병 대응체계 검사키트 서울 보건소,http://www.segye.com/content/html/2022/04/13/20220413509302.html,학생복지/교육격차해소,보건관리,학생및교직원보건안전관리,감염병예방관리,"코로나19 대응, 학교 방역, 전염병 예방교육, 감염병 관리 지침",0.6356233358383179
