뉴스 식별자,일자,언론사,제목,특성추출(가중치순 상위 50개),URL,대분류,중분류,소분류,세부항목 예시,뉴스 일반 표현,유사도
1100751.202210261,20221026,아시아투데이,충남교육청 고교학점제가 궁금해 영상 개발 보급,고교학점제 중학교 충남 고등학교 충남교육청 신경희 교육청 진로학업설계 참학력 김관태 인재양성 미래사회 변화방향 학교생활 중요성 안내자료 김지철 교육감 진로학업 교육과정과장 학생들 학점제 설명회 공동교육과정 필요성 학부모 공동체 교육 영상 대상,https://www.asiatoday.co.kr/view.php?key=20221026010013220,교육활동지원,연구학교운영,연구학교운영,시도교육청지정,"교육청 지정 연구학교, 시도교육청 시범학교",0.6171784996986389
1100701.202210111,20221011,세계일보,정부 학업성취도 평가대상 단계적 확대 뉴스 투데이,교육부 학업성취 일제고사 코로나19 중3 전수평가 코로나바이러스 표집평가 어진동 세종시 고2,http://www.segye.com/content/html/2022/10/11/20221011518845.html,교육활동지원,교무업무운영,교무학사운영,교육과정평가,"교육과정 평가, 학교 운영 평가, 수업 평가",0.6171099543571472
1100401.202210041,20221004,동아일보,유한양행 청소년 과학진로체험 프로그램 진행,유한양행 청소년들 연구소 멘토 동작구 팬데믹 이해도 대학생 연구원 코로나19 버들과학진로캠프 진로탐색 온라인 고등학생 서울시,https://www.donga.com/news/article/all/20221004/115793437/1,선택적교육활동,기타선택적교육활동,기타선택적교육운영,대학생멘토링제운영,"대학생 멘토링, 학습 멘토 프로그램, 교육기부 멘토링, 취약계층 학습지원",0.6170699596405029
1100101.20221004,20221004,경향신문,송용진의 수학 인문학 산책 수학의 어려움,사람들 학생들 고등학교 동기들 서울대 사교육 송용진 인하대 부진아 문제들 고착화 수 자 오랜만 중계방송 성취감 40점 지구상 80점 학생뿐 전적 학교교육 대다수 실력고사 10점 수학문제 수학 학생 사람 스포츠 동의 경쟁 골프,https://www.khan.co.kr/opinion/column/article/202210040300015,기본적교육활동,교과활동,수학교과활동,수학교과운영,"수학 수업, 수학 보충수업, 수학 창의력 프로그램, 수학 체험활동",0.616926372051239
1100301.20221029,20221029,내일신문,수학의 애인이 되어 그의 곁에,킬러문항 사고력 권율 학생들 파주 운정 2등급 그동안 단편지식들 화장실 단편 끄적 휘발성 잠금장치 고교생 캐스팅보트 응용문제 이중삼중 워딩 판타지 상대평가 실타래 천인공노 추론능력 수포자 상한선 여럿 공수학 삼육 결정적 곁에 만큼 학습자 조력자 안내자 바로미터,http://www.naeil.com/news_view/?id_art=439972,기본적교육활동,교과활동,수학교과활동,수학교과운영,"수학 수업, 수학 보충수업, 수학 창의력 프로그램, 수학 체험활동",0.6168137192726135
1100301.20221018,20221018,내일신문,인하대 일반대학원 신입생 모집,장학금 대학원 신입생 일반대학원 전일제 이수 2023학년도 인하대 학과간 외국인 재직자 전년도 합격자 학년도 4차 증빙서류 정보통신기술 자연과학 챌린저장학금 연구실 활성화 의학계열 온라인,http://www.naeil.com/news_view/?id_art=438825,학생복지/교육격차해소,학생복지,학생장학금운영,학생장학금지원,"장학금 지급, 학생 장학 제도, 교육비 지원, 장학생 선발 공고",0.6166727542877197
1100501.202210281,20221028,문화일보,정부 코로나 반등 조짐 공식화,코로나19 중대본 2주 5주 경북 2만 치명률 1만 조규홍 중증화 위중증 조치사항 이산화탄소 1주일 질병관리청 보건복지부 43주 3만 요양병원 최소화 호흡기,http://www.munhwa.com/news/view.html?no=2022102801070821293001,학생복지/교육격차해소,보건관리,학생및교직원보건안전관리,감염병예방관리,"코로나19 대응, 학교 방역, 전염병 예방교육, 감염병 관리 지침",0.6166185736656189
1100611.20221025,20221025,서울신문,감염병자문위 3개월 더 실내 마스크 올해는 못 벗겠네,코로나19 오미크론 재유행 확진자 미국 감염병 3개월 호흡기 일주일 조규홍 하위변 정기석 정재훈 중환자실 가천대길병원 엄중식 겨울철,http://www.seoul.co.kr/news/newsView.php?id=20221025010016,학생복지/교육격차해소,보건관리,학생및교직원보건안전관리,감염병예방관리,"코로나19 대응, 학교 방역, 전염병 예방교육, 감염병 관리 지침",0.6164993643760681
1100701.20221012,20221012,세계일보,부산교육청 하반기 교육공무직원 452명 선발,교육공무직원 조리원 1명 교육청 돌봄전담사 3명 복지사 면접심사 최종합격자 상담사 영양사 기숙사 조리사 임상심리사 온라인 원서접수 심리사 합격자 홈페이지 부산시교육청 실무원,http://www.segye.com/content/html/2022/10/11/20221011508804.html,선택적교육활동,방과후학교운영,유치원방과후과정운영,유치원방과후전담인력운영,"유치원 돌봄교사, 방과후 전담 인력, 유치원 보육인력",0.6164654493331909
1100401.20221021,20221021,동아일보,학생 맞춤형 교육으로 기초학력 끌어올려 미래 인재 양성할 것,전북 교육감 정치권 서거석 미래사회 관계자 도교육청 집무실 자치단체 지원계획 교육정책 아이들 전북도 위원회 학생중심 미래교육 조교사 일대일 코로나바이러스,https://www.donga.com/news/article/all/20221020/116057897/1,교육활동지원,연구학교운영,연구학교운영,교육지원청지정,"교육지원청 지정 연구학교, 지역 연구학교",0.6163808703422546
1100701.202210241,20221024,세계일보,인천대 그린스마트 미래학교 운영 시교육청 주최 프로그램,인천대 그린스마트 한기순 고등학생 학생들 조각기 중학생 제물포캠퍼스 재활용품 마인크래프트 인천메이커스페이스 고교생 제물포 인천과학문화거점센터 미추홀 미래인재 탈바꿈 자신들 업사이클링 영재교육연구소 과학영재교육연구소 project based learning 연구소장 3d프린터 pbl,http://www.segye.com/content/html/2022/10/24/20221024506514.html,기본적교육활동,교과활동,예술교과활동,특성화중학교(예술)운영,"미술·음악 수업, 예술 활동 지원, 문화예술교육, 공연·전시 체험",0.6163656115531921
1100301.202210191,20221019,내일신문,중소벤처기업들의 인력난 극복 비결 퇴직 기술자 뭉쳐 창업 대기업 수준 복지 제공,인력난 액화수소 중소기업 지원금 시니어 하이리움 기술자 임직원 대학원 강원도 모빌리티 외국인 김윤상 세탁실 네오스 60세 대기업 회사주식 교육과정 저출산고령화 회사내 발효유 이동식 전문대 서울,http://www.naeil.com/news_view/?id_art=438964,선택적교육활동,직업교육,직업교육운영,중소기업현장직무체험,"현장실습, 직무체험, 산업 현장 체험, 중소기업 연계 교육",0.6159214973449707
1100301.202210061,20221006,내일신문,청소년정책과 학교교육 벽 허문다,여가부 교육청 전문가 김현숙 고등학생 청소년시설 국무총리 활성화,http://www.naeil.com/news_view/?id_art=437686,교육활동지원,생활지도운영,학생생활상담지도,체험/공감형예방교육,"학교폭력 예방교육, 공감형 교육, 체험형 인성교육",0.6157968640327454
1101101.202210041,20221004,한국일보,코로나가 갈라놓은 손 이제 잡아요 3개월 만 접촉 면회 재개,요양병원 서울 코로나19 방문객들 관계자 최미경 시립서부노인전문요양센터 코로나 방문객 지자체 요양원 이씨 코로나바이러스 정형외과 재유행 마포구 첫날,https://hankookilbo.com/News/Read/A2022100411090001491,학생복지/교육격차해소,보건관리,학생및교직원보건안전관리,감염병예방관리,"코로나19 대응, 학교 방역, 전염병 예방교육, 감염병 관리 지침",0.6157329082489014
1100751.202210051,20221005,아시아투데이,충남교육청 2023학년도 중등학교 교사 임용시험 계획 공고,전년도 충남교육청 학년도 사립학교 선정경쟁시험 김관태 누리집 후보자 중등학교 방역지침 임신부,https://www.asiatoday.co.kr/view.php?key=20221005010002205,교육활동지원,교무업무운영,교무학사운영,입학전형,"학교 입학전형, 입학전형 관리, 전형 일정 공고",0.6156689524650574
1100101.202210112,20221011,경향신문,성적순 줄세우기 일제고사 부활하나,교육부 일제고사 교육청 전수평가 자율평가 학업성취 부작용 시행령 이명박 평가잣대 사교육 장상윤 지식교과 아이들 가능성 교부금 대한민국,https://www.khan.co.kr/national/education/article/202210112101005,교육활동지원,교무업무운영,교무학사운영,교육과정평가,"교육과정 평가, 학교 운영 평가, 수업 평가",0.6156666278839111
1100751.202210111,20221011,아시아투데이,김대중 전남교육감 인구소멸지역 학생교육수당 우선 지급,전남 교육감 김대중 교직원 인구소멸지역 공동체 일자리 혁신학교 이명남 고1 남악 학생교육수당 학습이력 학습권 에듀테크 ai 중1 기자회견 1디지털 거버넌스,https://www.asiatoday.co.kr/view.php?key=20221011010004648,학생복지/교육격차해소,교육격차해소,학비지원,사회적배려대상자지원,"저소득층 학생 지원, 교육복지 대상자, 취약계층 장학금, 교육소외 해소",0.6156637072563171
1100901.202210121,20221012,중앙일보,학업성취도평가 확대에 교육계 환영 일제고사 사교육 우려도,교육부 사교육 교육계 교육감 자율평가 전수평가 학업성취 일제고사 숙명여대 고2 송기창 박정현 부작용 학업성취도평가 인천만수북중,https://www.joongang.co.kr/article/25108638,교육활동지원,교무업무운영,교무학사운영,교육과정평가,"교육과정 평가, 학교 운영 평가, 수업 평가",0.6155471205711365
1100611.202210131,20221013,서울신문,광주 사립 중등교사 신규임용 시험 접수,광주시교육청 사립학교 광주 필기시험 학년도 교직원 누리집 나이스 응시원서 홈페이지 온라인 교육학 입력사항 선정경쟁시험 불가능 후보자 접수 시험 기간 교사 학교 사항 수정 원서,http://www.seoul.co.kr/news/newsView.php?id=20221013500097,교육활동지원,교무업무운영,교무학사운영,입학전형,"학교 입학전형, 입학전형 관리, 전형 일정 공고",0.6154336929321289
1100701.202210081,20221008,세계일보,가을 환절기 감기 조심하세요 폐렴으로 악화될 수도,항생제 예방접종 호흡기 환절기 코로나19 이상철 일산병원 게티이미지뱅크 면역력 근육통 폐렴구균 코로나바이러스 65세 구균 일교차 병원균 호홉 트윈데믹 세팔로스포린,http://www.segye.com/content/html/2022/10/08/20221008504848.html,학생복지/교육격차해소,보건관리,학생및교직원보건안전관리,감염병예방관리,"코로나19 대응, 학교 방역, 전염병 예방교육, 감염병 관리 지침",0.6152499318122864
1100611.202210271,20221027,서울신문,여교사에 뺨 맞은 학생 고막 터졌다,중학교 여교사 가해자 충북교육청 피해자 처벌등 b군 특례법 상담실 충북 2학년 청주 아동학대범죄 동급생 학교장 a씨 관계자 교사 학생 학교 경찰 매뉴얼 상담 고막 체벌 논란 폭력 신고 진로 발생,http://www.seoul.co.kr/news/newsView.php?id=20221027500211,인적자원운용,교직원복지및역량강화,교직원복지,성폭력피해자지원,"교내 성폭력 피해자 보호, 교사 성희롱 대응, 성폭력 상담 지원, 피해 교원 지원 제도",0.6146066188812256
1100401.202210121,20221012,동아일보,아랫집이 어린이집 와다다다 뛰는 소리에 고통 해결 방법은,어린이집 아랫집 아이들 층간소음 시간대 관리소 피해자 캔슬링 노이즈 와다다다 이웃집 주거문화개선연구소장 연구소장 아기들 차상곤 실전해법 간섭작용 카톡,https://www.donga.com/news/article/all/20221012/115914476/1,학생복지/교육격차해소,보건관리,학교환경위생관리,소음관리,"학교 소음 민원, 교실 소음 저감, 학교 방음 시설, 주변 소음 차단",0.6145951747894287
1100751.202210051,20221005,아시아투데이,경기도교육청 2023학년도 중등 보건 사서 전문상담 영양 특수 교사 선발,경기도교육청 사립학교 1차 합격자 2차 상담실 전문상담 한국사 선정경쟁시험 최종합격자 김주홍 누리집 수원 교육학 홈페이지,https://www.asiatoday.co.kr/view.php?key=20221005010002229,인적자원운용,교직원복지및역량강화,교직원역량강화,직무연수,"교사 연수, 직무교육, 교사 역량 강화 프로그램",0.6144104599952698
1100751.202210051,20221005,아시아투데이,대전교육청 공 사립 중등교사 임용시험 계획 발표,중등학교 소지자 교육청 대전교육청 장애구분모집 홈페이지 선정경쟁시험 부전공 제1차 선발규모 합격자 이상선 24과목 사립학교 자격증,https://www.asiatoday.co.kr/view.php?key=20221005010002063,교육활동지원,교무업무운영,교무학사운영,입학전형,"학교 입학전형, 입학전형 관리, 전형 일정 공고",0.6142451763153076
1100401.20221019,20221019,동아일보,문제풀이 아닌 소통능력 키우는 영어평가를 기고 황종배,한국 우리나라 황종배 외국인 문제풀이식 학생들 고등학교 풀이식 대학교 입학시험,https://www.donga.com/news/article/all/20221018/116016402/1,기본적교육활동,교과활동,외국어교과활동,외국어교과운영,"영어 수업, 외국어 말하기 대회, 원어민 수업, 글로벌 언어 교육",0.613923192024231
1100701.202210211,20221021,세계일보,교복 입고 퇴진 촛불집회 참석하면 봉사활동 인정 교육청 사실 아냐,촛불집회 봉사활동 서울시교육청 온라인 정은나리 홈페이지 진영 서울 촛불중고생시민연대 윤설열 윤석열 예의주시 sns 가능성 소셜미디어 사회관계 가짜뉴스 진보단체들 학생증 사회관계망서비스 정치집회 드레스코드 교육청 시간date,http://www.segye.com/content/html/2022/10/21/20221021511926.html,기본적교육활동,창의적체험활동,봉사활동,봉사캠페인,"학생 봉사활동, 사회공헌 캠페인, 학교 내 봉사 문화, 지역사회 기여",0.6137822866439819
1100501.202210262,20221026,문화일보,대학 올 겨울 코로나19 폭발적 확산 없을 듯 중대본은 신중론,코로나19 확진자 전주 이동량 중대본 재감염 오미크론 2억 연구소 워싱턴대 1억 미국,http://www.munhwa.com/news/view.html?no=2022102601039910126005,학생복지/교육격차해소,보건관리,학생및교직원보건안전관리,감염병예방관리,"코로나19 대응, 학교 방역, 전염병 예방교육, 감염병 관리 지침",0.6135959625244141
1100301.202210271,20221027,내일신문,중학교 1학년도 형사처벌 받는다,피해자 13세 소년원 소년범 법무부 중학교 보호관찰 보호처분 촉법소년 14세 시행령 부가처분 보호자 소년원생 촉법,http://www.naeil.com/news_view/?id_art=439723,교육활동지원,생활지도운영,학교폭력예방,가해학생선도,"가해학생 상담, 선도교육 프로그램, 처분대상자 교육",0.6133691668510437
1100751.202210241,20221024,아시아투데이,충청소방학교 전국 최초 전문교육 융합 교육훈련 마무리,대원 충청소방학교 교육훈련 전술드론 충남 김푸른 보령소방서 김관태 저수지 해수욕장 산악지역 수난구조 수중탐색장비 소방교 항공대 현장지휘소 참가자들 전문가들 산악항공 3주 드론 대원들 참가자 이해도 전문가 지휘소,https://www.asiatoday.co.kr/view.php?key=20221024010011361,교육활동지원,생활지도운영,학생안전교육,소방훈련,"학교 소방훈련, 화재 대피 훈련, 소방 안전 교육",0.6133111715316772
1100101.202210032,20221003,경향신문,스쿨미투 5년 손 놓은 교육당국 가해교사 137명 아직 학교에 있다,성폭력 교육청 스쿨미투 성희롱 서울 0건 가해자 민형배,https://www.khan.co.kr/national/education/article/202210032114005,인적자원운용,교직원복지및역량강화,교직원복지,성폭력피해자지원,"교내 성폭력 피해자 보호, 교사 성희롱 대응, 성폭력 상담 지원, 피해 교원 지원 제도",0.6132073998451233
1100611.20221027,20221027,서울신문,사설 촉법연령 낮춰도 교화의 끈 더 바짝 죄어야,소년범죄 촉법 촉법연령 소년법 촉법소년 법무부 형사처벌 중학교 13세 보호처분 인권위 국가인권위 개정안 해결책 소년원 수용시설 윤석열 그동안 조치들 보완책 사회봉사 2학년,http://www.seoul.co.kr/news/newsView.php?id=20221027027016,교육활동지원,생활지도운영,학교폭력예방,가해학생선도,"가해학생 상담, 선도교육 프로그램, 처분대상자 교육",0.6132069826126099
1100301.202210191,20221019,내일신문,남호성 교수의 삐딱한 수학 이야기 아직도 수학이 어려운 여러분에게,fix try 영국 사람들 guide reverse 단시간 고등학교 home want get 설득력 겨울바람 succeed 마틴 삼천지교 수차례 ignite 뒷걸음질 크리스 don 펠트로 코딩지교 정작 대학원 bones 유튜브 best 번씩 나위 남들 독자들 뒷걸음 그동안,http://www.naeil.com/news_view/?id_art=438840,기본적교육활동,교과활동,수학교과활동,수학교과운영,"수학 수업, 수학 보충수업, 수학 창의력 프로그램, 수학 체험활동",0.613150954246521
1100801.20221004,20221004,조선일보,이렇게 바뀝니다 오늘부터 요양병원 대면 접촉 면회 재개,코로나 요양병원 입원자 음식물 키트 여름철 방문객 신속항원검사 종사자 정신병원 장애인시설 장애인 검사키트 재유행 자가검사키트 rat pcr 면회 시설,https://www.chosun.com/national/welfare-medical/2022/10/04/WOYUSMCJZJBJPOVEYMIFUBSXVU/?utm_source=bigkinds&utm_medium=original&utm_campaign=news,학생복지/교육격차해소,보건관리,학생및교직원보건안전관리,감염병예방관리,"코로나19 대응, 학교 방역, 전염병 예방교육, 감염병 관리 지침",0.6129370331764221
1100751.20221012,20221012,아시아투데이,중대본 응급실 환자 필요한 경우만 코로나19 검사,코로나19 응급실 확진자 조규홍 겨울철 중대본 의사환자 8개월 의료진 의심환자 아시아투데이 박아람 내원 신속항원검사 그동안 보건복지부 이용시설,https://www.asiatoday.co.kr/view.php?key=20221012010005274,학생복지/교육격차해소,보건관리,학생및교직원보건안전관리,감염병예방관리,"코로나19 대응, 학교 방역, 전염병 예방교육, 감염병 관리 지침",0.6128525137901306
1100301.20221013,20221013,내일신문,예비 고1 현재 자신의 실력을 정확히 파악해야,고등학교 중학교 고1 난이도 모의고사 고등영어 목동 문제들 학생들 시험범위 상대적 대학입시 외부지문 서술형 100점 선수현 고등부 썬영어 단어실력 보자 지침서 복문 문장구조 단문형태 절대평가 점수대,http://www.naeil.com/news_view/?id_art=438367,기본적교육활동,창의적체험활동,진로활동,적성검사,"적성검사, 진로탐색 평가, 학생 적성 찾기, 자기이해 검사",0.6128021478652954
1100801.20221011,20221011,조선일보,내일부터 75세 이상 독감 무료접종 코로나 신규 확진은 1만명대 중후반,코로나 대상자 인플루엔자 1만 65세 출생자 임신부 75세 고령층 홈페이지 연령대 6개월 이듬해 확진자,https://www.chosun.com/national/welfare-medical/2022/10/11/JHEEL4OROREOPHAHBZ2TVQTLHI/?utm_source=bigkinds&utm_medium=original&utm_campaign=news,학생복지/교육격차해소,보건관리,학생및교직원보건안전관리,감염병예방관리,"코로나19 대응, 학교 방역, 전염병 예방교육, 감염병 관리 지침",0.6126807332038879
1100611.20221006,20221006,서울신문,으앙 살살 트윈데믹 우려 속 독감예방 무료 접종 시작,서울 트윈데믹 소아청소년과의원 과의원 주의보 코로나19 임신부 뉴시스 독감 접종 무료 유행 어린이 예방 시작 소아 청소년 전국적 주사 전국 동시 경험,http://www.seoul.co.kr/news/newsView.php?id=20221006008027,학생복지/교육격차해소,보건관리,학생및교직원보건안전관리,감염병예방관리,"코로나19 대응, 학교 방역, 전염병 예방교육, 감염병 관리 지침",0.6126015782356262
1100611.20221019,20221019,서울신문,수능 3일 전 원격수업 확진 땐 별도 시험장,시험장 수험생 코로나19 원격수업 교육부 고등학교,http://www.seoul.co.kr/news/newsView.php?id=20221019009001,학생복지/교육격차해소,보건관리,학생및교직원보건안전관리,감염병예방관리,"코로나19 대응, 학교 방역, 전염병 예방교육, 감염병 관리 지침",0.612422525882721
1100201.20221012,20221012,국민일보,성추행 가해자와 여전히 같은 반 초등생 부모 호소,위원회 가해자 부산 남학생 a군 교육청 지속성 교육지원청 학부모 위원들 관계자 어불성설 7호 학폭 사회봉사 지원청 고의성 피해학생 피해자,https://news.kmib.co.kr/article/view.asp?arcid=0017558032&code=61121811&cp=kd,교육활동지원,생활지도운영,학교폭력예방,가해학생선도,"가해학생 상담, 선도교육 프로그램, 처분대상자 교육",0.612406849861145
1100301.202210241,20221024,내일신문,우아한청년들 한양사이버대 장학금,한양사이버대 종사자 청년들 배달종사자 임직원 사이버대 남양주시 오성근 산업체 라이더 한양 장학금 한양사이버대학교 입학금 김병우 김우승 특수형태근로종사자 배민라이더스쿨 만큼 등록금 고용보험 부총장 배달종사자들 배달 청년,http://www.naeil.com/news_view/?id_art=439392,학생복지/교육격차해소,학생복지,학생장학금운영,학생장학금지원,"장학금 지급, 학생 장학 제도, 교육비 지원, 장학생 선발 공고",0.6123016476631165
1100701.20221027,20221027,세계일보,전남교육청 호주 교육청 대학 간 글로벌 화상교육 업무협약,교육청 전남도교육청 호주 업무협약 코리쉬 에반스 실비아 사이먼 협약서 nsw une 대학교 뉴사우스웨일즈주 교육감 뉴잉글랜드대학 김대중 mou 전남교육청 글로벌 교육 총장 협약 업무 화상 체결 방문 기관 국장 대학 활성 서명,http://www.segye.com/content/html/2022/10/26/20221026510592.html,선택적교육활동,국제교육,국제교육운영,자매결연학교교류,"국제 자매결연, 해외 학교 교류, 학생 국제 교류, 글로벌 교육 교류",0.6122678518295288
1100401.20221006,20221006,동아일보,자리정리 등 공동생활 규칙 알려주고 감정표현 능력 키워주세요,아이들 서울 1학년 뒤처리 시간date 유치원 선생님 휴대전화 코로나바이러스 공동생활 돌봄 엄영진 강미연 교내선 진도 전혜경 등하굣길,https://www.donga.com/news/article/all/20221006/115818977/1,학생복지/교육격차해소,보건관리,학생및교직원보건안전관리,감염병예방관리,"코로나19 대응, 학교 방역, 전염병 예방교육, 감염병 관리 지침",0.6122278571128845
1100751.202210051,20221005,아시아투데이,KT 광폭의 사회공헌 활동을 펼쳐,코로나19 온라인 랜선야학 소상공인 랜선 꿈품교실 ict,https://www.asiatoday.co.kr/view.php?key=20220926010015002,학생복지/교육격차해소,교육격차해소,정보화비지원,사회적배려대상자인터넷통신비지원,"인터넷 통신비 지원, 디지털 소외 해소, 원격 수업 통신 지원",0.6121696829795837
1100101.202210202,20221020,경향신문,인천 내년 초교 신입생에 입학준비금,인천 1학년 고등학교 졸업예정자 인천시 자격증 입학준비금 예정자 전형료 인천시교육청 준비금 응시수수료 20만 임시회 본회의 대학입학전형 수수료 2만,https://www.khan.co.kr/local/Incheon/article/202210202140005,교육활동지원,교무업무운영,교무학사운영,입학전형,"학교 입학전형, 입학전형 관리, 전형 일정 공고",0.6121347546577454
1100201.20221003,20221003,국민일보,영유아 계절독감 지표 급상승 만 1세 이후 요주의,인플루엔자 계절독감 연령대 전문가 코로나19 ili 질병관리청 접종률 1세 영유아 감염병 서울성모병원 관리청 강진한 분율 급상승 전문가들,https://news.kmib.co.kr/article/view.asp?arcid=0924266446&code=11141400,학생복지/교육격차해소,보건관리,학생및교직원보건안전관리,감염병예방관리,"코로나19 대응, 학교 방역, 전염병 예방교육, 감염병 관리 지침",0.6120427846908569
