뉴스 식별자,일자,언론사,제목,특성추출(가중치순 상위 50개),URL,대분류,중분류,소분류,세부항목 예시,뉴스 일반 표현,유사도
1100401.20230916,20230916,동아일보,이주호 20년 동결된 교원 보직수당 등 대폭 올릴것,교육부 이주호 교원평가 교육법 본회의 회복지원 부총리 성희롱 보직수당 시도교육청 교육청 위원회 기본법 유아교육법 교육기본법 보건복지부 증빙자료 담임수당 교원치유지원센터 서울청사 지위법 교원지위법 심리검사 교원들,https://www.donga.com/news/Society/article/all/20230915/121203982/1,인적자원운용,교직원복지및역량강화,교직원복지,교직원포상,"우수 교사 포상, 교원 격려, 교직원 사기 진작, 교육 공로상",0.6183681488037109
1100401.20230901,20230901,동아일보,코로나 재유행 저를 조심하세요,코로나19 연구팀 오하이오주 가능성 3배 몸속 돌연변이 꼬리사슴 동아사이언스 오하이오주립대 흰꼬리사슴 문세영 앤드루 커뮤니케이션스 코로나바이러스 게놈,https://www.donga.com/news/Health/article/all/20230901/120965037/1,학생복지/교육격차해소,보건관리,학생및교직원보건안전관리,감염병예방관리,"코로나19 대응, 학교 방역, 전염병 예방교육, 감염병 관리 지침",0.618078351020813
1100901.202309211,20230921,중앙일보,속보 교권회복 4법 국회 통과 정당사유 없이 직위해제 금지,교육활동 개정안 교원지위법 교육법 교육감 보호자 아동학대 지위법 본회의 교육기본법 유아교육법 4법 생활지도 기본법 중등교육법 공제회 찬성표 지역교 지역교권 만장일치 정당사유 학교안전공제회 공제사업 보호위원회 교육지원청 교직원,https://www.joongang.co.kr/article/25194297,인적자원운용,교직원복지및역량강화,교직원복지,교육활동보호지원,"교권 보호 정책, 교사 폭력 방지, 교사 보호법, 교육활동 안전 확보",0.6179879903793335
1100701.202309171,20230917,세계일보,유치원 사교육비 5년 새 38 늘어 초등학생 월 42만원,사교육비 고등학교 유치원 중학교 지출액 사교육 서울 학교급 연구위원 16만 42만,http://www.segye.com/content/html/2023/09/17/20230917504578.html,학교일반운영,학교기관운영,병설유치원기본운영,유치원운영비,"유치원 운영 예산, 병설유치원 경비, 유아교육 운영비",0.6179248094558716
1100201.20230922,20230922,국민일보,LG CNS 신입사원들 초등학교 일일 코딩 강사,지니어스 ai 신입사원들 lg dx 인공지능 부여군 빅데이터 강릉시 클라우드 충남 2회 이수 디지털전환 강원도 cns 코딩 농활 사원 프로그램 신입 블록 일일 강사 팩토리 분야 스마트 인공 시작 디지털,https://news.kmib.co.kr/article/view.asp?arcid=0924322328&code=11131423,기본적교육활동,교과활동,정보교과활동,교육용SW확충,"정보 수업, 코딩 교육, 소프트웨어 교육, 디지털 리터러시",0.6179208159446716
1100301.202309111,20230911,내일신문,예비중1 명문대 합격을 위한 첫걸음 떼야 할 시기,올댓스터디학원 로드맵 설명회 예비중1 학부모 최명호 학생들 예비중 고교학점제 명문대 강동구 학습력 그동안 학부모님 독해력,http://www.naeil.com/news_view/?id_art=473335,교육활동지원,교무업무운영,교무학사운영,입학전형,"학교 입학전형, 입학전형 관리, 전형 일정 공고",0.6178237199783325
1100751.202309211,20230921,아시아투데이,하남시 찾아가는 장애인 돌봄서비스 10월 시행 활동지원 10시간 추가,장애인 하남시 장애인활동지원 추가지원 대상자 홍화표 중증장애인 아시아투데이 시간date 행정복지센터 이현재 가사활동 지원사 공약사업 이용자 보건복지부 수급자 학교생활 비장애인 활동지원 활동지원사들 180여명 서비스 지원 추가 사업 활동 복지 증진 시행,https://www.asiatoday.co.kr/view.php?key=20230921010013330,교육활동지원,교육여건개선,교육환경개선,장애인편의시설관리,"장애인 편의시설, 무장애 학교, 장애인 접근성 개선",0.6177477836608887
1100901.20230926,20230926,중앙일보,교육이 미래다 NCSI 전문대학부문 10년 연속 전국 1위,운영대학 중소기업 영남이공대 영남이공대학교 전문대학 선도전문대학 실습실 전문대학부문 인공지능 기업부 빅데이터 중소벤처기업부 특성화 경북 만족도 고등직업교육거점지구 산학연 국가고객만족도 반도체 대구 직업교육중심대학 ncsi 전문화 복지제도,https://www.joongang.co.kr/article/25195444,선택적교육활동,직업교육,직업교육운영,직업교육운영,"직업교육, 진로직업 교육, 기술교육 강화, 실무형 인재 양성",0.617746114730835
1100701.202309062,20230906,세계일보,경기도교육청 서이초 교사 49제 연가 낸 교사에 소명자료 요구,소명자료 경기도교육청 부총리 공교육 교사들 이주호 학사운영 한마음 강훈식 더불어민주당 전교조 전국교직원노동조합 49제 위법성 위원회 전체회의 학교별 합반수업 시수 교육계 합반,http://www.segye.com/content/html/2023/09/06/20230906516227.html,인적자원운용,교직원복지및역량강화,교직원역량강화,기타역량강화지원,"교직원 자기개발, 역량강화 프로그램, 교사 성장 지원, 교원 역량 개발 사업",0.6177284121513367
1101001.202309012,20230901,한겨레,초등교사 또 극단 선택 공교육 멈춤의 날 참여 열기 커질까,공교육 집단행동 교사들 관계자 서울시교육청 서울 임시휴업 교육부 6학년 인디스쿨 양천구 전북 한겨레 학교장 고양시 30곳 가능성 교원단체들 재량휴업일 서울교사,http://www.hani.co.kr/arti/society/schooling/1106808.html,학교일반운영,학교운영협력,관계기관협력,주민참여학교운영,"주민 참여 학교, 지역 개방형 학교, 학교 공동체 운영",0.6176803112030029
1100901.202309141,20230914,중앙일보,경희사이버대학교 한국어센터 2023학년도 2학기 한국어교육 현장 실습 진행,한국어 경희사이버대학교 법무부 한국어센터 외국인 한국어문화학부 오프라인 한국 교수법 온라인 봉원덕,https://www.joongang.co.kr/article/25192403,기본적교육활동,교과활동,외국어교과활동,외국어교과운영,"영어 수업, 외국어 말하기 대회, 원어민 수업, 글로벌 언어 교육",0.6176444888114929
1100801.202309051,20230905,조선일보,성관계는 좋은 것 많이 해봐야 수업 중 상습 발언 교사 입건,제주 성희롱 학생들 고등학교 수업시간 성관계 a씨 50대 수치심 성고충심의 위원회 제주도교육청 복지법 수차례 혐의 조사 경찰 교사 입건 의결 학생 수업 발언 위반 시간 상습 직위 정서적 유발 남녀 정서 공학 지역 차례 성적,https://www.chosun.com/national/regional/2023/09/05/HIEXJ2ANCZFG5ND6WNMTTMOS54/?utm_source=bigkinds&utm_medium=original&utm_campaign=news,인적자원운용,교직원복지및역량강화,교직원복지,성폭력피해자지원,"교내 성폭력 피해자 보호, 교사 성희롱 대응, 성폭력 상담 지원, 피해 교원 지원 제도",0.6176128387451172
1100701.202309042,20230904,세계일보,체육 손 놓은 학교 10대 절반 운동 부족,10대 과체중 한국 부산 학생들 일주일 체육교육 상명대 유상건 노년층 국민의힘 유영만 70대 도종환,http://www.segye.com/content/html/2023/09/04/20230904514863.html,기본적교육활동,교과활동,체육교과활동,특성화중학교(체육)운영,"체육 수업, 체력 증진 활동, 체육대회, 학생 스포츠 활동",0.6175938844680786
1100701.20230901,20230901,세계일보,정당한 생활지도 아동학대서 면책 교권보호 법안 교육위 소위 통과,교육위 개정안 교육부 교육감 위원회 협의체 법안소위 아동학대 교육법 부총리 이주호 이태규 김철민,http://www.segye.com/content/html/2023/08/31/20230831520678.html,인적자원운용,교직원복지및역량강화,교직원복지,교육활동보호지원,"교권 보호 정책, 교사 폭력 방지, 교사 보호법, 교육활동 안전 확보",0.6174590587615967
1100101.202309042,20230904,경향신문,교직원 보호 위해 통화 녹음됩니다,교육부 교육활동 공모전 연결음 통화연결음 공감대 공교육 수상작 이주호 부총리 학교현장 정인화 함백고 최우수 학생들 1편 3편 후속조치 6편 최우수작 선생님 수상자 중요성 유치원 종합방안 교육현장,https://www.khan.co.kr/national/education/article/202309042143025,인적자원운용,교직원복지및역량강화,교직원복지,교육활동보호지원,"교권 보호 정책, 교사 폭력 방지, 교사 보호법, 교육활동 안전 확보",0.6172139644622803
1100301.202309201,20230920,내일신문,안전한 추석맞이 현장점검의 날,사업장 화학물질 운수업 이정식 안전회의 고용부 취약분야 추석맞이 중요성 작동성 한국산업안전보건공단 노동부 8대 이사장 지방노동관서 공정안전관리 위험요인 제조업 감독관 안종주 물류업종 안전점검 고용노동부,http://www.naeil.com/news_view/?id_art=474444,학생복지/교육격차해소,보건관리,학생및교직원보건안전관리,산업안전보건관리,"학교 산업안전, 작업장 안전, 산업안전 교육, 교직원 안전관리",0.6171818971633911
1100751.202309131,20230913,아시아투데이,청송군 장애인 어울림 운동교실 운영,장애인 건강관리 청송 경북 운동교실 재활운동 청송군 윤경희 김정섭 아시아투데이 건강취약 질환자 건강증진 일상생활 8주 화요일 사회참여 건강취약계층 경북지역장애인보건의료센터 장애인들 장애인단체 농아인 건강관리서비스 지역사회중심재활사업 건강관리교육,https://www.asiatoday.co.kr/view.php?key=20230913010007599,교육활동지원,교육여건개선,교육환경개선,장애인편의시설관리,"장애인 편의시설, 무장애 학교, 장애인 접근성 개선",0.617107093334198
1100501.202309101,20230910,문화일보,여야 모두 교권 보호 4법 찬성 이번엔 교사들 목소리 들어줄까,개정안 이재명 교육법 교사들 간담회 본회의 선생님 민주당 윤재옥 교원단체 더불어민주당 중등교육법 여야가 원내대표 유아교육법 논쟁점 대한민국 김영호 아동학,http://www.munhwa.com/news/view.html?no=2023091001039907124011,인적자원운용,교직원복지및역량강화,교직원복지,교육활동보호지원,"교권 보호 정책, 교사 폭력 방지, 교사 보호법, 교육활동 안전 확보",0.6170976161956787
1100611.202309131,20230913,서울신문,또래 옷 벗기고 폭행 장면 SNS 생중계 중학생 집유 감형 왜,1심 피해자 재판부 중학생 a군 항소심 집행유예 성폭력 수치심 실시간 대구고법 sns 생중계 대구 정승규 소셜 이수 성보호 30여명 소셜미디어 동구 피고인 보호관찰 취업제한 언어폭력 양형 징역형,http://www.seoul.co.kr/news/newsView.php?id=20230913500142,교육활동지원,생활지도운영,학교폭력예방,가해학생선도,"가해학생 상담, 선도교육 프로그램, 처분대상자 교육",0.6170651316642761
1100101.202309261,20230926,경향신문,겨울 코로나 예방접종 다음 달 19일 시작 고위험군은 꼭 맞아야,코로나19 고위험군 질병청 예방접종 65세 1만 사전예약 면역저 희망자 동절기 2회 의료기관 구성원 12세 확진자 콜센터 노바백스 2가,https://www.khan.co.kr/national/health-welfare/article/202309261104001,학생복지/교육격차해소,보건관리,학생및교직원보건안전관리,감염병예방관리,"코로나19 대응, 학교 방역, 전염병 예방교육, 감염병 관리 지침",0.6169788837432861
1100751.202309261,20230926,아시아투데이,세종시교육청 개교 예정 3개 학교 통학구역 학교군 조정 추진,3생활 중학교 통학구역 세종교육청 학교군 해밀 해밀중 학급편제 산울중 시행령 홈페이지 이진희 학생들 세종시교육청 중학생 의견서 중등교육법 늘봄 교육법 도담중 제6학군 제68조 학부모 도담 예고문 행정예고 행정예고문 행정예고안 아시아투데 지역주민 세종시 산울 고시공고 학습권 1교,https://www.asiatoday.co.kr/view.php?key=20230926010015608,교육활동지원,연구학교운영,연구학교운영,시도교육청지정,"교육청 지정 연구학교, 시도교육청 시범학교",0.6168363094329834
1100301.202309141,20230914,내일신문,경기 AI 교수 학습 플랫폼 하이러닝 시범운영,하이러닝 ai 학부모 도교육청 시범운영 learning 인공지능 1학년 경기도미래교육연수원,http://www.naeil.com/news_view/?id_art=473717,교육활동지원,연구학교운영,연구학교운영,시도교육청지정,"교육청 지정 연구학교, 시도교육청 시범학교",0.6165486574172974
1100401.202309052,20230905,동아일보,사설 공교육 멈춤의 날 공교육 회복의 날 로 이어지길,공교육 학부모 교사들 서울 맞벌이 학교장 추모일 당사자 만큼 연구조직 용인,https://www.donga.com/news/Opinion/article/all/20230904/121017949/1,인적자원운용,교직원복지및역량강화,교직원복지,스승의날행사,"스승의날 기념식, 교사 존중 문화, 교원 감사 행사",0.6165364384651184
1100101.202309051,20230905,경향신문,교사 마음 건강 적신호 63 가 우울 6명 중 1명은 극단선택 고민,학부모 노동자 녹색병원 10회 정신건강 응답자 언어폭력 전교조 교사들 윤간우 임상혁 실태조사 가해자,https://www.khan.co.kr/national/education/article/202309051558001,교육활동지원,생활지도운영,학생생활상담지도,학교부적응학생상담,"학교 부적응 학생, 위기학생 상담, 적응력 강화 교육",0.616508424282074
1100611.20230905,20230905,서울신문,다음은 없어야 교사들의 절규,교사들 학부모 교육부 선생님 공교육 병가 우울감 입법발 서울 나흘,http://www.seoul.co.kr/news/newsView.php?id=20230905001008,인적자원운용,기타교직원보수,교직원대체인건비,교원대체인건비,"기간제 교사, 대체 교사, 출산휴가 교사, 교사 인력난",0.6165039539337158
1100751.202309211,20230921,아시아투데이,교사 2명 사망 의정부 초등학교 기간제 구인 공고 소름 돋는 업무 자격 요건,기간제 학부모 원씩 자격증 재조명 50만 치료비 서울 소지자 2명 담임교사 교사들 지원청 6개월 정부교육지원청 경기도 월급날,https://www.asiatoday.co.kr/view.php?key=20230921001524466,인적자원운용,기타교직원보수,교직원대체인건비,교원대체인건비,"기간제 교사, 대체 교사, 출산휴가 교사, 교사 인력난",0.6164821982383728
1100901.20230904,20230904,중앙일보,대입 내비게이션 학생부종합전형 DKU인재 면접형 신설,학생부 죽전 천안 우수자 dku인재 면접형 학생부종합전형 1단계 취업자 대상자 석차등급 학생부교과우수자 지역균형선발 온라인 원서접수 재직자 고졸재직자 학년도 학업역량 배려대상자 자기주도 자연계열 단국대학교 논술우수자전형 보통교과 배려자 농어촌,https://www.joongang.co.kr/article/25189640,기본적교육활동,창의적체험활동,진로활동,적성검사,"적성검사, 진로탐색 평가, 학생 적성 찾기, 자기이해 검사",0.6164414286613464
1100501.202309041,20230904,문화일보,대학별고사 선행학습 영향평가 모든 전형 확대,학년도 2024학년도 대학별 교육부 고등학교 학교생활 기록부 학교생활기록부 학생부 필답고사 선다 관계자 2015학년도 선다형 필답 수험생 대학들 불이익 대학 평가 여부 고사 전형 출제,http://www.munhwa.com/news/view.html?no=2023090401070821172001,교육활동지원,교무업무운영,교무학사운영,입학전형,"학교 입학전형, 입학전형 관리, 전형 일정 공고",0.6162810325622559
1100701.20230905,20230905,세계일보,휴업 결정 학교장 솔직히 징계 겁나지만 교사 위해 결정,서울 교육부 추모제 학교장 이주호 부총리 공교육 기관장 교사들 재량휴업 김현정 더불어민주당 강훈식 정용주 교사분 위원회 뉴스쇼 선생님 교사분들 병가,http://www.segye.com/content/html/2023/09/05/20230905502104.html,교육활동지원,교무업무운영,교무학사운영,교무학사운영,"학사 운영, 교육행정 운영, 학교 일정 관리",0.6162636876106262
1100611.202309101,20230910,서울신문,광주 새날학교 여름철 물놀이 안전교육 체험 학습,새날학교 물놀 중도입국 물놀이 고려인 체험관 청소년들 교직원 전북 임실 다문화 광주고려인마을 안전체험학습 고려인동포 전교생 119안전 새날 급류사고 익수사고 익수 체험학습 관계자 여름철 광주,http://www.seoul.co.kr/news/newsView.php?id=20230910500095,기본적교육활동,창의적체험활동,현장체험학습활동,수련활동,"수련회, 인성 함양 수련활동, 학생 공동체 훈련, 학교 수련 교육",0.6162400245666504
1100101.202309122,20230912,경향신문,상벌점제 허용하고 학생 책임 의무 강조 뒤로 가는 경기도 학생인권조례,경기도 개정안 경기도교육청 충남도의회 교육활동 상벌점제 충남 경기도의회 충남도 상벌점 임태희 입법예고 학교생활 제1조 도의회 학습자 조례안 학부모 구성원 홈페이지 보호자 학습권 폐지조례안 교육감,https://www.khan.co.kr/national/education/article/202309122140025,교육활동지원,생활지도운영,학생생활상담지도,학생생활지도운영,"학생 생활지도, 학교 규칙 지도, 생활태도 개선",0.6161983013153076
1100101.202309071,20230907,경향신문,입시 준비 월 400만원 영재학교 정작 수능보면 3등급 경향시소,영재학교 경향시소 사교육 영재교육 교육과정 경향신문 유튜브 구본창 한국 서울과학고 소믈리에 3등급,https://www.khan.co.kr/national/education/article/202309071854001,선택적교육활동,기타선택적교육활동,창의교육운영,영재교육운영,"영재교육, 영재학생 발굴, 수월성 교육, 창의인재 육성",0.6161873936653137
1101001.202309031,20230903,한겨레,사설 교사 극단 선택 잇따르는데 엄단 만 외치는 교육부,교사들 교육부 고양 서울 2명 군산 교원단체 양천구 학부모 전북 경기도 종교인 중징계 형사고발 병가 진상규명 여의도공원,http://www.hani.co.kr/arti/opinion/editorial/1106921.html,인적자원운용,교직원복지및역량강화,교직원복지,교육활동보호지원,"교권 보호 정책, 교사 폭력 방지, 교사 보호법, 교육활동 안전 확보",0.6161590814590454
1100701.202309051,20230905,세계일보,이 자리 싫어 고교생이 교실서 교사 5분간 폭행 퇴학 조치,a군 광주 클립아트코리아 교권보호위원회 특별휴가 b교사 시교육청 병가 광주시교육청 위원회 구조대 치료비 교육청 여교사 남학생 제비뽑기 고등학교 고교생 학생들 교사들 a씨 교사 교실 폭행 자리 병원,http://www.segye.com/content/html/2023/09/05/20230905514135.html,교육활동지원,생활지도운영,학교폭력예방,학교폭력관련연수지원,"학교폭력 연수, 교사 연수 프로그램, 폭력 예방 교육",0.6160085201263428
1100301.202309071,20230907,내일신문,이 공부법을 추앙하라,강아 하브루타 안남재 학생들 학습법 코칭 플립러닝 가맹점 사고방식 지속력 집중지속력 개인별 정기교육 슈퍼바이저 대화체 학습지,http://www.naeil.com/news_view/?id_art=472839,선택적교육활동,독서활동,독서활동운영,독서교육역량강화,"독서 교육, 문해력 강화, 책읽기 활동, 학생 독서 습관",0.6160046458244324
1100611.20230928,20230928,서울신문,경기도 청년 120명 우즈베크 베트남 캄보디아 교육봉사 추진,봉사단 교육봉사 캄보디아 베트남 일자리 한국문화 개발도상국 미국 자기개발계획서 경기도 해외봉사단 수급자 서류심사 차상위계층 계획서 개발원조 자립준비청년 어학수업 한국어 응에안 우즈베키스탄 한국 3개국,http://go.seoul.co.kr/news/newsView.php?id=20230928500021,학생복지/교육격차해소,학생복지,교육복지우선,교육복지사업운영비,"교육복지사업, 취약계층 학생 프로그램, 교육복지 프로그램 운영",0.6158344149589539
1100801.20230923,20230923,조선일보,1교시 전 3분씩 마음 챙김 명상 으로 학폭 우울증 줄여요,중동고 학생들 중학교 집중력 서울 교육부 대구교육청 불교 교육청,https://www.chosun.com/national/education/2023/09/23/6JULQWYN6ZFWXHLUS5CACDL3Q4/?utm_source=bigkinds&utm_medium=original&utm_campaign=news,교육활동지원,생활지도운영,학생생활상담지도,치유프로그램,"심리치유 프로그램, 학생 정서 회복, 정신건강 프로그램",0.6156101226806641
1100201.202309121,20230912,국민일보,경남교육 내년부터 생태전환교육 중심 학생 수련기관 운영,수련기관 자연환경 덕유학생교육원 교육원 재구조화 학생교육원,https://news.kmib.co.kr/article/view.asp?arcid=0018660191&code=61121111&cp=kd,기본적교육활동,창의적체험활동,현장체험학습활동,수련활동,"수련회, 인성 함양 수련활동, 학생 공동체 훈련, 학교 수련 교육",0.6155737638473511
1101101.202309011,20230901,한국일보,여야정 교사 생활지도는 아동학대서 제외 입법 급물살,교육활동 여야정 교육위 위원회 생활지도 교육법 아동학대 더불어민주당 교육부 교육감 이수 협의체 유아교육법 학생부,https://www.hankookilbo.com/News/Read/A2023090110480004891,인적자원운용,교직원복지및역량강화,교직원복지,교육활동보호지원,"교권 보호 정책, 교사 폭력 방지, 교사 보호법, 교육활동 안전 확보",0.6153133511543274
1100801.202309111,20230911,조선일보,법원 급우 밀어 다치게 한 학생 사회봉사 처분 취소,학교폭력 사회봉사 재판부 a군 3점 광주지법 지원청 광주광역시 안전바 재판장 중학교 재량권 교육장 광주 장찬수 교육청 광산구 교육지원청 광주서부교육지원청교육장 b군 학생 처분 취소 판결 폭력 고의 소송 행위 학교 교육,https://www.chosun.com/national/regional/2023/09/11/57QI6BM3XBHZZF5T6YASS5NU4U/?utm_source=bigkinds&utm_medium=original&utm_campaign=news,교육활동지원,생활지도운영,학교폭력예방,가해학생선도,"가해학생 상담, 선도교육 프로그램, 처분대상자 교육",0.6152673363685608
1100101.202309011,20230901,경향신문,월요일 정상수업 어렵다 체험학습 써달라 다수 초등학교 단축수업 합동수업 예고,서울 교육부 학부모 월요일 학교장 교사들 교외체험학습 신청서 재량휴업 단축수업 인천 경기도 통신문 선생님 집단행동 가정통신문 임시휴업 정상수업 응답자 온라인,https://www.khan.co.kr/national/education/article/202309011643001,선택적교육활동,방과후학교운영,방과후학교운영,방과후학교자율과정지원,"방과후 자율 프로그램, 학교 자율 방과후 수업, 학생 맞춤 방과후 활동",0.6151484251022339
1100701.20230925,20230925,세계일보,단독 교육부 학생인권조례 분석 착수 이르면 10월 말 예시안 공개,교육부 학생인권조례 교육청 예시안 공교육 교육공동체 개정안 휴대전화 서울시교육청 문제점 협성대 이주호 김성기 공동체 부총리 만큼 사생활 학부모 교육감 교육학 교육감들,http://www.segye.com/content/html/2023/09/22/20230922513816.html,교육활동지원,연구학교운영,연구학교운영,교육부지정,"교육부 지정 연구학교, 시범학교 운영, 정책 실험학교",0.6151443719863892
1100801.20230921,20230921,조선일보,인사 교육부 외,지청장 부부장 형사2부장 형사1부장 형사3부장 공판부장 보호관 인권보호관 수사부장 담당관 팀장 법무부 중요경제범죄조사단 연구관 인권보호 형사4부장 대검찰청 여성아동범죄조사부장 인권보호부장 형사부장 기획관 형사5부장 제1차장 헌법재판소 정지영 제2차장 박성민 법무연수원 형사6부장 김희영 이주현 범죄수사부장,https://www.chosun.com/national/obituary-personnel/2023/09/21/OVOORJH6HFBKFLPFTIEFEQIFBI/?utm_source=bigkinds&utm_medium=original&utm_campaign=news,학교일반운영,학교기관운영,부서기본운영,교육행정업무운영,"교육행정 운영, 학교 행정 업무, 학사관리 행정 지원",0.6151440739631653
