뉴스 식별자,일자,언론사,제목,특성추출(가중치순 상위 50개),URL,대분류,중분류,소분류,세부항목 예시,뉴스 일반 표현,유사도
1100901.202408191,20240819,중앙일보,세종사이버대 아동가족학부 미술심리상담사 2급 자격 과정 워크샵 실시,2급 전문가 세종사이버대 상담사 자격증 아동가족학부 미술치료 제공인력 아동학 학생들 영유아 한국정신보건미술치료학회 홈페이지 아동가족 코칭 자격과정 국가자격증 연계성 수석연구원 공신력 아동가족학 신구 연구원,https://www.joongang.co.kr/article/25271539,선택적교육활동,직업교육,직업교육운영,직업교육운영,"직업교육, 진로직업 교육, 기술교육 강화, 실무형 인재 양성",0.6390441656112671
1100301.202408051,20240805,내일신문,희망학교 SW교실 참여 학교 모집,미래사회 희망학교 신한금융희망재단 구성원 신한금융 특수학교 sw 진옥동 관계자 2학기 이사장 1학기 1만 장애학생들 교육부 적응력 이틀간 교보재 교육 학교 참여,https://www.naeil.com/news/read/519088?ref=bigkinds,학교일반운영,학교운영협력,관계기관협력,주민참여학교운영,"주민 참여 학교, 지역 개방형 학교, 학교 공동체 운영",0.6387743949890137
1100101.202408241,20240824,경향신문,유치원생에 영어는 기본 초3 분수까지 강남 유치원 4곳 중 1곳은 초등 선행,유치원 영어특성화 강남 3세 강남구 5세 사걱세 그로그램 사교육걱정 조국혁신당 1학기 강경숙 송파구 10곳 참여율 연계교육 사교육 만4세 서울시교육청 상대적 4세 유형별 a유치원 9곳,https://www.khan.co.kr/national/education/article/202408241520001,학교일반운영,학교기관운영,병설유치원기본운영,유치원운영비,"유치원 운영 예산, 병설유치원 경비, 유아교육 운영비",0.6386379599571228
1100701.202408131,20240813,세계일보,버스 안에서 흡연 교사 성희롱한 고교생 퇴학은 과중해 주장했지만,a학생 특별교육 성희롱 이수 광주지법 고등학교 사회봉사 부장판사 민사부 학생들 비위행위 수업권 수치심 반성문 정영호 재판부 통학버스 위원회 모욕감 침해행위 교육위 고교생 클립아트코리아 고등학생 시간date,http://www.segye.com/content/html/2024/08/13/20240813513397.html,교육활동지원,생활지도운영,학교폭력예방,가해학생선도,"가해학생 상담, 선도교육 프로그램, 처분대상자 교육",0.6385619640350342
1100501.202408161,20240816,문화일보,국회예정처 대규모 세수결손 예상시 추경편성 대응이 원칙,예정처 일반회계 공자기금 지방교부세 교부금 미교부 18조 예상시 김경호 지방교육재정교부금 세수결손 14조 외국환 보고서 교부금법 예수한 공공자금관리기금 2023회계 9조 교부세법 지방교육재정교부금법,http://www.munhwa.com/news/view.html?no=2024081601071405015001,학교재무활동,예비비,예비비,예비비,"교육청 예비비, 긴급 예산 편성, 비상 재정 집행",0.6383918523788452
1101101.20240802,20240802,한국일보,단독 교사 간 갈등 풀겠다며 애꿎은 장애 유아들 30일간 분리한 학교,유치원 통합교육 통합학급 병설유치원 협의회 용인 수업일수 부모들 아동들 특수교사 지원청,https://www.hankookilbo.com/News/Read/A2024080103060001015,기본적교육활동,교과활동,특수교육교과활동,특수교육교과운영,"특수교과 운영, 장애학생 교과 수업, 통합교육 교과 지원",0.638102114200592
1100701.202408192,20240819,세계일보,초등생도 쉽게 드론 디지털 교육 날개,드론 늘봄학교 한국 서울 2학기 세계일보 강서구 경쟁사 사용자 정규수업 조작법 안전협회장 학부모 김종복 드론자격증 교육자원 이노컨,http://www.segye.com/content/html/2024/08/19/20240819521111.html,기본적교육활동,교과활동,정보교과활동,교육용SW확충,"정보 수업, 코딩 교육, 소프트웨어 교육, 디지털 리터러시",0.6380941867828369
1100101.202408141,20240814,경향신문,코로나19 재확산에 급식비 방과후교실도 환불 서울시교육청은 긴급 예산 25억원 편성,코로나19 서울시교육청 방과후교실 25억 관찰실 가정통신문 통신문 재확산 밴드악기 확진자 유튜브 감염병 소독제 진행시 유의사항 경남 김해 체크리스트 학생들 법정감염병 급식비,https://www.khan.co.kr/national/education/article/202408141453001,학생복지/교육격차해소,보건관리,학생및교직원보건안전관리,감염병예방관리,"코로나19 대응, 학교 방역, 전염병 예방교육, 감염병 관리 지침",0.6377856731414795
1100751.202408251,20240825,아시아투데이,서울시교육청 올 하반기 원어민 영어보조교사 437명 배치,원어민 시교육청 3학년 사교육 공교육 중학교 조희연 박지숙 30학급 서울시교육청 아시아투데이 학생들,https://www.asiatoday.co.kr/view.php?key=20240825010013242,기본적교육활동,교과활동,외국어교과활동,원어민보조교사지원,"영어 수업, 외국어 말하기 대회, 원어민 수업, 글로벌 언어 교육",0.6375835537910461
1100901.202408271,20240827,중앙일보,명지대 김포 8개고 교사 대상 MJ교사연수,명지대학교 학년도 mj 김포 김포고등학교 사정관 전문성 입학처 학생부 모의평가 원서접수 전임사정관 mj교사연수 유병진 김포시 위촉사정관 김포고 8개 교사들 인재발굴팀,https://www.joongang.co.kr/article/25273387,인적자원운용,교직원복지및역량강화,교직원역량강화,직무연수,"교사 연수, 직무교육, 교사 역량 강화 프로그램",0.6374927163124084
1100201.202408261,20240826,국민일보,노원구 추석 대비 감염병 예방 시민강좌 개최,감염병 노원구 노원구청 서울시 강남성심병원 보건소 중앙대병원 정진원 시민강좌 홍보물 오승록 보건과 노원구청장 한림대 시민들 선착순 이재갑 지역사회 생활보건과 서울 qr qr코드 예방 교수 진행 연휴 추석,https://www.kmib.co.kr/article/view.asp?arcid=0020456965&code=61122011&cp=kd,학생복지/교육격차해소,보건관리,학생및교직원보건안전관리,보건교육,"보건교육 프로그램, 위생교육, 감염병 예방교육, 건강생활 교육",0.6374872922897339
1100301.202408141,20240814,내일신문,2025 대학별 수시 분석 종합 서류형 선발 확대 수능 최저 신설 자유전공학부 신설 계열 분리 모집,인재상 학생부 종합전형 지원자 서울시립대 중국어 합격자 자유전공학부 2024학년 교과전형 합격선 수시전형 이수 공학부,https://www.naeil.com/news/read/520098?ref=bigkinds,교육활동지원,교무업무운영,교무학사운영,입학전형,"학교 입학전형, 입학전형 관리, 전형 일정 공고",0.637466549873352
1100751.202408191,20240819,아시아투데이,전남도 최중증 발달장애인 맞춤형 통합돌봄 본격 추진,장애인 최중증 발달장애인 전남도 1대 제공기관 시군 통합돌봄서비스 사각지대 신청자 일상생활 4명 아시아투데이 이명남,https://www.asiatoday.co.kr/view.php?key=20240819010009515,기본적교육활동,창의적체험활동,봉사활동,장애학생돌보기,"장애학생 돌봄, 특수학생 지원 활동, 장애인식 개선 봉사, 통합교육 봉사활동",0.6373934745788574
1100301.202408201,20240820,내일신문,보건의료 향상 의학교육 개선 환자와 지역중심 의료 위해 의학교육 크게 바꿔야,의학교육 의과대학 전문가 평가인증 우리나라 의료서비스 지역사회 학생들 다양성 의료이용 보건의료 임상실습,https://www.naeil.com/news/read/520442?ref=bigkinds,학생복지/교육격차해소,학생복지,교육복지우선,교육복지사인건비,"교육복지사 채용, 교육복지 인력 확충, 취약계층 교육 지원",0.6373387575149536
1100101.202408211,20240821,경향신문,금욕적 성교육이 만든 성교육 과외 포괄적 성교육 으로 바뀔 이유 플랫,성교육 유네스코 성폭력 교육청 사교육 교육부 관계자 성폭력예방교육,https://www.khan.co.kr/national/gender/article/202408211127001,교육활동지원,생활지도운영,학생생활상담지도,체험/공감형예방교육,"학교폭력 예방교육, 공감형 교육, 체험형 인성교육",0.6372835040092468
1101001.202408081,20240808,한겨레,호흡기 환자 4명 중 1명 코로나 8월 3 4주 정점 예상,코로나19 호흡기 감염병 엄중식 면역력 냉방병 병원급 220곳 케이피쓰리 전문가 시비에스 코로나 오미크론 200병상,http://www.hani.co.kr/arti/society/health/1152848.html,학생복지/교육격차해소,보건관리,학생및교직원보건안전관리,감염병예방관리,"코로나19 대응, 학교 방역, 전염병 예방교육, 감염병 관리 지침",0.6372336149215698
1100701.20240807,20240807,세계일보,면역회피 전파력 강한 코로나 KP 3 변이 질병청 여름철 유행 패턴 반복,코로나19 코로나 질병청 미국 호흡곤란 감염병 호흡기 전파력 인천 4주 a씨 김동근 감염증 면역력 여름철,http://www.segye.com/content/html/2024/08/07/20240807507826.html,학생복지/교육격차해소,보건관리,학생및교직원보건안전관리,감염병예방관리,"코로나19 대응, 학교 방역, 전염병 예방교육, 감염병 관리 지침",0.6371972560882568
1100701.202408212,20240821,세계일보,우리처럼 힘내 학교 밖 또래에 나눔 손길,전주시 학생들 청소년들 직업전문학교 전주 수익금 제과제빵 전북 친구들 제빵조리사 자신들 조리사 관계자 윤지민 13채 궁전요리제빵미용직업전문학교 바리스타 조손 호텔제과제빵바리스타학 청소년상담복지센터 청소년 학교 지역 또래 학생 센터 이불 희망 기부 마음 교육 친구 여름 심리 어려움 심리적,http://www.segye.com/content/html/2024/08/21/20240821518410.html,기본적교육활동,창의적체험활동,봉사활동,봉사캠페인,"학생 봉사활동, 사회공헌 캠페인, 학교 내 봉사 문화, 지역사회 기여",0.6371514797210693
1100301.20240822,20240822,내일신문,미래의 직업까지 고려해 입시상담을 하는 하늘높이 컨설팅,전문가 세특관리 대명프라자 학생들 하늘높이컨설팅 1등급 중계동 입시상담 고등학교 수시지원 재학생 학종 일반고 영수학원 이중전공 부모님 원진서 세특 네이버 아이들 인강 직업관련성 수학선행 가능성 카톡 순공시간 학부모님 대학교 6개 선행학습,https://www.naeil.com/news/read/520712?ref=bigkinds,기본적교육활동,창의적체험활동,진로활동,진로상담활동,"진로 상담, 진로 멘토링, 학생 진로 설계 지도, 진로코칭 프로그램",0.6368597745895386
1100301.202408171,20240817,내일신문,수능과 내신 수학 공부의 차이점을 인지하고 공부하자,모의고사 유형서 부교재 문항들 문제들 프린트물 공부량 이성현 시간date 응용력 정답률 30번 약점보완 일산 출제자 고정적 유형들 1등급 백마학원 회독 22번 고득점 학부모님 학생들 문제집 학부모 신유형 불상사,https://www.naeil.com/news/read/520271?ref=bigkinds,기본적교육활동,교과활동,수학교과활동,수학교과운영,"수학 수업, 수학 보충수업, 수학 창의력 프로그램, 수학 체험활동",0.6368580460548401
1100901.202408141,20240814,중앙일보,전국 초등 1학년 28만명 방과 후 늘봄학교 간다 대기 제로,늘봄학교 1학년 늘봄 2학기 교육부 교육청 3만 1만 신청자 28만 드론 원도심,https://www.joongang.co.kr/article/25270654,선택적교육활동,방과후학교운영,늘봄학교운영,늘봄학교(교실)운영,"늘봄학교 운영, 돌봄교실 확장, 온종일 교육체계, 학교 중심 돌봄",0.6367339491844177
1100611.20240828,20240828,서울신문,한국공학대학교 1학년 이수 후 원하는 전공 100 선택,모집단위 학생부종합 이수 우수자 학생부 재직자 만큼 모집인원 내년도 학생부교과 공학부 단과대 융복합 자유전공학부 2등급 고졸재직자 4등급 1등급 계약학과 한국공대 관련도 경쟁률 단과대학 정원내,http://www.seoul.co.kr/news/newsView.php?id=20240828036004,교육활동지원,교무업무운영,교무학사운영,입학전형,"학교 입학전형, 입학전형 관리, 전형 일정 공고",0.6366140842437744
1100301.202408081,20240808,내일신문,교육기고 개정 교육과정에 맞춘 고등학교 수학의 준비,공통수학 교육과정 1학년 공통수학1 만큼 선행학습 고등학교 이현진 방정식 공통수학2 미적분 신입생 변별력 중3 고1 상대평가 절대평가 3학년 선택과목 수학2,https://www.naeil.com/news/read/519522?ref=bigkinds,기본적교육활동,교과활동,수학교과활동,수학교과운영,"수학 수업, 수학 보충수업, 수학 창의력 프로그램, 수학 체험활동",0.6365058422088623
1101001.202408241,20240824,한겨레,지금 한국은 팔 다리 다치면 안 되는 곳 의료체계 시한폭탄,서울 남궁 응급실 권역응급의료센터 코로나 코로나19 이화여대목동병원 권역응급센터 격리실 의료진 번아웃 뺑뺑이 중환자 당직표 집단사직 시한폭탄 우리나라 부천 300병상 구급차 종합병원 뺑뺑 의료공백 상급종합병원 페이스북 의료기관 팔다리 의료체계 경기도,http://www.hani.co.kr/arti/society/society_general/1155142.html,학생복지/교육격차해소,보건관리,학생및교직원보건안전관리,감염병예방관리,"코로나19 대응, 학교 방역, 전염병 예방교육, 감염병 관리 지침",0.6360713839530945
1100901.202408091,20240809,중앙일보,인사 중앙대학교,팀장 대학원 서울 생활관장 다빈치 김현노 윤준구 이지성 하관용 오동훈 신중범 박영수 이규 권영재 이상국 최문용 양승일 김동완 김진식 김태석 이철교 김태암 송수근 이주호 이현경 조동규 나창훈 신재영 기획처 장수영,https://www.joongang.co.kr/article/25269590,교육활동지원,교무업무운영,교무학사운영,교무학사운영,"학사 운영, 교육행정 운영, 학교 일정 관리",0.6359143257141113
1101001.202408071,20240807,한겨레,내년 초등교사 4245명 뽑는다 늘봄학교 시행에 선발 규모 확대,교육부 울산 인천 선발인원 전남 사전예고 늘봄학교 충북 경남 부산 서울 전북 경북 충남 교육청 늘봄지원실장 광주 강원 세종 대구 제주,http://www.hani.co.kr/arti/society/schooling/1152615.html,선택적교육활동,방과후학교운영,늘봄학교운영,늘봄학교(교실)운영,"늘봄학교 운영, 돌봄교실 확장, 온종일 교육체계, 학교 중심 돌봄",0.6358884572982788
1101001.202408191,20240819,한겨레,2025학년도 수능 22일부터 응시 원서접수,접수처 온라인 원서접수 수형자 주소지 고등학교 학년도 교육부 수수료 졸업생 복무자 지원청 교육지원청 사전입력,http://www.hani.co.kr/arti/society/schooling/1154267.html,교육활동지원,교무업무운영,교무학사운영,입학전형,"학교 입학전형, 입학전형 관리, 전형 일정 공고",0.6357883214950562
1100301.202408091,20240809,내일신문,청소년 발명 축제 열려,윤규빈 대전컨벤션센터 이만재 발명품 교원발명품경진대회 1학년 대한민국학생발명전시회 김완기 대통령상 대한민국 낙원중 집중호우 전시회 특허청장 방지 학생 발명 뚜껑 수상 이탈 청소년 페스티벌 축제 교원 경진 왼쪽 대회 진행 사진 낙원 집중 금상 맨홀 호우 출품 이용 수압 인명,https://www.naeil.com/news/read/519603?ref=bigkinds,선택적교육활동,기타선택적교육활동,창의교육운영,발명교실운영,"발명교육, 창의력 개발, 메이커 교육, 발명 아이디어 교실",0.6355494856834412
1100611.202408201,20240820,서울신문,영유아 학교 미리보기 9월부터 152곳 유보통합 시범운영,유치원 어린이집 영유아 유보통합 시범학교 교육부 통합기관 학부모,http://www.seoul.co.kr/news/newsView.php?id=20240820500086,교육활동지원,연구학교운영,연구학교운영,시도교육청지정,"교육청 지정 연구학교, 시도교육청 시범학교",0.6354174017906189
1101001.202408192,20240819,한겨레,고교평준화 폐지 등 힘 실으려 국교위서 짬짜미 의혹,국교위 고교평준화 국가교육발전계획 고등학교 위원장 자격신설 교육부 전문위 사립학교 위원회 평준화 절대평가 상대평가 교육전문대학원 위원들 전문위원 대외비 관계자 자주성,http://www.hani.co.kr/arti/society/schooling/1154390.html,학교일반운영,학교운영협력,학교운영위원회운영,학교운영위원회운영,"학교운영위 운영, 학교 의사결정 기구, 학부모 참여 위원회",0.6347560286521912
1100701.202408081,20240808,세계일보,학교급식 식단에 아열대 채소 오른다,아열대 농업기술원 영양사 충남 기술원 레시피 우리나라 국공립학교 조리법 충남도 영양소 연구사 하계직무연수 유재호 서원대 영양성분,http://www.segye.com/content/html/2024/08/08/20240808518364.html,학생복지/교육격차해소,급식관리,학교급식운영,급식재료구입비,"학교 급식, 급식 질, 친환경 식자재, 학교 식단",0.6345918774604797
1100701.202408121,20240812,세계일보,부산시 학교 밖 청소년 진로 진학박람회 개최,박람회 부산시 꿈드림센터 부산 입시설명회 일대일 부스 학부모 부산시청 설명회 동서대 고신대,http://www.segye.com/content/html/2024/08/12/20240812507824.html,기본적교육활동,창의적체험활동,진로활동,진로상담활동,"진로 상담, 진로 멘토링, 학생 진로 설계 지도, 진로코칭 프로그램",0.634588360786438
1100701.202408281,20240828,세계일보,올해 학생 교사 딥페이크 피해 196건 교육부 전담 TF 꾸려 대응한다,딥페이크 교육부 피해자 성범죄 성희롱 196건 용산 경찰청 자문단 전문가 예방교육,http://www.segye.com/content/html/2024/08/28/20240828512669.html,인적자원운용,교직원복지및역량강화,교직원복지,성폭력피해자지원,"교내 성폭력 피해자 보호, 교사 성희롱 대응, 성폭력 상담 지원, 피해 교원 지원 제도",0.6344034671783447
1101001.202408081,20240808,한겨레,전문대학 수시모집 정보 궁금하다면 프로칼리지 접속하세요,전문대학 자료집 학년도 학부모 프로칼리지 업로드 배상기 전문대교협 일람표 게시판 남성희 대구보건대학교 수험생 자료실 진학정보자료실,http://www.hani.co.kr/arti/society/schooling/1152779.html,교육활동지원,교무업무운영,교무학사운영,입학전형,"학교 입학전형, 입학전형 관리, 전형 일정 공고",0.6342799663543701
1100701.202408301,20240830,세계일보,코로나19 입원환자 20 1 감소 질병청 정점 지나고 있다,코로나19 표본감시 감염증 감소세 질병청 질병관리청 42곳 병원체 검출률 기침예절 대규모 20만,http://www.segye.com/content/html/2024/08/30/20240830509087.html,학생복지/교육격차해소,보건관리,학생및교직원보건안전관리,감염병예방관리,"코로나19 대응, 학교 방역, 전염병 예방교육, 감염병 관리 지침",0.6342595815658569
1100301.202408032,20240803,내일신문,을지대 고교생 대상 자기주도 프로젝트 공유학교 성료,을지대 고교생 공유학교 김명철 보건의료특성화 광주 경기도 시간date 을지대학교 홍성희 물리치료학과 하남 치료학과 성료 고등학교 물리치료 입학관리처장 공학부 강좌별 진로탐색 안전교육 간호학과,https://www.naeil.com/news/read/518956?ref=bigkinds,학교일반운영,학교운영협력,관계기관협력,주민참여학교운영,"주민 참여 학교, 지역 개방형 학교, 학교 공동체 운영",0.6341375708580017
1100751.202408251,20240825,아시아투데이,보건노조 파업 예고 복지부 진료 차질없게 할 것,간호사 응급실 복지부 시범사업 내원 의료기관 대한간호협회 사업장 코로나 지자체 대학병원 2만,https://www.asiatoday.co.kr/view.php?key=20240826010013463,학생복지/교육격차해소,보건관리,학생및교직원보건안전관리,감염병예방관리,"코로나19 대응, 학교 방역, 전염병 예방교육, 감염병 관리 지침",0.6340748071670532
1100751.20240804,20240804,아시아투데이,전북에듀페이 교육활동 지원 학부모 부담 경감 효과,전북에듀페이 가맹점 전북교육청 사용처 문구점 영화관 교육비 학부모 바우처 윤복진 독서실 모니터링단 아시아투데이 학생들 3학년 고2 안경점 13만 자치도 중2 전북 교복점 스포츠활동 여름방학,https://www.asiatoday.co.kr/view.php?key=20240804010001418,학교일반운영,학교운영협력,학부모협력,학부모회운영비,"학부모회 운영, 학교-가정 협력, 학부모회 예산",0.6339117884635925
1100901.202408281,20240828,중앙일보,세종사이버대 대학발전방안 아이디어 공모전 시상식,교직원 공모전 시상식 세종사이버대 참가자 전혜린 학습자 우수상 세종사이버대학교 교육부 장려상 이은경 무방관 신구 교직원들 비전임교원 비전임 메타버스 ai 참가자들 30만,https://www.joongang.co.kr/article/25273695,인적자원운용,교직원복지및역량강화,교직원복지,교직원포상,"우수 교사 포상, 교원 격려, 교직원 사기 진작, 교육 공로상",0.633415937423706
1100611.202408261,20240826,서울신문,경북도교육청 학생 아침 간편식 제공한다,간편식 학부모 경산 위원장 자부담 4개 시범사업 안동 경북도의회 아이들 박채아 간담회 경산지역 한부모 3개월 수익자 전북 김상화 국민의힘 전남 저소득층 집중력 서울 선거구 교육위원장 학부모들,http://www.seoul.co.kr/news/newsView.php?id=20240826500042,학생복지/교육격차해소,급식관리,학교급식운영,비조리교급식비,"간편 급식, 비조리 급식, 신선식품 공급, 간식형 급식",0.6333929300308228
1100401.20240829,20240829,동아일보,계명문화대학교 글로컬 직업교육 선도대학으로 발돋움,전문대학 글로컬 계명문화대 영국 운영기관 아세안 선도대학 런던 학생들 혁신지원사업 국제협력단 직업인 미국 호주 1인 한국 여름방학 본격화 계명컬처 계명컬처센터,https://www.donga.com/news/Society/article/all/20240828/126709301/2,선택적교육활동,직업교육,직업교육운영,직업교육운영,"직업교육, 진로직업 교육, 기술교육 강화, 실무형 인재 양성",0.6333885192871094
1100301.202408012,20240801,내일신문,덕성여대 강북구 고교 지역사회 연계 진로교육과정 운영,덕성여대 강북구 학생들 조효선 교육과정 약학대학 mutation 마이크로나노 이수 고등학교 산학협력단 협력단 산업체 체험활동 제형,https://www.naeil.com/news/read/518792?ref=bigkinds,기본적교육활동,교과활동,교과활동지원,공동교육과정운영,"고교 공동교육과정, 학교 간 교육과정 공유, 맞춤형 수업 운영, 교육과정 다양화",0.6331338286399841
1100701.202408141,20240814,세계일보,강원도교육청 춘천경찰서와 특이민원 대응 모의훈련 실시,특이민원 민원인 민원실 강원교육청 강원도교육청 모의훈련 강원 교육청 춘천경찰서 박기현 비상벨 신사우파출소 자치도 총무과장 상급자 강원특별자치도교육청 대응 훈련 유도 상황 보호 민원 안전 인계 폭언 진정 제공,http://www.segye.com/content/html/2024/08/14/20240814507710.html,교육활동지원,생활지도운영,학생안전교육,재난대응훈련,"재난 대응 훈련, 재난 모의훈련, 비상대피훈련",0.6331067085266113
1100751.202408301,20240830,아시아투데이,대학생 학자금 대출 44만명 8 증가,학자금 적립금 교육비 학자금대출 이용자 사립대 44만 장학금 icl 재학생 원리금 박지숙 아시아투데이 1인 5만 한국대학교육협의회,https://www.asiatoday.co.kr/view.php?key=20240830010017166,학생복지/교육격차해소,학생복지,학생장학금운영,학생장학금지원,"장학금 지급, 학생 장학 제도, 교육비 지원, 장학생 선발 공고",0.633090078830719
1100611.20240809,20240809,서울신문,단독 올여름 코로나 재유행 조짐 치료제 품귀 예산도 부족,치료제 코로나19 팍스로비드 질병관리청 관리청 환자들 고위험군 관계자 라게브리오 대유행 길병원 고령층 60세 세종 코로나 엄중식 심혈관계,http://www.seoul.co.kr/news/newsView.php?id=20240809009006,학생복지/교육격차해소,보건관리,학생및교직원보건안전관리,감염병예방관리,"코로나19 대응, 학교 방역, 전염병 예방교육, 감염병 관리 지침",0.6325839757919312
